question,truthValue,snippet,description,results
mammal that considered more le hairless include walrus whale naked mole rat pig elephant rhinoceros hippopotamus .,True,,05.03.2021 mammal that considered more le hairless include walrus whale naked mole rat pig elephant rhinoceros ... all mammal have hair sometimes evolved appear naked . cetacean african elephant walrus hairless dog sphynx skinny pig naked mole-rat.trichocare - did know facebookhttps//m.facebook.com ... trichocare videohttps//m.facebook.com ... trichocare video19.12.2003 beard may have been considered disadvantage hand-to-hand combat ... hippopotamus walrus whale naked mole rats.11.03.2021 body hair is defining mammalian characteristic several mammal such whale naked mole-rats human have notably le hair ... pdf von m pagel 2003 zitiert von 139 von m pagel 2003 zitiert von 139 extant mammal only other effectively hairless specie elephant rhinoceros hippopotamus walrus pig whale naked mole-rats ... alexander sanger 2005 history ... more than 5000 mammal virtually hairless elephant rhinoceros hippopotamus pig walrus whale naked mole rat.it is found on all mammal on no other animal denton 1986. even `` hairless '' mammal including pig elephant hippopotamus rhinoceros whale ... mammal from latin mamma 'breast ' group vertebrate animal constituting class ... around 6400 extant specie mammal have been described divided ...,177000.0
olympics held every 3 year,False,olympic game considered world 's foremost sport competition with more than 200 nation participating . olympic game normally held every four year since 1994 ha alternated between summer winter olympics every two year during four-year period . olympic game considered world 's foremost sport competition with more than 200 nation participating . olympic game normally held every four year since 1994 ha alternated between summer winter olympics every two year during four-year period .,respect ancient origin olympic game which were held every four year olympia . four-year interval between ancient game edition ... 18 jul 2021 olympic game held every four respect ancient origin olympic game which were held every four year olympia.25 mar 2020 history olympics go back 3000 year peloponnese ancient greece . history olympics event is held every four ... 23 jul 2021 some took place every two year some every four year . olympic game held olympia greece honor zeus became most important.the summer olympics have almost always been held northern hemisphere except for 3 time twice australia once brazil where it winter during ... 0 vote because ancient olympics greece were every 4 year it modelled on that.22 feb 2014 four year is long time top-level athletics it 's very difficult for some competitor make multiple olympic team let alone remain ... 15 jul 2022 all game held throughout greece olympic game were most famous . held every four year between august 6 september 19 ... olympics guide reference source main reading room researcher reference service ... july 19-august 3 1980 los angeles california usa,145000000.0
bull feature on porsche logo,False,,brand wa established 1931 ferdinand porsche company 's logo is based on coat arm free people 's state wrttemberg former weimar germany since car were produced stuttgart it coat arm with black stallion on yellow background wa also placed middle ... brand wa established 1931 ferdinand porsche company 's logo is based on coat arm free people 's state wrttemberg former weimar germany since car were produced stuttgart it coat arm with black stallion on yellow background wa also placed middle ... 2018/09/24 porsche logo symbolizes luxury power . learn more about porsche logo meaning today courtesy team porsche fremont ! 2022/04/29 featuring green coiled serpent with man it mouth red cross represent italian city milan alfa romeo logo is ... image feature set four red four black stripe on golden background with porsche horse it own separate shield . 's also series ... 2021/05/23 lamborghini logo comprises corporate coat arm golden snorting bull symbol inside it . though inspiration lamborghini 's ... 2020/10/20 porsche logo wa introduced u.s. market 1952. it did n't take long for emblem recognized symbol luxury . relive ... 2021/12/21 9 is ferrari italian car 10 what sport car ha horse logo 11 what ferrari fan calledthere two reason for use bull lamborghini logo . ... both logo feature animal although ferrari logo is horse not bull.2022/01/29 reference stuttgart porsche logo feature black horse centerpiece for it design alluding fact that porsche ...,9340000.0
new york ha nickname big pear,False,,more from brighttrip - facebookhttps//m.facebook.com ... brighttrip videoshttps//m.facebook.com ... brighttrip videosthe big apple - nyc 's famous nickname explained - youtubehttps//www.youtube.com watchhttps//www.youtube.com watchmar 11 2015 big apple nickname for new york city really take hold 1920s jazz era . term already popular meaning betting on ... jul 23 2014 it happens long before new york city wa nicknamed big apple it wa known briefly new orange . 1673 dutch captured new york ... unofficial nickname listed here have been use for long time have gained wide currency . nickname city ... new york . doe n't love big apple worldstrides certainly doe ! ... new york 19th century that shell were used pave pearl street.throughout it history term `` big apple '' ha always come down simply mean best biggest place new york city ha long lived up ... u. p. hedrick 2019 fictionwaxbirn that is wax pear big-bellied lower end ... have yellow wax-like color whence name ha been given ...,14500000.0
maximum length for video posted on tiktok is 45 second,False,,first tiktok video could only up 15 second long company recently extended limit 60 second string 4 15-second segment together . however only applies video recorded natively on app . upload video that wa created elsewhere it can longer than 60 second . first tiktok video could only up 15 second long company recently extended limit 60 second string 4 15-second segment together . however only applies video recorded natively on app . upload video that wa created elsewhere it can longer than 60 seconds.2022/02/28 tiktok is starting roll out ability for user upload video up 10 minute length company confirmed techcrunch.2021/07/07 week social medium news tiktok increase it video length limit from 60 second three minute snapchat share insight on it ... 2021/07/02 since it launched 2018 tiktok ha limited it user 60 second per video setting it apart from competitor like youtube . app say ... 2022/06/01 tiktok first launched video could only maximum 15 second . later on it became possible create one-minute tiktoks ... 2022/04/13 topic postcontent piece such workout tutorial political commentary explainer video require more time over 30 second ... 2022/05/26 although tiktok is platform that tends favor short viral video tiktok ha slowly been increasing maximum length video can ... karen e. sutherland 2020 business economics16.5 ongoing social medium video debate 16.4 social medium platform supporting ... maximum length 8 hour twitter recorded 45 second live not stated.2022/03/02 original limit on tiktok video wa 15 second . seems fit line with short-form video apps generally mature . apps like vine ... 2022/02/28 tiktok is again expanding maximum length video user can upload platform -- more than tripling it 10 minute .,16100000.0
atlantic ocean is world biggest ocean,False,covering approximately 20 percent earth 's surface atlantic ocean is second largest ocean basin world following only pacific . however it is only slightly larger than half size pacific ocean . covering approximately 20 percent earth 's surface atlantic ocean is second largest ocean basin world following only pacific . however it is only slightly larger than half size pacific ocean . 26 feb 2021,26 feb 2021 pacific ocean is largest deepest world ocean basins.the atlantic ocean is second-largest ocean on earth accounting for one fifth earth 's surface 29 earth 's water . united state is le ... 4 jun 2010 pacific ocean is largest body water on earth . located between southern ocean asia australia landmass western ... 1 jun 2022 pacific ocean is largest ocean world taking up much area atlantic ocean indian ocean combined.the largest ocean world - pacific ocean - is ten time bigger than smallest one - arctic ocean . pacific ocean got it name from ferno de ... 7 jun 2022 yes largest ocean basin is far pacific ocean . it stretch from western coast north south america oceania asia ... world ocean day-5 largest ocean world 1. pacific ocean pacific ocean 2. atlantic ocean atlantic ocean 3. indian ocean indian ocean 4. southern ...,90000000.0
eczema is not skin disease . true false,False,skin is dry itchy red might have eczema atopic dermatitis . it 's common skin condition that is n't contagious . 're high risk have asthma allergy . treatment that manage symptom 's no cure . skin is dry itchy red might have eczema atopic dermatitis . it 's common skin condition that is n't contagious . 're high risk have asthma allergy . treatment that manage symptom 's no cure . 28 oct 2020,eczema-prone skin is allergic condition . ... true . mean that it is due overreaction immune system presence allergen such mite ... 13 apr 2021 lot health condition can look like eczema which can make skin irritated inflamed itchy . here 's spot difference ... 6 may 2021 1. myth eczema is contagious ... point-blank that 's simply not true . it 's genetic condition is not contagious say charles e.atopic dermatitis also known eczema is non-contagious inflammatory skin condition . it is chronic disease characterized dry itchy skin that can ... 7 jul 2017 it 's just skin problem . it 's no big deal . ... another misperception is that it 's not serious said yamauchi . that 's not true because people ... 24 apr 2018 qeczema also atopic eczema atopic dermatitis is general term for type skin inflammation . true false ... atrue . word eczema ... 5 day ago eczema is general term for rash-like skin condition . most common type eczema is called atopic dermatitis which is caused ... dermatitis is inflammation skin . term dermatitis is synonymous with eczema.atopic dermatitis eczema is chronic inherited inflammatory skin condition with symptom including area dry itching reddened skin . eczema is not ...,60500000.0
two number on opposite side dice added together result is always 7,True,for six-sided die opposite face arranged always sum seven . give two possible mirror image arrangement which number 1 2 3 may arranged clockwise counterclockwise order about corner . commercial dice may fact have either orientation . for six-sided die opposite face arranged always sum seven . give two possible mirror image arrangement which number 1 2 3 may arranged clockwise counterclockwise order about corner . commercial dice may fact have either orientation .,02-aug-2018 opposite side die traditionally add up seven implying that 1 2 3 face share vertex . face die may placed clockwise ... q. dice cube with dot on each face . opposite face die always have total seven dot on . here ... must opposite face dice always add up 7 1/62/53/4 would it make any difference did n't ... design whole is provide randomly ... 13-mar-2022 all opposite side die meant add up 7. 1 6 2 5 3 4 is also part most common dice roll involving ... 1 answer using fact that opposite side face dice always add upto 7 we can say that casea is true net dice . wa answer helpful06-dec-2020 dice come many shape have different arrangement number . some do n't have number all . is nothing that opposite side ... bob longe 1998 juvenile nonfictionso number showing on dice 3 6 2 . ... since opposite side die always total 7 hugo ha added 7 total shown on die 7 + ... nicholas einhorn 2012 juvenile nonfictionwhile magician 's back is turned two dice rolled number time ... that two number on opposite side any die always add up 4 7 .,4610000.0
australia is country well continent,True,,situated geographical region oceania australia is smallest seven traditional continent . australia . australia-new guinea orthographic ... 2 jul 2018 australia is considered continent because it is very large contiguous land mass just north america south america antarctica africa asia ... australia is one most bio-geographically diverse region world . it is oldest continental landmass on earth . located oceania region ... 15 feb 2018 many case will regularly see continent australia defined australia/oceania . fundamentally australia itself is both ... encyclopdia britannica inc. about 3 million square mile 7.7 million square km australia is smallest continent on earth . fact it 's closer ... australia/new zealand sometimes referred australasia . australia is known smallest continent on earth . country ha area 7692000 km ...,45500000.0
scallop have close 100 simple eye said blue hue,True,have ever wondered what color scallop 's eye scallop often have 100-200 simple eye for most part blue . yes that 's right blue dot photo fact eye . we 're little creeped out ! have ever wondered what color scallop 's eye scallop often have 100-200 simple eye for most part blue . yes that 's right blue dot photo fact eye . we 're little creeped out !,8 apr 2016 scallop have up 100 eye ! eye rely on concave parabolic mirror guanine crystal instead lens like other animal ... 6 may 2019 scallop eye scallop can have up 200 eye although scientist still do n't know exactly all work together help mollusk ... 30 nov 2017 each scallop eye is built something like gigantic telescope that peer deep space researcher reported on thursday.the bay scallop pecten irradians ha many strikingly blue eye . each scallop usually ha between 40 60 eyes.30 nov 2017 30 nov 2017 look full living scallop 'll see very different animal . that animal will looking right back using dozen eye ... missing 100 100magellanicus 28. however eye colour varies beyond blue black scallop some specie like saucer scallop amusium balloti have brown eye 24 ... scallop may look like simple creature seafood delicacy ha 200 eye that function remarkably like telescope using living mirror focus light ...,1340000.0
penguin considered flightless bird .,True,,no list flightless bird would complete without penguin . all 18 specie penguin unable fly fact better built for swimming diving which spend majority time doing . short leg stocky build give distinctive waddling walk . no list flightless bird would complete without penguin . all 18 specie penguin unable fly fact better built for swimming diving which spend majority time doing . short leg stocky build give distinctive waddling walk.flightless bird bird that through evolution lost ability fly . over 60 extant specie including well known ratite penguins.also flightless unrelated ratite penguin order sphenisciformes . several extinct form such dodo known from historical record ... however penguin classified bird aves zoological term . black white flightless seabird family spheniscidae which ... 16 jan. 2022 penguin . all penguin flightless . rail . * calayan rail gallirallus calayanensis * drummer rail ... flightless flightless bird that can not sustain flapping aerial flight ... it is thought that many flightless bird evolved trait ... yes penguin bird although flightless bird . ... other bird that ca n't fly like emu ostrich cassowary and.1 apr . 2009 well sense really do fly only through water not through air . penguin have strong wing strong pectoral muscle ... ostrich chicken emperor penguin humboldt penguin galapagos rail bird galapagos cormorant emu kiwi.i thought answer could use visual aid penguin have feather wing although do n't work anymore for flight neither do wing ...,5.0
longest strongest bone human body is thighbone .,True,1. femur bone is longest strongest bone body . located thigh it span hip knee joint help maintain upright posture supporting skeleton . 2 . 1. femur bone is longest strongest bone body . located thigh it span hip knee joint help maintain upright posture supporting skeleton . 2 .,g noussios 2019 cited 1 femur is one most well-described bone human skeleton field ranging from clinical anatomy forensic medicine . because it is longest ... 11 mar 2022 femur is thigh bone . it 's longest strongest bone body . it 's critical part ability stand move . femur ... 1. femur thighbone 19.9 2. tibia shinbone 16.9 3. fibula lower leg 15.9 4. humerus upper arm 14.4.18 apr 2018 femur is longest bone found human body . it is almost 19.9 inch long is commonly known thigh bone.the femur run from keen hip . it carry all upper body weight . other part leg tibia femur fibula keep cap also ... 3 oct 2017 femur thigh bone is longest heaviest strongest bone entire human body . all body 's weight is supported ... 1 apr 2020 thigh bone is called femur not only is it strongest bone body it is also longest . because femur is strong ... head femur articulates with acetabulum pelvic bone forming hip joint while distal part femur articulates with tibia ...,313000.0
moon is wider than australia,False,australia 's diameter is 600km wider than moon 's . moon sits 3400km diameter while australia 's diameter from east west is almost 4000km . australia 's diameter is 600km wider than moon 's . moon sits 3400km diameter while australia 's diameter from east west is almost 4000km .,jun 5 2018 moon is about wide australia it is actually much bigger think term surface area . it turn out surface moon is much larger than ... jul 19 2019 that 's just one way looking thing . although moon is about wide australia it is actually much bigger think ... dec 16 2016 1 australia is wider than moon ... add one moreyouknow file australia 's diameter is 600km wider than moon 's . moon sits ... may 25 2022 australia is wider moon ! moon is 3400km diameter australia is almost 4000km . r/ ... random fact australia is wider than moon ! apr 26 2021 955am . taken on november 14 2016. not sure got use measuring tape measure ... '' australia is wider than moon '' 35 mind-blowing geography fact canada ha more lake than rest world combined.jul 9 2021 total area australia is 7692024 square km 2969907 sq mi total surface area moon is around 37936694.79 square km .,24600000.0
star sign aquarius is represented tiger,True,aquarius january 20 - february 18 personality according chinese zodiac tiger smart sophisticated . combing with aquarius sign western astrology tend like thinking creativity make become outstanding inventor . personality according chinese zodiac tiger smart sophisticated . combing with aquarius sign western astrology tend like thinking creativity make become outstanding inventor .,may 12 2018 aquarius tiger people always charming constantly want others ' approval sure . active competitive these ... cheerful aquarius-tiger radiates love for everything around . even just being with is happiness not mention close friendship.jan 26 2022 aquarius can both diligent surprising being ruled saturn uranus . aquarius energy is defined breaking from tradition ... aquarius born during year tiger ... tiger born during cycle aquarius represented primal astrology panther . panther more ... privacy notice governs membership influencer panel which can access here . website us cooky . like offline world cooky make ... aquarius is eleventh astrological sign zodiac originating from constellation aquarius . under tropical zodiac sun is ... conventional aquarian tiger character take on courage resilience associated animal . it also incorporates independence farsightedness ... sep 13 2019 aquarius is eleventh zodiac sign represents were born between january 20th february 18th . sign always relates ... mar 5 2021 star sign aquarius is represented tiger . true false . 1. see answer . unlocked badge showing astronaut 's boot touching down ...,3260000.0
tv series game throne tyrion lannisters favourite quote is drink know thing,True,,2019/04/08 best tyrion lannister quote like ' drink know thing ' show game throne character ha most intellect best ... 2020/04/13 1 `` that 's what do drink know thing . '' ... probably most famous tyrion lannister quote is one that inspired very list . game throneslove tyrion lannisterone best character game thronesand one my favorite charactersand best out whole ... 2022/01/27 here some great tyrion lannister quote from game throne . ... drink - know thing season 6 home . mean come on . flipkart.com buy tyrion lannister quote - game throne collection - that 's what do drink know thing - premium quality framed poster paper ... game throne that 's whats do drink know thing quote tyrion ... tyrion lannister poster that 's what do tv series quote quote poster ... 2016/05/13 tyrion lannister is possibly most beloved game throne character . ... tyrion meet jon snow series premiere ...,190000.0
sense touch is activated eye .,False,,30.12.2020 understanding perception start with five sens touch taste smell hearing sight it 's deceptively simple.19.09.2019 new research is suggesting that area cerebral cortex that activated we merely look illustration picture specific ... 06.07.2020 `` connection between eye touch reveals surprising link across perception cognition action '' add stephanie badde nyu ... 06.07.2020 work reveals connection between eye movement sense touch . fact that tiny eye movement can hinder ability ... tactile touch . touch is processed through 'tactile ' sense . tactile receptor identify sensation touch all over body skin.26.12.2019 even with my eye open touch little ball do n't feel it sawsen say . all sens touch proprioception ... von r betancourt 2016 zitiert von 9 optical pneuma flow from seat con- sciousness eye activates air adjacent eye placing it state tension stress ... 08.11.1999 result emory study confirming role visual cortex tactile perception were reported recent issue nature.learn about sense touch skin receptor anatomy nerve signal ... mechanoreceptors skin activated start chain ... von s brodoehl 2015 zitiert von 37 tactile discrimination grating orientation fmri activation pattern . hum brain mapp 25 3707 2005. article google scholar . bjork . ...,240000000.0
5+9 = 14,True,,preschool prep companywhen enosh had lived 90 year became father kenan . after became father kenan enosh lived 815 year had other son and.26 jun 2022 what 5 eye 9 eye 14 eye alliance ... five eye fvey nine eye fourteen eye state intelligence alliance ... 21 mar 2021 learn calculate what 5/9 14 is with simple step-by-step guide find fraction any number.here we will show calculate 5/9 time 14. other word what is 5/9 x 14 step-by-step instruction with solution.united state . congress . house . committee on way mean 1951 internal revenue law152 9 5 9 118 16 8 9 139 18 9 10 164 20 10 11 3 164 9 5 10 245 8 302 7 305 12 320 8 315 4 100 35 35 5 25 50 33 31 9 24 71 58 33 38 25 96 67 36 9 26 50 ...,25270000000.0
classic tv series 'starsky hutch ' two cop drove ford gran torino,True,,751 youtube usclassicmusclecars 28 jun 2019 28 jun 2019 what year is gran torino starsky hutchzebra three is radio call sign given fictional `` bay city california '' police department iconic 1970s television series starsky hutch ... code name nickname for ford gran torino that starsky owned ... 7 dec 2018 7 dec 2018 wa one character that eclipsed both police car . it wa ford gran torino it eventually became iconic that even ... 1 apr 2020 although it found fame classic 1970s tv show ford gran torino is american ... 1970s tv cool cop drove cool cars.1 aug 2020 movie wa based off starsky hutch television series ... street-savvy cop drove chevrolet camaro convertible ford 's ... although memorable for it chase scene bromance breakout star is cop ' custom-painted ford gran torino . tv show . 1975 gran torino - starsky ...,35500.0
bat blind,False,,contrary what most people believe bat generally not blind all fact believed have eyesight keener than that most human . ... sep 6 2016 contrary myth bat n't blind . fact research show that depending on circumstance bat sometimes prefer using eyesight ... apr 9 2013 bat not blind can fact see quite well using eye . while most bat do have advanced ear that give form vision ... many people mistakenly believe that bat blind because fly about erratically while hunting which give impression can not see where ... jul 30 2020 anyone 's ever told 're blind bat it is n't much criticism eyesight . that 's because although saying is ... despite famous idiom bat n't blind . all bat rely on sight find food avoid predator navigate from roosts.feb 18 2020 it 's safe say that bat certainly n't blind . combination echolocation vision specially tuned dawn dusk give ... sep 21 2021 no bat not blind . reality is that bat can see quite well just not same way human . most bat hunt dim dark ...,62700000.0
pluto is pet dog mickey mouse,True,,pluto is mickey mouse 's pet dog . unlike goofy is not anthropomorphic dog . is fact only member sensational six that behaves like ... after chain gang pluto popped up rightful role household pet picnic 1930but wa named rover belonged not mickey minnie ... sep 26 2014 perhaps pluto 's time dog is due fact that ha owner mickey ha been unable evolve while goofy may have never had ... feb 17 2021 pluto is mickey 's pet . just like many have pet dog home mickey doe well . dog man 's best friend can mouse 's ... is mickey mouse 's pet . officially mixed-breed dog made debut bloodhound mickey mouse cartoon chain gang . together with mickey mouse ... mar 19 2015 pluto big goofy dog disney fame is old guessed right said 85 year old . walt disney production created pluto pup ...,1380000.0
