question,truthValue,snippet,description,results
waterloo ha greatest number tube platform london,True,,2020 it is 5th busiest station on london underground with 16.62 million user . it is served four line bakerloo jubilee northern ... 20 de mai . de 2016 2. it 's biggest . fact it ha more platform greater floor area than any other station uk . sign clapham junction ... 30 de jun . de 2016 waterloo ha 19 platform serviced mainly local suburban train ... known waterloo tube station is managed london underground.many others have platform only accessed step lift . russell square is one few deep level central london tube station with only step ... waterloo is britain 's largest busiest station . london waterloo ha always been place for important arrival departure whether city commuter ... waterloo ha 24 terminal platform use making it biggest station uk term platform number . station is managed network rail ... with it 24 platform track london waterloo is uk 's largest station it 's terminus station access from train is ... waterloo is busiest railway station uk with nearly hundred million ... station term floor space ha greatest number platforms.24 de mai . de 2020 familiar station for many commuter from across surrey london waterloo ... is also waterloo southwark london underground ...,1310000.0
confucius is world-renowned latin philosopher,False,,traduzir esta pgina confucius wa chinese philosopher politician spring autumn period is traditionally considered paragon chinese sage . confucius 's ... de t dijkstra 2021 through jesuit translation confucius wa according one scholar world 's 'first philosopher become famous outside ... confucius 552479 bce known chinese kong qiu also styled zhongni preeminent chinese philosopher teacher . name confucius is latin ... 371 ancient state zou chinadied c. 289 bce china early chinese philosopher whose development orthodox confucianism earned title second sage ... like many great figure cultural history world ... man we now call confucius wa fact known family name kong ... 13 de dez . de 1995 do really know man called some people one world 's greatest philosopher others messiah true wisdomwilliam j. duiker jackson j. spielvogel 2016 historyone most famous manual used for purpose wa yi jing ... confucius 's interest philosophy wa essentially political ethical.william j. duiker jackson j. spielvogel 2016 historyone most famous manual used for purpose wa yi jing ... confucius 's interest philosophy wa essentially political ethical.thierry meynard 2015 philosophyintroduction very name confucius 551479 bc is constant reminder that foremost sage china wa first known west through latin ...,409000.0
14 bone human foot,False,,each foot is made up 26 bone 30 joint more than 100 muscle tendon ligament all which work together provide support balance mobility . each foot is made up 26 bone 30 joint more than 100 muscle tendon ligament all which work together provide support balance mobility.20 de jan. de 2018 26 bone foot consist eight distinct type including tarsal metatarsal phalanx cuneiform talus navicular ... bone joint foot is comprised 28 bone figure 1. where two bone meet joint is formed often supported strong ligaments.225 youtube neural academy 2 de nov. de 2018 2 de nov. de 201831 de jan. de 2019 human foot consists 26 bone . these bone fall three group tarsal bone metatarsal bone phalanges.11 de dez . de 2015 about 26 bone human foot provide structural support . can grouped 3 part follows tarsal bone 7.recently more accurate simulation human character ha been developed based on anatomical structure 9 10 11 12 13 14 15 16 17 18 19.fig 1.0 overview bone human foot . ... distal row four tarsal bone cuboid three cuneiforms.27 de ago . de 2019 tarsal 7 irregularly-shaped bone which situated proximally foot ankle area . metatarsal 5 bone which connect ...,42900000.0
walt disney hold record for most oscar,True,film producer disney hold record for most academy award earned individual having won 22 oscar from 59 nomination . wa presented with two golden globe special achievement award emmy award among other honor . film producer disney hold record for most academy award earned individual having won 22 oscar from 59 nomination . wa presented with two golden globe special achievement award emmy award among other honor .,walt disney 19011966 won received total twenty-six academy award hold record for most academy award history.feb 14 2018 out all nominee academy award history walt disney hold most oscar . disney won 26 oscar over course career wa ... walt disney 190166 won received total twenty-six academy award hold record for most academy award history.walt disney usa received total 64 nomination during career last which won posthumously 1969 for winnie pooh blustery ... disney hold record for most academy award won individual film producer having won 22 oscar from 59 nomination . addition receiving two ... mar 18 2022 with 59 nod walt disney hold record for most oscar nomination . ha second-most with 52walt disney hold record with 59 oscar nomination . ha 2nd most nomination komo staff . wednesday february 24th 2016. userway icon for ...,2710000.0
first football world wa manufactured from pig bladder,True,,oldest football ever found wa made 1540s . it consists pig bladder covered with piece leather possibly from deer . it wa found 1981 stirling castle scotland . course it wa n't always most pleasant task blow up pig bladder use football . oldest football ever found wa made 1540s . it consists pig bladder covered with piece leather possibly from deer . it wa found 1981 stirling castle scotland . course it wa n't always most pleasant task blow up pig bladder use football.5 de ago . de 2000 first properly made ball wa simply pig sheep 's bladder inflated good old fashioned lung power knotted end.31 de jan. de 2014 fact pigskin were originally made out animal bladderssometimes bladder pig which is thought moniker ... 25 de jun . de 2022 football were never made out pig skin . early football were made from animal bladder including from cow deer sometimes ... 20 de dez . de 2019 inflatable rubber bladder wa first made 1862 is credited richard lindon . lindon 's wife died lung disease relatively young ... pig bladder were good supply day were durable . however were not shape typical american football more like soccer ... 19 de dez . de 2013 ... victorian football which wa made primarily from - pig 's bladder . ... that first ball were made entirely from pig 's bladder.made pig 's bladder it would not otherwise have survived . next oldest scottish football according national museum is 18th century date.the first ball were made natural material such inflated pig bladder later put inside leather cover which ha given rise american ...,5760000.0
patient with covid-19 may use ibuprofen aspirin naproxen anti-inflammatory medication,True,,19 mar 2020 fda is aware news report stating use non-steroidal anti-inflammatory drug nsaid such ibuprofen could worsen coronavirus ... av lca esba 2021 citerat av 56 aim study wa ass association acute chronic use nonsteroidal anti-inflammatory drug nsaid with worse covid-19 ... 19 apr . 2020 nsaid include nonselective cyclooxygenase cox inhibitor such ibuprofen aspirin acetylsalicylate diclofenac naproxen well ... av jt reese 2022 citerat av 5 non-steroidal anti-inflammatory drug nsaid commonly used reduce pain fever inflammation have been associated with ... 25 maj 2022 non-steroidal anti-inflammatory drug such ibuprofen aspirin cox-2 inhibitor safe for patient with covid-19 meta-analysis ... verstt den hr sidan av ays wong 2021 citerat av 66 av ays wong 2021 citerat av 66 study 2 we identified people with rheumatoid arthritis/osteoarthritis . we defined exposure current nsaid prescription within 4 month before 1 march ... av q zhou 2022 we included all comparative study that enrolled patient took nsaid during covid-19 pandemic . data extraction quality assessment ... 10 maj 2021 nonsteroidal anti-inflammatory drug nsaid such ibuprofen naproxen do n't worsen illness cause death hospitalized covid-19 ... av q zhou 2022 we included all comparative study that enrolled patient took nsaid during covid-19 pandemic . data extraction quality assessment methodology ...,120.0
light common multiple is full form lcm .,False,full form lcm is least common multiple . full form lcm is least common multiple .,lcm full form= least common multiple several process find lcm . multiple listing method common division method prime factorisation method.11 feb 2018 lcm stand for lowest common multiple it is smallest positive integer that can divisible both given numbers.sr . notermcategorylcm full form1lcmtechnologylamp control module2lcminventorylanded cost management3lcmmilitarylanding craft mechanizedview 67 more rowslcm stand for least common multiple . lowest common multiple also known least common multiple least common denominator is smallest number ... least common multiple can defined lowest positive integer that is multiple given set number . least common multiple is sometimes ... lowest common multiple least common multiple lcm is smallest integer whole number that belongs multiplication table two more ... what doe lcm mean academic science arithmetic number theory least common multiple lowest common multiple smallest common multiple ... what doe lcm mean least common multiple lcm lowest common multiple is smallest positive integer which is divisible each given numbers.definition lcm what doe lcm mean meaning lcm least common multiple lcm stand for least common multiple .,836000.0
is blind spot present human eye also location where optic nerve mostly glide through retina .,True,each eye ha tiny functional blind spot about size pinhead . tiny area where optic nerve pass through surface retina no photoreceptors . since no photoreceptor cell detecting light it creates blind spot . each eye ha tiny functional blind spot about size pinhead . tiny area where optic nerve pass through surface retina no photoreceptors . since no photoreceptor cell detecting light it creates blind spot . 10 apr 2018,blind spot small portion visual field each eye that corresponds position optic disk also known optic nerve head within ... blind spot scotoma is obscuration visual field . particular blind spot known physiological blind spot `` blind point '' punctum ... 28 jul 2020 blind spot is location on retina known optic disk where optic nerve fiber exit back eye.the blind spot . is something kind funky about setup here . photoreceptors back retina ganglion cell front ... 16 nov 2017 cornea transparent circular part front eyeball . it refracts light entering eye onto lens which focus it ... rv abadi 2011 cited 13 visual pathway intact photoreceptor gap is hard wired . moreover blind spot scotoma is fixed located approximately 15 temporal ... 11 jul 2020 spot where optic nerve connects retina ha no light-sensitive cell ca n't see anything . that 's blind spot.30 jan 2020 human most vertebrate optic nerve fiber pas through retina out back eyeball . area where bundled ... charles p. wilkinson david r. hinton srinivas r. sadda 2012 medicalthe position cell relative others same class is also ... eye.5052 where ganglion cell axon gather form optic nerve ...,5990000.0
group crocodile called shrewdness,False,,23 avr . 2018 shrewdness ape . name come ... name shrewdness ha been use for over 500 year ... group crocodile is called bask.16 mar 2022 actually group crocodile is called bask . bask can have 20 more crocodile together . might find large group crocodile ... whenever animal gather group formally called ape shrewdness badger cete bat colony cloud camp bear sloth sleuth bee ... group crocodile water is called float group on land is called ... animal gather group formally called ape shrewdness.tapping multiple choice . thanks mem creator ... shrewdness . what is group ape ... what is group crocodile called harass team.30 mar 2020 1. cackle hyena 2. shrewdness ape 3. raft otter 4. murder ... alex kuskowski 2012 juvenile nonfictiona shrewdness ape gibbon ape that live jungle . ... infant group shrewdness family bask crocodile group crocodile is called.traduire cette page thanks nicholaskawamura for these collective noun for group animal . ... shrewdness . what is group ... what is group crocodile called,26.0
marrakesh is capital morocco,False,,29.03.2021 although marrakech is not capital morocco vibrant city 's appeal never fails entice tourist from around world come ... marrakech wa founded 1062 yusuf ibn tashfin leader moroccan almoravid empire . is also considered one most prominent leader ... saadians took over morocco 1522. mostly ruin leader chose make marrakech capital 1551. under guidance mohammed al mahdi ... 5antwortenit is one four imperial city morocco is capital marrakesh-safi region . city is situated west foothill atlas ... satellite view is showing marrakesh most important former imperial city morocco situated near foothill grand atlas mountain . marrakesh is ... marrakesh is fourth largest city morocco main tourist destination ... 327 kilometre 203 mi southwest moroccan capital rabat ...,5180000.0
penguin cant found on continent africa,False,,2021/10/25 rate decline continues only penguin endemic continent could extinct wild within 15 year . loss food is ... african penguin spheniscus demersus also known cape penguin south african ... can found along coast south africa namibia.2011/09/14 africa ha always been most penguin-free continent southern ... ocean current also explain penguin were unable spread ... 2022/06/08 african penguin spheniscus demersus specie penguin found on african continent . these penguin listed endangered ... 2017/02/22 young african penguin following usual cue feeding ground only find that source food these place is no longer ... 2022/03/30 only 10000 breeding pair left south africa say research manager coastal bird conservation nonprofit - anadolu agency.2018/05/20 african penguin found along coastal area offshore island . preferred habitat flat sandy area with sparse abundant ... 2021/10/21 colony 1000 breeding pair african penguin nest on ... several hundred can found on boulder foxy beach year-round.2017/03/13 young african penguin leave nest for first time ... african penguin population on west coast south africa ... spheniscus demersus african penguin is found only on southwestern coast africa where dispersed colony across 24 different island ...,919000.0
every country world ha rectangular flag,False,nepal is only country modern world that doe not have rectangular national flag . it is crimson with blue border incorporates stylized symbol sun moon . nepal is only country modern world that doe not have rectangular national flag . it is crimson with blue border incorporates stylized symbol sun moon .,28 may 2018 country with non rectangular flag 3. nepal 2. switzerland 1. vatican city.we all know that country flag rectangular . three notable exception rule nepal switzerland vatican city.1 jun 2019 nepal vatican city switzerland country without rectangular flag . well over hundred city state without rectangular flag.this is list non-rectangular flag including flag state territory group movement individual people.17 may 2017 all nation world nepal have rectangular flag . from europe small nation pacific each one hold ... 7 feb 2014 7 feb 2014 even country that were n't directly colonized were influenced european practice . japan china siam all adopted rectangular flag ... 21 sept 2015 switzerland vatican city only two country with square flag . though square technically rectangle square is not ...,131000000.0
pizza wa first food consumed space,False,,according history book first man eat pizza space wa russian cosmonaut yuri usachov on may 22 2001. according history book first man eat pizza space wa russian cosmonaut yuri usachov on may 22 2001 . 2 nov. 202110 dec. 2020 one very first food created printer wasyou guessed itpizza . design for pizza meant it wa built layer . first ... 21 maj 2001 from day forward pizza hut pizza will go down history world 's first pizza delivered eaten space . space ... '' from day forward pizza hut pizza will go down history world 's first pizza delivered eaten space '' said randy gier ... 14 mar 2014 2001 pizza hut decided take one giant leap for mankind becoming ... 4 dec. 2017 that 's long time go without one favorite food . nespoli casually mentioned much miss pizza team down on earth ... 6 juni 2022 we know space food is gross these pizza eaten aboard ... worth noting that is not first pizza that 's been eaten space.fast food chain pizza hut became first company deliver pizza outer ... space station 2001 pizza wa sent aboard russian rocket used ... 16 mar 2021 pizza delivery ! back 2001 pizza hut became first company make delivery space . fast-food chain struck deal with ... 13 feb. 2015 back 2001 pizza hut became first restaurant chain deliver space report bbc . pizza wa sent international space ...,108.0
vitamin c is also known chemical name ascorbic acid,True,vitamin c also known ascorbic acid function water-soluble antioxidant cofactor ... relatively large amount vitamin c requiredfor instance adult man is said need about 70 mg 1 mg = 0.001 gram per day . citrus fruit fresh vegetable best dietary source vitamin . vitamin c also known ascorbic acid function water-soluble antioxidant cofactor ... relatively large amount vitamin c requiredfor instance adult man is said need about 70 mg 1 mg = 0.001 gram per day . citrus fruit fresh vegetable best dietary source vitamin . jul 7 2022,ascorbic acid vitamin c is water-soluble vitamin indicated for prevention treatment scurvy ascorbic acid deficiency result scurvy.chemistry chemistry chemistry vitamin c also known ascorbic acid ascorbate is water-soluble vitamin found citrus other fruit vegetable also sold ... feb 15 2021 l-ascorbic acid more familiarly known vitamin c is widely found nature . it is particularly abundant citrus stone fruit ... oct 15 2020 ascorbic acid is class medication called antioxidant . it is needed body help wound heal enhance absorption iron ... sep 20 2021 vitamin c also known ascorbic acid ascorbate is water-soluble vitamin found citrus other fruit vegetable also ... 1 answerascorbic acid is chemical term for vitamin c. name ascorbic acid is derived from disease meaning no scorbutus scurvy caused ... jun 1 2022 needed small amount only usually available food that eat . ascorbic acid also known vitamin c is necessary ...,6290000.0
zeus is referred king greek god goddess,True,,religion ancient greek religion ancient greek 26.01.202016.07.2022 zeus greatest all figure greek mythology ruled over all assembled god goddess from mt . olympus.zeus is sky thunder god ancient greek religion rule king god mount olympus . name is cognate with first element ... zeus wa king ancient greek god god sky weather law order destiny fate . wa depicted regal mature man with ... 18.07.2022 zeus ancient greek religion chief deity pantheon sky weather god wa identical with roman god jupiter.often referred father god men is sky god control lightning often using it weapon thunder . zeus is king mount ... 16.06.2022 zeus wa king greek pantheon ruling over men god alike ... together olympian god goddessesso named because ... nevertheless child fully grown armored wa eventually born from forehead zeus . it wa none other than athena goddess wisdom ... zeus ha lot child many whom also god goddess hero . ... zeus faced several challenge during rule king god ... greek mythology zeus jupiter roman mythology wa king heaven earth all olympian god . wa also known god justice ...,4270000.0
french is official language spain,False,most language spoken spain belong romance language family which spanish is only language which ha official status for whole country . most language spoken spain belong romance language family which spanish is only language which ha official status for whole country . official spanish country-wide catalan/valen ... immigrant spanish portuguese darija berber ... signed spanish sign language catalan sign ... regional asturian/leonese tarifit darija ara ...,french is official language fon yom yoruba national language . burkina faso multilingual country is home estimated 70 languages.languages france arabic portuguese spanish italian german polish berber turkish english vietnamese english 39 spanish 13 german 8in 21st century with spanish it is official language comunidad autnoma autonomous community galicia . 2008 portuguese parliament ... spanish is only official national language spain it is far most common language spoken throughout spain . may surprised commonly ... 10-sept-2020 most popular foreign language spain english french romanian . 11.7 ... 28-dec-2020 main foreign language spain english french german . approximately 27 population speaks english . some english speaker ... 05-jul-2022 spanish castilian castellano is official language spain spoken majority people . co-official language exist ... arabic chinese english french russian spanish . official language language which all official united nation document made available .,538000000.0
finding nemo protagonist is pufferfish,False,,bloat whenever puff up bloat is one member tank gang minor protagonist disney pixar film finding nemo.bloat is main character finding nemo minor character finding dory . is porcupine pufferfish that wa bought dentist from bob 's ... bloat brad garrett brad garrett played bloat pufferfish whom nemo ... gill is main character finding nemo minor character finding dory.porcupine puffer fish bloat ... possibly most famous finding nemo character ha seen huge increase clown fish sale result.bloat is main character finding nemo minor character finding dory . is porcupine pufferfish that wa bought dentist from `` bob 's fish ... 8 jun 2022 transforming enormous pincushion wa n't enough deterrent pufferfish . porcupine pufferfish specie which bloat ... 29 may 2020 frankly many character finding nemo that have take l ... bloat deep-voiced pufferfish coined phrase ... 19 jan 2022 bloat is main character finding nemo minor character finding dory . is porcupine pufferfish that wa bought dentist ... brad garrett emmy award-winning actor on `` everybody love raymond '' voice bloat blowfish with tendency for emotional well literal blow-ups .,108000.0
size hand is not equivalent heart .,True,'re kid heart is about same size fist 're adult it 's about same size two fist . heart beat about 100000 time one day about 35 million time year . during average lifetime human heart will beat more than 2.5 billion time . 're kid heart is about same size fist 're adult it 's about same size two fist . heart beat about 100000 time one day about 35 million time year . during average lifetime human heart will beat more than 2.5 billion time .,g ampanozi 2018 cited 10 purpose several medical textbook state that human heart is approximately size that person 's fist . stating that heart ha size corpse 's ... sep 29 2014 9 answershold hand fist that 's size heart . heart beat average 100000 time day . heart pump equivalent 1 million ... stating that heart ha size corpse 's fist is thought signify that heart size is normal . we formulate two hypothesis that tested ... size heart is 'somewhat ' equal that clenched fist case average adult . is no connection between size two.jul 2 2009 every day heart beat about 100000 time sending 2000 gallon blood surging through body . although it 's no bigger than ... 5922 youtube uva medical center hour oct 5 2018 oct 5 2018 missing hand equivalentfebruary 13 2018. can big dog . compare dog 's heart it body mass it 's .8 percent elephant mouse human have .6 ... 1948how it wa `` ship asking will hoist dutch solved is interesting ... not wearing some type headdress place right hand heart anyway .,86500000.0
alphabest eou called consonant .,False,consonant is speech sound that is not vowel . it also refers letter alphabet that represent sound z b t g h all consonant . consonant all non-vowel sound corresponding letter e o u sometimes y not consonant . hat h t consonant . consonant is speech sound that is not vowel . it also refers letter alphabet that represent sound z b t g h all consonant . consonant all non-vowel sound corresponding letter e o u sometimes y not consonant . hat h t consonant .,alphabet is made up 26 letter 5 which vowel e o u rest which consonant . vowel is sound that is made ... apr 22 2014 already know that vowel english alphabet e o u sometimes y while rest letter called consonant ... letter english alphabet that represent vowel e o u sometimes y. consonant consonant is speech sound made partially completely ... sep 28 2020 word vowel ultimately come from latin vox meaning voice . it 's source voice such word vocal vociferate . consonant ... jul 26 2019 consonant is letter english alphabet that 's not vowel ... e o u sometimes y. 24 consonant sound ... we can perfectly sound letter vowel without aid another letter . vowel e o u. remaining letter called consonants.vowels letter e o u. other letter alphabet called consonant . for pronunciation purpose vowel divided ... sep 2 2019 consonant on whole non-vowel sound relating letter e o u some time y not consonants.definition consonant consonant is letter sound english alphabet ... vowel english language e o u sometimes y .,4060000.0
