question,truthValue,snippet,description,results
howard donald is oldest member take that,True,howard is oldest member take that ! birthday is 28th april 1968 making currently 53-years-old . gary is next oldest birthday is on 20th january 1971 's currently 50-years-old . howard is oldest member take that ! birthday is 28th april 1968 making currently 53-years-old . gary is next oldest birthday is on 20th january 1971 's currently 50-years-old . sep 15 2021,is member english pop-group take that . donald wa also judge on german reality talent show got dance from 2013 2014 during take ... jun 4 2021 howard donald is member take that currently alongside gary barlow mark owen previously robbie williams jason orange.nov 18 2018 howard donald is 50-years-old . wa born 1968 is from droylsden . however jason ha not reunited with band for latest album ... jun 7 2021 howard wa born on april 28 1968 making 53-years-old . is singer songwriter record producer . blue-eyed six-foot-tall hunk ... mark owen gary barlow howard donald first performed 2007 hit 'shine ' before former member robbie williams had been sitting with other ... jul 14 2022 eldest wa pictured cap gown . ... howard shot fame member manchester band take that formed 1990 ... british pop band consisting member gary barlow mark owen howard donald jason orange robbie williams . had wildly successful initial run ... may 4 2021 member gary barlow howard donald jason orange 1990 2014 mark owen robbie williams 1990 2012.may 16 2022 exclusive take that heartthrob gary barlow howard donald mark owen gearing up conquer cannes on wednesday first time ...,37600000.0
eye responsible for sight,True,light reach retina back eye retina change image electrical impulse signal . optic nerve transfer these signal part brain that 's responsible for vision visual cortex . optic nerve carry signal from both eye once . light reach retina back eye retina change image electrical impulse signal . optic nerve transfer these signal part brain that 's responsible for vision visual cortex . optic nerve carry signal from both eye once . 20-sept-2021,04-mar-2020 vision refers part eye brain that enable see . main part eye include cornea pupil iris lens ... 20-apr-2022 all different part eye work together help see . learn job cornea pupil lens retina optic nerve ... most people use both eye see object . is called binocular vision image formed on retina each eye . these image slightly ... front eye is made cornea iris pupil lens focus image onto retina . retina is light sensitive membrane that cover ... rod responsible for night peripheral side vision . rod more numerous than cone much more sensitive light do not register ... cone cell responsible for daylight vision . three kind each responding different wavelength light red green blue . cone ... located front skull eye complex sensory organ responsible for vision . light pass through layer eye is translated ... 11-oct-2020 vision is dependent on connection between eye brain . light that enters eye is required go through specific ... cornea clear covering on front eye that focus light entering eye . fovea tiny pit macula that provides sharp central vision ...,46700000.0
canis lupur is scientific name for wolf,False,,genus canis linnaeus 1758 dog fox jackal . specie canis lupus linnaeus 1758 wolf gray wolf lobo gris loup . direct children.the wolf canis lupus also known gray wolf grey wolf is large canine native eurasia north america . more than thirty subspecies ... mar 9 2021 common name itis 2014 mech boitani 2003 nowak 1999. gray grey wolf tundra wolf arctic wolf mexican wolf plain wolf ... jul 8 2022 scientific name for wolf is canis lupus . lupus is latin name for wolf while canis is latin name for dog.items 1 - 10 175 gray wolf canis lupus largest wild member canidae dog family with adult ranging weight from 18 80 kilogram ... wolf largest wild member dog family between 4.5 6 foot 1.4 - 1.8 m length nose tail covered grizzled gray coat with ... canis lupusgray wolf canidae information 1 canidae picture 193 canidae specimen 212 canidae sound 4.available www.fs.fed.us/database/feis/animals/mammal/calu/all.html 2022 july 18. abbreviation calu common name gray wolf grey wolf timber wolf eastern ...,6000000.0
polar bear can only live arctic region not antarctic,True,,jan 3 2021 while it 's true that antarctic ha appropriate climate for polar bear food for eat relocating bear south is far from ... mar 20 2022 arctic antarctica while similar habitat some way home very different creature . both pole host variety seal ... mar 29 2021 short answer is no . arctic is natural home for polar bear . no polar dwell antarctica any sub-antarctic island . light ... jun 30 2021 polar bear could transported antarctic would almost certainly destroy wildlife that is currently die out ... top arctic predator can found all territory northern hemisphere where both sea ice seal population present northern america ... polar bear were created north pole region penguin were consigned south pole . worked out well for century until recently ice ... feb 3 2020 no penguin arctic south pole . icy water actually full life . narwhal only live up north . no shark ... oct 28 2021 polar bear live arctic north pole earth . do n't live antarctic which is south pole world ...,1330000.0
shark mammal,False,,30 jun 2022 while shark not mammal certain type called viviparous shark such hammerhead shark do give birth live young.sharks not mammal shark fish . shark lack mammalian characteristic such hair lung do not produce milk . being fish shark have ... 8 oct 2020 no shark not mammal . all specie shark classified fish . shark do not have mammary gland do not feed young ... dolphin whale seal sea lion otter all mammal . give birth live young nurse young with milk . contrast shark fish.17 nov 2021 shark mammal fish ... already discussed above shark fish meaning that shark not mammal . ... mammal from mammalian ... shark not mammal do not posse any characteristic feature that define mammal . for instance not warm-blooded . shark ... 3 answersmost people think shark mammal give birth young one pup some do lay egg . all specie 70 shark bear live one ... we have explained shark not mammal . shark is cartilaginous fish . skeleton shark is n't made up bone cartilage . some specie ...,11000000.0
mm stand for mar moordale,False,,m directed fritz lang . with peter lorre ellen widmann inge landgut otto wernicke . police german city unable catch ... check out m ' explicit aap rocky feat . lil wayne on amazon music . stream ad-free purchase cd 's mp3s now on amazon.com.m-audiohttps//m-audio.comhttps//m-audio.comlisten m ' on spotify . aap rocky single 2015 1 songs.letteredit . m upper case lower case m. thirteenth letter afrikaans alphabet written latin script.mac cosmetic beauty makeup product - official sitehttps//www.maccosmetics.comhttps//www.maccosmetics.com,25270000000.0
alliumphobia is fear garlic,True,,alliumphobia is fear garlic . people fear garlic may also avoid other plant that have pungent odor such chive onion shallot . origin word allium is latin meaning garlic bulb phobia is greek meaning fear . alliumphobia is fear garlic . people fear garlic may also avoid other plant that have pungent odor such chive onion shallot . origin word allium is latin meaning garlic bulb phobia is greek meaning fear . 20.06.2018alliumphobia is irrational fear garlic . someone suffering from condition can expect experience very high amount anxiety from merely ... alliumphobia from allium latin for `` garlic bulb '' is fear garlic . alliumphobes would not even want smell even including garlic-like smell go ... alliumphobia definition irrational disproportionate fear garlic . see more.and no it is not joke it really doe exist it medical term is alliumphobia . people suffer from it can not even get close garlic ... 20.07.2017 suffering from alliumphobia just smell garlic can trigger severe anxiety panic attack rebecca . submitted byalliumphobia is irrational fear garlic . person suffering from alliumphobia will fear even image thought garlic itself . many ... 27.08.2019 true . alliumphobia is fear garlic . garlic ha very pungent smell is due strong smell it becomes object dislike ... 04.11.2020 alliumphobia is fear garlic . symptom alliumphobia . phobia taken seriously . n't given proper attention ... 02.12.2020 it is defined persistent abnormal unwarranted fear garlic . some legend about vampire phobia is attributed these ...,52200.0
alexander fleming discovered penicillin,True,1928 st. mary 's hospital london alexander fleming discovered penicillin . discovery led introduction antibiotic that greatly reduced number death from infection . 1928 st. mary 's hospital london alexander fleming discovered penicillin . discovery led introduction antibiotic that greatly reduced number death from infection .,mar 25 2012 sir alexander fleming scottish researcher is credited with discovery penicillin 1928. time fleming wa experimenting ... dec 5 2017 fleming 's legendary discovery penicillin occurred 1928 while wa investigating staphylococcus common type bacteria that cause ... mar 14 2019 uncovered petri dish near open window became contaminated with mold . fleming realized that bacteria near mold were dying . ... sep 27 2013 many school child can recite basic . penicillin wa discovered london september 1928. story go dr. alexander fleming ... discovery penicillin discovery 1928 what wa later named benzylpenicillin penicillin g from mould penicillium rubens is ...,378000.0
smack is word used address group jellyfish,True,smack jellyfish other collective noun for group jellyfish bloom swarm . we think smack is most descriptive . jellyfish can found on shallow deep ocean water even beached jelly can smack with venomous painful sting . other collective noun for group jellyfish bloom swarm . we think smack is most descriptive . jellyfish can found on shallow deep ocean water even beached jelly can smack with venomous painful sting . 3 mar 2021,1 answer7 jan 2020 did know group jellyfish is called smack ! here more collective noun for ocean animal might not know ... 17 jun 2017 revel trove nine enchantingly fanciful marine-based collective noun including charmingly named smack jellyfish.a group jelly is commonly called swarm bloom . people also called it smack jellyfish though it 's bit old now . also some collect.jellyfish usually form cluster called smack bloom swarm . despite fact that these term used interchangeably refer specific group ... group jellyfish is sometimes called bloom swarm . `` bloom '' is usually used for large group jellyfish that gather small area may also ... 7 nov 2019 word that refer group individual collective noun english ... oh no 'm right middle smack jellyfish ! jellyfish sea jelly informal common name given medusa-phase certain gelatinous member subphylum medusozoa major part ... oceana - what is group jellyfish called facebookhttps//www.facebook.com ... oceana videoshttps//www.facebook.com ... oceana video,2080000.0
human have 4 sens .,False,five basic human sens touch sight hearing smell taste . sensing organ associated with each sense send information brain help u understand perceive world around u . five basic human sens touch sight hearing smell taste . sensing organ associated with each sense send information brain help u understand perceive world around u . 8 mar 2022,15 oct 2020 sight vision hearing audition smell olfaction taste gustation touch tactition.9 jan 2017 's much more human experience than sight hearing smell touch taste . here some lesser-known senses.we have more than five sens most people take faculty sight touch smell taste hearing for grantedbut not scientist.19 nov 2014 we often talk having five sens universal truth . reality may more . christian jarrett explains controversy.gustatory system taste although traditionally around five human sens were known namely sight smell touch taste hearing it is now recognized that ... 1 feb 2012 human eye contain four different kind sensory receptor three type cone optimized for long medium short wavelength light ... 14 oct 2021 many sens doe average human have assuming equate sens with receptor such retina eye ... 12 sept 2019 go beyond touch taste smell sound sight . ... today found out human have more than five sens . it turn out least nine ... many sens do human have 3 number physical type stimulus light photon chemical smell taste internal sensor mechanical touch ...,132000000.0
gin is typically included long island iced tea,True,long island iced tea long island ice tea is type cocktail typically made with vodka tequila light rum triple sec gin splash cola which give drink same amber hue iced tea . long island iced tea long island ice tea is type cocktail typically made with vodka tequila light rum triple sec gin splash cola which give drink same amber hue iced tea . iba specified ingredient 15 ml tequila 15 ml ... base spirit gin tequila vodka rum triple sec preparation add all ingredient highball g ... standard garnish lemon slice optional,6 jul 2022 long island iced tea ingredient ounce vodka ounce rum ounce tequila ounce gin ounce triple sec ounce simple syrup ounce ... what 's long island iced tea it not only contains captain morgan original spiced gold also vodka tequila triple sec gin too.11 jul 2022 long island iced tea is typically made with vodka tequila light rum triple sec gin splash cola which give drink ... 3/4 oz gin 3/4 oz white rum 3/4 oz silver tequila 3/4 oz vodka 3/4 oz triple sec 3/4 oz simple syrup 3/4 oz fresh lemon juice topped with cola ... 28 aug 2019 discover perfect long island iced tea recipe right here ! combining gin with rum vodka tequila triple sec topped up with cola ...,1390000.0
downton abbey series start day after sinking titanic,True,downton abbey series start day after sinking hm titanic april 1912 tell story crawley family navigates changing time early twentieth century end year 1926. downton abbey series start day after sinking hm titanic april 1912 tell story crawley family navigates changing time early twentieth century end year 1926. jan 18 2022,series downton abbey is launched quite literally event surrounding rms titanic it fateful encounter with iceberg on night april ... first series downton abbey comprises seven episode wa broadcast uk from 26 ... from day after sinking rms titanic april 1912 ... sinking rms titanic downton abbey - youtubehttps//www.youtube.com watchhttps//www.youtube.com watchfeb 28 2022 first series wa set 1912 revolving around sinking titanic . following tv series is 2019 spin-off film downton ... sun rise over downton abbey for another day ritualistic eating changing clothes . while crawleys stir above servant get house ... story open on morning 16 april 1912 day after titanic sank bottom atlantic . news had shocked nation . tragedy would change ... rating 8.3/10 2945 votesjan 23 2022 audience downton abbey eagerly watched crawleys were affected moment history such titanic sinking ...,149000.0
porsche 718 cayman is front-engined,False,,traduzir esta pgina 3 de mai . de 2022 3 de mai . de 2022 most modern car equipped with engine located front many high-quality sport car have same configuration.the 718 model were made for sport it . mid-engined roadster that unite sporting spirit legendary porsche 718 with sport car ...,3410000.0
song we dont talk about bruno from encanto is first disney song hit 1 on billboard hot 100 chart 29 year,True,,3 day ago 3 day ago we do n't talk about bruno disney 's biggest song date is first song from animated disney film hit number one since 1993.feb 4 2022 first new no . 1 song yearwe do n't talk about bruno contrapuntal ensemble song from disney 's colombian fable encanto ... jan 31 2022 we do n't talk about bruno surprise hit off encanto soundtrack ha gone where even let it go could n't it 's become first ... jan 21 2022 we do n't talk about bruno from animated film encanto ha become first original disney song reach no 1 uk charts.jan 31 2022 today though surprise encanto hit we do n't talk about bruno ha joined whole new world becoming disney 's second-ever 1 hit.apr 6 2022 we do n't talk about bruno wa first song from animated disney film hit no . 1 on chart since 1993. madrigal family from ' ... jan 31 2022 we do n't talk about bruno from disney 's encanto make magical move no . 1 on billboard hot 100 song chart . ensemble song ... feb 3 2022 week we do n't talk about bruno from disney animated film encanto ha dethroned adele take top spot on billboard hot 100 ...,180000.0
increase rbc ha nothing do with onset anaemia .,True,,anaemia mean that either level red blood cell level haemoglobin body is lower than normal which mean body doe not have enough ... iron deficiency anaemia is caused lack iron often because blood loss pregnancy . it 's treated with iron tablet eating iron-rich foods.11 aug 2020 anemia is defined low number red blood cell . routine blood test ... have anemia hemoglobin level will low too.causes anemia ckd may include inflammation low level epo due kidney damage low level nutrient needed make red blood cells.4 jan 2022 4 jan 2022 frequent blood donor . people routinely donate blood may have increased risk iron deficiency anemia since blood donation can deplete ... anemia is decrease number red blood cell rbc . ... is nothing specifically that can do prevent anemia from occurring.16 mar 2022 iron deficiency little iron anemia occurs is insufficient iron body make hemoglobin . quantity hemoglobin ... 7 apr 2022 chronic inflammation can affect body 's ability use iron needed make enough red blood cell . anemia happens do n't have enough ...,4310000.0
japanese car company toyota wa originally established textile manufacturer,True,,toyota industry corporation wa founded 1926 sakichi toyoda manufacture sell automatic loom which had invented.toyota industry corporation is japanese machine maker . originally still active 2021 manufacturer automatic loom it is company ... toyota 's origin lie japanese weaving industry sakichi toyoda invented world 's first automatic loom subsequently set up toyoda ... all loom invented sakichi toyoda including 1905 toyoda power loom were type power loom known time japanese cotton spinning ... founded 1920s produce sell automatic loom company is one japan 's larger integrated manufacturer textile machinery producing both ... 04-mar-2013 1929 british textile machinery maker platt bros. paid toyoda 150000 - fortune time - for right latest loom ... rising from ash industrial upheaval post-war japan toyota ha become largest vehicle manufacturer japan with over 40 market share . toyota ... leader automotive production today toyota wa actually founded heir automobile division huge textile business house toyoda ...,5270000.0
mushroom need sunlight grow,False,,most mushroom do n't need light sunlight grow do n't have chlorophyll making photosynthesis impossible . instead these mushroom grow darkness ... do mushroom need darkness grow mushroom do like little sunlight not light-dependent can both grow reproduce without it.15 jan 2018 yes can grow acre mushroom flat land with sunlight long create perfect environment for grow . some people grow ... 25 aug 2015 unlike plant mushroom do n't have chlorophyl not capable photosynthesis . however lot require some light order grow fruit ... 30 jul 2020 placing terrarium grow kit somewhere where it can get healthy amount indirect sunlight room lighting should good enough . many ... 27 aug 2021 mushroom can grow light well need very specific environment do . need high humidity shade from direct ... reality mushroom is that do not need darkness grow though known grow faster dark than do light . mushroom 92 ... although mushroom known for growing shady spot forest do need light . want grow mushroom it is good idea study ... 4 feb 2022 mushroom capable growing complete absence light . nature mushroom do before peeping out from under leaf ...,13300000.0
is no railway system iceland,True,,iceland doe not have public railway system . have been three small railway none became part public transport iceland . main reason for lack railway small population competition with automobile traffic harsh environment . iceland doe not have public railway system . have been three small railway none became part public transport iceland . main reason for lack railway small population competition with automobile traffic harsh environment.1 oct. 2018 did know that iceland is not possible iceland doe not have public railway system . iceland 's small population road network ... no iceland ha never had any train station . have been three railway iceland none wa for pedestrian were for transferring good ... 24 janv . 2018 although have been three railway network iceland country ha never had public railway network . iceland ha no public ... 845 youtube bright side 4 mar 2020 4 mar 2020there no active railway iceland today . over year have been various proposal for introducing urban transit system metro tram ... 14 janv . 2021 despite lack public railway iceland were 4 local industrial line most important impulse for establishment ... 31 mar 2022 's been lot talk on social medium about importance train system iceland . for instance jn gnarr ha tweeted about ... not having any railway service all is about bad it get . here some country without any railway all iceland greenland yemen oman ... iceland doe not have public railway system . have been three small railway ... ... which country eastern africa ha no railway line,5.0
taiwan celebrates festival appreciate monkey,False,,monkey buffet festival kick off with opening ceremony that includes performance dancer monkey costume . monkey arrive host remove ... monkey festival is puyuma celebration focused on young men one ... with it came increased appreciation among indigenous people for own ... jan 29 2016 celebrate 20th anniversary taipei metro system one-day pas ticket design feature 20 unique city image ... nov 29 2021 lopburi community member bring out fruit feast for neighborhood monkey lopburi monkey festival lopburi thailand nov. 28 2021.the lantern festival is celebrated on 15th day first month chinese lunar calendar with series activity throughout taiwan.dec 2 2021 purpose festival is thank monkey for part lopburi 's tourism region thailand sometimes known monkey ... carried many article on taiwan 's festival written ... bureau titled time for celebration taiwan tourism ... 1992/2004 monkey . 1993/2005 rooster.feb 16 2016 2016 taiwan lantern festival will run from february 22 march 6. spending few hour will leave visitor with memory cherish ...,1520000.0
four lung found human body,False,,human have two lung right lung left lung . situated within thoracic cavity chest . right lung is bigger than left which share space chest with heart . lung together weigh approximately 1.3 kilogram 2.9 lb right is heavier . human have two lung right lung left lung . situated within thoracic cavity chest . right lung is bigger than left which share space chest with heart . lung together weigh approximately 1.3 kilogram 2.9 lb right is heavier.21 juni 2021 lung pair spongy air-filled organ located on either side chest thorax . trachea windpipe conduct inhaled air ... verstt den hr sidan lung respiratory system allow u breathe . bring oxygen body called inspiration inhalation send carbon dioxide out ... lung . upper respiratory tract is made up nose . nasal cavity ... body 's cell need oxygen live carry out normal functions.av r chaudhry 2021 citerat av 16 purpose lung is provide oxygen blood . ... general four segment left upper lobe anterior apicoposterior ... broad coastal surface lung is pressed against rib cage while ... lung become smaller structure wall changes.14 dec. 2018 look like tiny grape bunch very tiny balloon . about 600 million alveolus lung . small bubble shape ... lung major organ respiratory system divided ... blood cell release oxygen pick up carbon dioxide ...,180.0
justin bieber ha fear grape specifies that each venue play must grape free before enters building,False,,... radio star ' true justin bieber ha fear grape specifies that each venue play must grape free before enters building - false ... justin bieber is one biggest pop star on planet rising fame young teenager - find out everything need know about 'justice ' ... 0 it wa time day all spain slept during summer 1 same way did 2 sarah told that wa see brother 3 galileo ... no titlenoyesinfo regarding car truck air purifiernoyesa brief description stevie wonder quotesnoyesview 198 more rowsjust do my documentary aim expose all that go on subterranean world marketing advertising . only ha one distinct advantage.6 feb 2012 6 feb 2012 because need brick road magazine ... identical work doing most it for free with identical similar degree many have ... adele adkins is singer-songwriter from england one world ' best-selling music artist . doe little bit california dreaming song ... lr ashby cited 204 dent raised hope that united state had turned racial corner it also injected additional dose bitter partisanship ... lost job all possession is unlikely die from hunger . ... closest thing we have global constitution categorically state that ...,167000.0
