question,truthValue,snippet,description,results
region human body which experience fastest growth hair is facial hair,True,,2016/06/21 did not win wa 27th competition . did chaplin come 20th place 27th place did enter contest all it 's fun ... 2021/01/05 tramp wa beloved that comic strip character animated cartoon were fashioned after character . manufacturer publisher ... 2021/03/19 impersonated well known film self . did not win wa 27th competition . chicago herald had put it on july 15 ... 2021/03/05 charlie chaplin participated won 20th position competition ... look-alike that wa peak stardomno mention final position number time entered . ... also participated 'charlie chaplin look-alike contest ' along with other 125 ... 0 recall story going around wa that charlie chaplin entered charlie chaplin lookalike ... stardom stardom2021/06/25 ... heard story far many time silent movie star charlie chaplin entered look-alike contest came twentieth position.sir charles spencer chaplin jr. kbe 16 april 1889 25 december 1977 wa english comic actor filmmaker composer rose fame era ... 2008/11/04 event is organized local movie exhibitor john hamrick 1876-1956 had recently secured film charlie chaplin 's burlesque on ...,344000.0
thomas edison discovered gravity,False,,sep 12 2011 isac newton discovered gravity . thomas edison invented first electric light bulb.thomas alva edison february 11 1847 october 18 1931 wa american inventor businessman . developed many device field such electric ... jun 5 2021 thomas edison discovered gravity . answer false.thomas edison 's secret lab murphy 's law gravityhttps//www.youtube.com watchhttps//www.youtube.com watchjun 6 2019 born 1847 thomas edison acquired record number 1093 patent singly jointly . invention included phonograph ... oct 28 2019 edison did not actually invent light bulb course . people had been making wire incandesce since 1761 plenty other inventor had ... may 30 2022 fact check sir isaac newton discovered gravity around 1665. thomas edison experimented with lightbulb 1879.oct 19 2021 kbc offline quiz october 19 2021 concept gravity wa discovered which famous physicist thomas edisonstephen hawkingalbert ... not only did newton invent world 's first reflecting telescope developed three law motion discovered many new fact about gravity had many ... dec 2 2020 what exactly did thomas edison definitely invent without anyone ... for claim over revolutionary idea gravity calculus ...,372000.0
wont find any hair on rhinoceros nose .,False,fastest flying insect certain dragonfly hawk moth both which have been clocked around 35 mph . comparison honey bee have been clocked only 13.9 mph top speed hornet 15.6 mph . fastest flying insect certain dragonfly hawk moth both which have been clocked around 35 mph . comparison honey bee have been clocked only 13.9 mph top speed hornet 15.6 mph . 4 dec 2019,17 jul 2013 hive honey bee `` bible '' beekeeping indicates that bee 's flight speed average about 15 mile per hour 're capable ... 5 sept 2017 according smithsonian title fastest flying insect belongs dragonfly which dart spin dive record 35 ... fast do bee fly fastest speed honeybee recorded is 20 mph we see attack other insect prey on hives.18 dec 2014 my personal opinion out fly wasp bee fly fastest.17 jun 2014 best guess far fastest flier is horsefly it speed wa estimated 145km/h . record is ever beaten it is likely ... 29 nov 2005 being relatively large insect bee would expected beat wing rather slowly sweep across same wide arc other ... 28 apr 2000 detailed study randall hepburn rhodes university south africa treat insect essentially miniature aircraft calculate ... honey bee ... might surprised see humble honey bee on list fact honey bee very quick flier need order ... honey bee last one on list top fastest flying insect is honey bee . is one fastest flying insect world .,165000.0
clampett family struck oil near home ozarks before moving beverly hill 1960 's,True,downton abbey series start day after sinking hm titanic april 1912 tell story crawley family navigates changing time early twentieth century end year 1926. downton abbey series start day after sinking hm titanic april 1912 tell story crawley family navigates changing time early twentieth century end year 1926. jan 18 2022,series downton abbey is launched quite literally event surrounding rms titanic it fateful encounter with iceberg on night april ... first series downton abbey comprises seven episode wa broadcast uk from 26 ... from day after sinking rms titanic april 1912 ... sinking rms titanic downton abbey - youtubehttps//www.youtube.com watchhttps//www.youtube.com watchfeb 28 2022 first series wa set 1912 revolving around sinking titanic . following tv series is 2019 spin-off film downton ... sun rise over downton abbey for another day ritualistic eating changing clothes . while crawleys stir above servant get house ... story open on morning 16 april 1912 day after titanic sank bottom atlantic . news had shocked nation . tragedy would change ... rating 8.3/10 2945 votesjan 23 2022 audience downton abbey eagerly watched crawleys were affected moment history such titanic sinking ...,149000.0
letter j is only letter alphabet not included periodic table,True,nepal is only country modern world that doe not have rectangular national flag . it is crimson with blue border incorporates stylized symbol sun moon . nepal is only country modern world that doe not have rectangular national flag . it is crimson with blue border incorporates stylized symbol sun moon .,28 may 2018 country with non rectangular flag 3. nepal 2. switzerland 1. vatican city.we all know that country flag rectangular . three notable exception rule nepal switzerland vatican city.1 jun 2019 nepal vatican city switzerland country without rectangular flag . well over hundred city state without rectangular flag.this is list non-rectangular flag including flag state territory group movement individual people.17 may 2017 all nation world nepal have rectangular flag . from europe small nation pacific each one hold ... 7 feb 2014 7 feb 2014 even country that were n't directly colonized were influenced european practice . japan china siam all adopted rectangular flag ... 21 sept 2015 switzerland vatican city only two country with square flag . though square technically rectangle square is not ...,131000000.0
it take sloth two week digest meal,True,,goliath mean really big ! we 're not kiddingthe goliath frog is largest frog world . it grows up 12.5 inch 32 centimeter long can ... west african goliath frog which can reach 30 cm 12 inch from snout vent weigh up 3.3 kg 7.3 pound is largest anuran.09-aug-2019 goliath frog conraua goliath can 34 centimetre long weigh over 3.2 kilogram . only found cameroon equatorial guinea ... goliath frog fact picture information meet biggest frog world . oversize amphibian is found west africa.22-jun-2020 found only tropical rainforest central africa within south western part cameroon north equatorial guinea.the geographic range goliath frog is restricted coastal equatorial guinea cameroon west africa . biogeographic region ethiopian.12-aug-2019 goliath frog formally known conraua goliath occupy relatively small range that stretch from southwestern cameroon equatorial ...,1290000.0
walt disney ha record for most academy award,True,,during career won 26 academy award four were honorary wa nominated 59 time . lying frog on it back softly caressing it tummy it is possible hypnotize it . moon is wider than australia . answer false . during career won 26 academy award four were honorary wa nominated 59 time . lying frog on it back softly caressing it tummy it is possible hypnotize it . moon is wider than australia . answer false.1 juin 2015 pet frog 's tummy with other fingertip using repetitive stroking motion from just under it chin bottom it belly.28 oct. 2014 alligator method also work on lizard frog . hypnotize lizard frog put it on it back hold it still for few seconds.24 nov. 2020 it is possible hypnotize frog placing it on it back gently stroking it stomach . see ifunny ... 6 avr . 2022 it is possible hypnotize frog placing it on it back gently stroking it stomach . trivia quiz general knowledge gk click flip.purple disco machine sophie giant - youtubehttps//www.youtube.com watchhttps//www.youtube.com watch20 juin 2022 interesting fact about animal number two can hypnotise frog softly caressing it tummy while it is lying down on it back.28 sept. 2016 `` it 's state hypnotism generated flipping animal on it back fully ... 6 mai 2020 think that work on lot different animal including some human though position belly rub up down ...,1.0
bull feature on porsche logo,False,,what wa first car come equipped with anti-lock brake a. lincoln continental mark iii b. shelby cobra c. bmw 1600 d. jensen ff.19 apr 2011 bmw wa first motorcycle manufacturer introduce ab 1988 now offer sixth generation numerous ab option across it product ... anti-lock braking system ab is safety anti-skid braking system used on aircraft on land vehicle such car motorcycle truck buses.19 apr 2011 recent study insurance institute for highway safety iihs revealed that motorcycle equipped with antilock brake 37 percent le ... 29 sept 2013 2013 mark 25th anniversary motorcycle ab here 's look back first bike fitted with antilock brake system from bmw.29 aug 2018 8 what wa 1st car come equipped with anti-lock brake lincoln continental mark iii b jensen ff c shelby cobra d bmw 1600.with it unparalleled six-cylinder engine it equipment bmw k 1600 gtl offer exclusive comfortable performance touring for two.8 jul 2012 leading motorcycle manufacturer bmw motorrad ha always been aware it social responsibility connection with motorcycling safety . ... 2455 youtube teapotone 19 apr 2019 19 apr 2019,7310000.0
world 's ocean produce over 40 oxygen we breath,True,,according new study half sea turtle on planet have ingested some form plastic . come just day after another study with some same researcher involved reported similar finding seabird -- some 90 percent which have consumed plastic . according new study half sea turtle on planet have ingested some form plastic . come just day after another study with some same researcher involved reported similar finding seabird -- some 90 percent which have consumed plastic . 15 sep. 2015many turtle that have been killed consuming debris had plastic bag fishing line stomach some small half fingernail . sea turtle ... 1 juli 2021 sadly it 's not only consumption plastic that pose threat these marine reptile turtle get entangled plastic debris ... 13 sep. 2018 new study ingesting even single piece plastic expose sea turtle 20 chance death.av c wilcox 2018 citerat av 127 globally it is estimated that approximately 52 all sea turtle have ingested plastic debris however varies considerably between ... 19 sep. 2015 first schuyler told washington post team made model marine plastic distribution based on found debris.13 okt . 2021 consuming plastic debris can lead floating syndrome especially juvenile . without intervention many will not survive.24 sep. 2015 sea turtle dangerously munch on ocean plastic . ... another study showed that about 90 percent seabird have also consumed plastic.there seven specie sea turtle found world 's ocean today ... research suggests that 52 world 's turtle have eaten plastic waste.av se nelms 2016 citerat av 300 indeed plastic item have become principal constituent marine debris ... one study found that juvenile green turtle chelonia mydas consumed ...,960.0
is no railway system iceland,True,,iceland doe not have public railway system . have been three small railway none became part public transport iceland . main reason for lack railway small population competition with automobile traffic harsh environment . iceland doe not have public railway system . have been three small railway none became part public transport iceland . main reason for lack railway small population competition with automobile traffic harsh environment.1 oct. 2018 did know that iceland is not possible iceland doe not have public railway system . iceland 's small population road network ... no iceland ha never had any train station . have been three railway iceland none wa for pedestrian were for transferring good ... 24 janv . 2018 although have been three railway network iceland country ha never had public railway network . iceland ha no public ... 845 youtube bright side 4 mar 2020 4 mar 2020there no active railway iceland today . over year have been various proposal for introducing urban transit system metro tram ... 14 janv . 2021 despite lack public railway iceland were 4 local industrial line most important impulse for establishment ... 31 mar 2022 's been lot talk on social medium about importance train system iceland . for instance jn gnarr ha tweeted about ... not having any railway service all is about bad it get . here some country without any railway all iceland greenland yemen oman ... iceland doe not have public railway system . have been three small railway ... ... which country eastern africa ha no railway line,5.0
omnivore eat only plant,False,generally omnivore eat fruit vegetable freely ca n't eat grass some grain due digestive limitation . omnivore will also hunt both carnivore herbivore for meat including small mammal reptile insect . large omnivore include bear human . generally omnivore eat fruit vegetable freely ca n't eat grass some grain due digestive limitation . omnivore will also hunt both carnivore herbivore for meat including small mammal reptile insect . large omnivore include bear human .,19 may 2022 19 may 2022 omnivore is organism that regularly consumes variety material including plant animal algae fungi.herbivores animal that eat only plant . carnivore animal that eat only meat . omnivore animal that eat both plant meat . size ... omnivore animal is one that eats both plant animal which may include egg insect fungi meat algae . many omnivore evolved ... omnivore is animal that ha ability eat survive on both plant animal matter . obtaining energy nutrient from plant animal ... can omnivore eat only plant omnivore is kind animal that eats either other animal plant . omnivore eat plant not all kind ... unlike carnivore eat diet almost completely meat herbivore eat only plant omnivore generalist it come what can ... 23 oct 2021 while herbivore eat only plant carnivore only prey on meat other animal carrion . similarly omnivore animal that eat ... 17 jul 2020 human omnivore because biology . vegetarianism is dietary choice . omnivore eats only plant material remain omnivore . dietary ...,441000.0
equator is line that pass through middle earth .,True,equator is invisible line that run around center earth 0 degree latitude . equator is imaginary line around middle planet other celestial body . it is halfway between north pole south pole 0 degree latitude . equator is invisible line that run around center earth 0 degree latitude . equator is imaginary line around middle planet other celestial body . it is halfway between north pole south pole 0 degree latitude . may 19 2022,equator is circle latitude about 40075 km 24901 mi circumference that divide earth northern southern hemispheres.the equator is imaginary line around middle earth . it is halfway between north south pole divide earth northern ... earth 's equator is imaginary line that run around center globe 0 degree latitude equal distance between north south poles.the equator is huge circle imagination that is assumed middle earth . length earth 's equator is exactly 40075.16.jan 29 2020 jan 29 2020 equator thus qualifies great circle because it pass through exact center earth divide it half . other line ... equator is only line latitude which is also great circlethat is one whose plane pass through centre globe . earth is widest ... oct 12 2021 equator pass through 13 country ecuador colombia brazil sao tome principe gabon republic congo democratic republic ... equator . imaginary circle go around middle earth for 24902 mile . it divide northern hemisphere from southern hemisphere ...,7560000.0
snail can sleep for up 3 month,False,,13 jun 2015 study laughing chimpanzee rat offer clue about evolutionary pasta well mental health.apes ape . chimpanzee gorilla bonobo orangutan show laughter-like vocalization response physical contact such wrestling play chasing ... 22 may 2021 22 may 2021 new study journal bioacoustics found that 65 different specie animal have own form laughter . study co-author sasha ... 17 may 2021 17 may 2021 team identified 65 specie that `` laughed '' while playing most were mammal few bird specie demonstrated playful laughter . ... md ross 2010 cited 110 addition producing most distinctive laughter among great ape orangutan clearly were specie laugh least during tickling session ... 27 may 2015 dog rat chimpanzee other ape few specie that known emit unique sound similar laughter response pleasure . can ... 6 oct 2021 now we know that laughing is rare legitimate behavior amongst certain group animal . particular primate rodent bird ...,740000.0
bmw 1600 wa first car come equipped with anti-lock brake,False,,751 youtube usclassicmusclecars 28 jun 2019 28 jun 2019 what year is gran torino starsky hutchzebra three is radio call sign given fictional `` bay city california '' police department iconic 1970s television series starsky hutch ... code name nickname for ford gran torino that starsky owned ... 7 dec 2018 7 dec 2018 wa one character that eclipsed both police car . it wa ford gran torino it eventually became iconic that even ... 1 apr 2020 although it found fame classic 1970s tv show ford gran torino is american ... 1970s tv cool cop drove cool cars.1 aug 2020 movie wa based off starsky hutch television series ... street-savvy cop drove chevrolet camaro convertible ford 's ... although memorable for it chase scene bromance breakout star is cop ' custom-painted ford gran torino . tv show . 1975 gran torino - starsky ...,35500.0
seahorse have stomach which aid digestion food,False,official canon disney princess princess were given official number franchise lineup based on chronological order which film were released starting with snow white first original disney princess with cinderella being second followed aurora on . princess were given official number franchise lineup based on chronological order which film were released starting with snow white first original disney princess with cinderella being second followed aurora on . clothing disney fairy tale wedding collection original music disney 's princess favorite di ... comic kilala princess disney princess se ...,cinderella first made appearance 12th animated feature film produced disney cinderella 1950 over decade after snow white wa released . ... 11 oct 2021 first all disney princess snow white appeared disney 's snow white seven dwarf hardworking cinderella never give up.cinderella is first disney princess is married royalty marries prince charming . aurora is titular protagonist film sleeping ... 20 apr 2021 cinderella wa 19 film is first disney princess have sister . next came aurora . sleeping beauty wa released 1959.4 feb 2016 movie broke box office record sparked animation empire anchored primarily on disney 's signature bevy princess . though ... period is foundation 'princess ' genre whole . generation snow white 1937 cinderella 1950 sleeping beauty 1959 were ... 24 june 2022 snow white seven dwarf came out 1937 debuting very first disney princess with snow white herself.how watch disney princess move order 1 snow white 1937 2 cinderella 1950.7 apr 2015 snow white is first disney princess . film snow white seven dwarf wa released 1937 wa first it kind . story ...,18600000.0
rapper nicki minaj is over 180 cm 5 ft 10.9 height,False,,standard helium balloon can lift approximately 0.03 pound 14 gram . however depends on several factor such weight size balloon ... oct 12 2014 helium will lift about 66 pound per 1000 cubic foot gas depending on air pressure air temperature humidity gas pressure inside balloon . ... hard tell with all high heel right 5. theory it take over 5000 helium balloon lift average-sized human from ground.helium ha 0.0114 pound per cubic foot . for one cubic foot helium filled balloon gravity pull down on helium with force 0.0114 pound while ... jul 11 2022 theory it take over 5000 helium balloon lift average-sized human from ground . answer true.this equation is useful for pressure-temperature calculation for confined gas constant volume . note that temperature must on kelvin scale for any ... faa-h-8083-11 balloon flying handbook 2001 u.s. department transportation federal aviation administration flight standard service preface balloon ... popular mechanic magazinecomplexity theory can also simulate on computer emergence ... hypersonic travel 5000 mile per hour may turn earth tiny ...,56400.0
japanese anime sazae-san ha guinness world record for longest-running animated show on television,True,2010 momoa wa cast khal drogo leader dothraki people game throne . while character drogo wa written somewhat villainous least early episode momoa 's natural charm made character standout audience eagerly responded portrayal . 2010 momoa wa cast khal drogo leader dothraki people game throne . while character drogo wa written somewhat villainous least early episode momoa 's natural charm made character standout audience eagerly responded portrayal . aug 26 2021,aug 2 2021 actor wa cast khal drogo fantasy series aquaman star jason momoa ha said that would not want play game throne ... jan 24 2018 actor played khal drogo on game throne did job well that multiple people did n't realize jason momoa spoke english not ... jul 22 2021 game throne actor jason momoa gained worldwide fame khal drogo on hbo series fan ca n't get enough fantasy drama ... oct 29 2019 momoa portrayed khal drogo dothraki warlord daenerys targaryen 's husband until character 's untimely death end first ... khal drogo . portrayed man wa perfect jason momoa . 3. more like . do n't know enjoy much game throne cat.khal drogo is dead . did forget ok jason momoa just want make sure we 're all on same page on that one seeing some game throne fan ... nov 19 2020 hollywood star jason momoa say ate pizza every day order get shape for role khal drogo game throne .,91600.0
disabled valery spiridonov wa first person world have head transplanted onto another body,False,,tiktok 's expansion allow up 10-minute video come le than year after it raised maximum length video three minute july 2021 up from 60 second before . tiktok 's expansion allow up 10-minute video come le than year after it raised maximum length video three minute july 2021 up from 60 second before . 28 fvr . 2022traduire cette page 1 juil . 2021 1 juil . 2021 previously tiktok video could up 60 second length after initially expanding from 15-second clip . 60-second video format ... 1 mar 2022 launch tiktok video were limited 15 second . tiktok later increased maximum video length time 60 second tripled that 3 ... 15 juin 2022 while user could originally only record upload 15-second video on tiktok that limit wa later extended one minute ... 10 mai 2022 what is maximum length for tiktok video look tiktok 's time ... 2017 tiktok bumped up video length 60 seconds.7 juil . 2021 week social medium news tiktok increase it video length limit from 60 second three minute snapchat share insight on it ... first thing consider is length . first tiktok video could only up 15 second long company recently extended limit 60 ... 10 mai 2022 video started 15-second clip grew 60-second clop now 3-minute video may on card testing with certain users.video file size up 287.6 mb io 72 mb android size video length max fifteen second can also combine story video together for up sixty ...,12.0
ear corn have even number row,True,snap crackle pop cartoon mascot rice krispies brand breakfast cereal marketed kellogg 's . snap crackle pop cartoon mascot rice krispies brand breakfast cereal marketed kellogg 's . voiced snap daw butler 19371950 d ... first appearance 1933,snap crackle pop mascot kellogg 's cereal rice krispies . usa also mascot cocoa krispies.inspired kellogg 's rice krispies radio commercial artist vernon grant creates character snap crackle pop . first appear ad ... jun 26 2017 one greatest mascot trio advertising history life cereal aisle grocery store yet remain mystery ... dec 29 2017 via ricekrispies.comin 1941 snap crackle pop first appeared on box kellogg 's rice krispies represent unique sound ... jan 16 2014 look era cereal mascot were more than just snap ! crackle ! pop ! ... 're familiar with elf snap ! crackle ! ... named for onomatopoeia cereal 's crinkling noise snap crackle pop were turned from gnome elf continue used mascot not just ... snap crackle pop cartoon mascot rice krispies brand breakfast cereal marketed kellogg 's . content . 1 history 2 physic 3 ... jun 27 2008 rice krispies cereal hit market 1928. cereal is made rice grain that cooked dried toasted resulting crisped rice .,12200.0
