question,truthValue,snippet,description,results
archimedes is considered father history .,False,according american academy dermatologist it 's normal lose anywhere from 50 100 strand hair per day . for people with longer hair strand losing may more noticeable . according american academy dermatologist it 's normal lose anywhere from 50 100 strand hair per day . for people with longer hair strand losing may more noticeable . 20-jun-2018,20-nov-2018 according american academy dermatologist losing anywhere from 50 100 hair per day is perfectly normal . probably n't going ... it 's normal shed between 50 100 hair day . body shed significantly more hair every day person ha excessive hair shedding.22-aug-2019 we normally lose around 50 100 hair per day imagine trying count each one from hair follicle end resting stage.15-oct-2021 while average person loses about 50 100 strand per day salon trichologist penny james tell instyle anything over 150 strand is not ... 03-jun-2022 hair fall is quite normal it range between 50-100/day . everyday hair fall is significantly more than that ... 29-mar-2016 hair fall is very natural process . it happens anyone almost everyone . on average we lose about 50-100 strand hair day.by s malkud 2015 cited 198 physiological daily shedding 100-150 telogen club hair from scalp is natural consequence hair cycle . follicle normally ... 3 answer,98600.0
is no way telling boiled egg from raw egg until break open,False,inferno '' brown 's novel inspired dante 's epic poem about nine circle hell feature recurring hero robert langdon traveling florence solve mysterious clue found great work renaissance art stop threat mankind . inferno '' brown 's novel inspired dante 's epic poem about nine circle hell feature recurring hero robert langdon traveling florence solve mysterious clue found great work renaissance art stop threat mankind . may 14 2013,statement on brown 's website said book is set italy center on first part dante alighieri 's 14th-century epic poem `` divine comedy ... mar 22 2018 robert langdon virgil modern inferno take u on tour major cultural site florence venice istanbul . peering `` ... feb 20 2013 according brown novel wa inspired dante author `` divine comedy '' epic poem written 14th century that follows ... publication groundbreaking novel da vinci code lost symbol angel demon ha made dan brown international bestselling sensation.apr 23 2014 dan brown help answer that question inferno having fictional professor robert langdon call attention one michelangelo 's ... just bible inspired dante inferno poem also inspired dan brown inferno . throughout novel dan brown us allusion dante ... literature many writer inspired other great literary work . ... inferno . throughout novel dan brown used many allusion dante.jul 18 2013 inferno hell is first part 14th-century dante alighieri 's epic poem divine comedy . it is followed purgatorio ... jul 12 2013 inferno throw robert langdon fire for italian adventure inspired dante alighieri 's divine comedy . heroic effort is ...,81400.0
on august 6 1945 united state dropped atomic bomb on hiroshima .,True,'re kid heart is about same size fist 're adult it 's about same size two fist . heart beat about 100000 time one day about 35 million time year . during average lifetime human heart will beat more than 2.5 billion time . 're kid heart is about same size fist 're adult it 's about same size two fist . heart beat about 100000 time one day about 35 million time year . during average lifetime human heart will beat more than 2.5 billion time .,g ampanozi 2018 cited 10 purpose several medical textbook state that human heart is approximately size that person 's fist . stating that heart ha size corpse 's ... sep 29 2014 9 answershold hand fist that 's size heart . heart beat average 100000 time day . heart pump equivalent 1 million ... stating that heart ha size corpse 's fist is thought signify that heart size is normal . we formulate two hypothesis that tested ... size heart is 'somewhat ' equal that clenched fist case average adult . is no connection between size two.jul 2 2009 every day heart beat about 100000 time sending 2000 gallon blood surging through body . although it 's no bigger than ... 5922 youtube uva medical center hour oct 5 2018 oct 5 2018 missing hand equivalentfebruary 13 2018. can big dog . compare dog 's heart it body mass it 's .8 percent elephant mouse human have .6 ... 1948how it wa `` ship asking will hoist dutch solved is interesting ... not wearing some type headdress place right hand heart anyway .,86500000.0
5 side triangle,False,,three-sided polygon is triangle . several different type triangle see diagram including equilateral all side equal length ... traduire cette page also known five regular polyhedron consist tetrahedron pyramid cube octahedron dodecahedron icosahedron . do triangle have 5 ... pentagon five side . number triangle contained pentagon = 5 2 = 3. adjoining figure pentagon abcde on joining ac ... 13 juin 2016 18rponsesa polygon ha many angle it ha side . for example triangle ha 3 side 3 angle . pentagon ha 5 side 5 angles.a quadrilateral ha 4 straight side ... because 2 triangle square . ... pentagon ha 5 side can made from three triangle ... example polygon triangle three-sided polygon quadrilateral four-sided polygon pentagon five-sided polygon hexagon six- ... 218 youtube moomoomath science 12 oct. 2017 12 oct. 201726 mai 2017 'll leave computation for 5-sided pentagon up . ... we can also see that 5 triangle meeting centre .,122.0
spaghetto is singular form word spaghetti,True,,it wa second animated feature film produced disney made after first animated success snow white seven dwarf 1937.pinocchio wa walt disney 's first animated feature film full color . answer false . first one wa snow white seven dwarfs.nov 11 2014 snow white seven dwarf will always first . disney 's second feature gave studio feature animation some it ... nov 29 2015 pinocchio directed ben sharpsteen hamilton luske . 88 minute . february 7 1940. story walt disney 's second animated feature need ... feb 7 2015 pinocchio is terrorized throughout movie four five villain torment get off unpunished . 21. film eventually made ... jan 11 2021 from disney 's first groundbreaking animated feature ... let 's take crash course film walt disney animation studio 'll ... walt disney first started what would become walt disney company 1923 began producing animated short film . studio 's first feature length ... walt disney 's version pinocchio . disney walt . ... film soon became first animated feature win competitive ... color pictorial wraps.as we celebrate 75 year walt disney 's pinocchio 1940heralded many ... some work put walt 's second full-length animated feature ... pinocchio directed norman ferguson t. hee wilfred jackson ... walt disney feature animation - 500 s. buena vista street burbank california usa .,506000.0
monkey wa first non-human go space,False,addition three principal island new york citymanhattan island staten island part long islandeach borough contains several smaller island . new york city contains about 36 42 island total . addition three principal island new york citymanhattan island staten island part long islandeach borough contains several smaller island . new york city contains about 36 42 island total .,new york city is composed five borough bronx brooklyn manhattan queen staten island . each borough is coextensive with respective county ... dec 14 2021 dec 14 2021 new york city contains about 36 42 island total . ... east river between borough manhattan queen new york city.oct 11 2011 between 36 42 island according other island new york city stuart miller sharon seitz.long island comprised nassau suffolk county new york state wa never part new york city . suffolk county on eastern end long island ... city new york is hereby divided five borough designated respectively manhattan bronx brooklyn queen staten island.nov 3 2019 although 4 out 5 borough larger island part long island rarely doe anyone see new york city archipelago many ... 1832 chronology historical27 42 n. lick america situated between mexicato town cayuga county new york . can state on north colombia on catskill ...,372000000.0
doe rainbow have 7 colour,True,people with acrophobia have intense fear situation that involve height such being tall building using ladder . like other specific phobia acrophobia is treatable with psychological therapy called exposure therapy . people with acrophobia have intense fear situation that involve height such being tall building using ladder . like other specific phobia acrophobia is treatable with psychological therapy called exposure therapy .,acrophobia is extreme irrational fear phobia height especially one is not particularly high up . it belongs category specific ... 12 jun 2022 acrophobia is defined fear height . unlike specific phobia such aerophobia which is fear flying acrophobia can cause ... 27 mar 2019 acrophobia describes intense fear height that can cause significant anxiety panic . some researchtrusted source suggests ... 27 jul 2020 acrophobia is intense fear height . person ha acrophobia being high up thinking about height may cause have panic ... 12 sept 2019 definition acrophobia is simply put phobia height . suffer from acrophobiathe word come from greek word for ... 26 jun 2022 acrophobia is excessive fear height manifest severe anxiety . person could have attack just walking up stair climbing ... 3 mar 2021 acrophobia is fear height . fear is excessive situation persistent can cause person avoid situation where ... 10 jun 2020 individual with acrophobia typically feel intense fear distress around height tend avoid result . also symptom ... 5 sept 2017 one most common phobia world acrophobia from greek word kron meaning peak summit edge phbos fear ...,1160000.0
pluto is pet dog mickey mouse,True,,pluto is mickey mouse 's pet dog . unlike goofy is not anthropomorphic dog . is fact only member sensational six that behaves like ... after chain gang pluto popped up rightful role household pet picnic 1930but wa named rover belonged not mickey minnie ... sep 26 2014 perhaps pluto 's time dog is due fact that ha owner mickey ha been unable evolve while goofy may have never had ... feb 17 2021 pluto is mickey 's pet . just like many have pet dog home mickey doe well . dog man 's best friend can mouse 's ... is mickey mouse 's pet . officially mixed-breed dog made debut bloodhound mickey mouse cartoon chain gang . together with mickey mouse ... mar 19 2015 pluto big goofy dog disney fame is old guessed right said 85 year old . walt disney production created pluto pup ...,1380000.0
sex city star kim cattrall is from california,False,,traduzir esta pgina kim victoria cattrall is british canadian actress . is best known for role samantha jones on hbo 's sex city 19982004 ... 5 de mai . de 2022 for six season two movie kim cattrall put sex sex city while adding dose glamour surprising relatability ... 3 de jun . de 2022 timeline kim cattrall sarah jessica parker 's rumored sex city feud . madison feller savannah walsh . jun 3 2022.traduzir esta pgina 21 de set . de 2020 21 de set . de 2020 `` sex city '' star kim cattrall make network tv debut fox 's `` filthy rich '' cunning matriarch televangelist family.traduzir esta pgina 4 de mai . de 2022 4 de mai . de 2022 finally said 'you 're making mistake here ' '' told variety . went on star for six season is absent from show 's reboot `` ... 4 de mai . de 2022 pasadena california - january 07 kim cattrall 'filthy rich ' speaks during . amy sussman/getty image entertainment/getty image .,497000.0
ear nose continue grow throughout life,True,,height doe n't change after puberty well anything we get shorter we age ear nose always lengthening . that 's due gravity not actual growth . age gravity cause cartilage ear nose break down sag . result droopier longer feature . height doe n't change after puberty well anything we get shorter we age ear nose always lengthening . that 's due gravity not actual growth . age gravity cause cartilage ear nose break down sag . result droopier longer features.24.06.2016 truth is that yes we age nose ear do get bigger not because growing . real reason is common ... 01.11.2021 nose ear indeed change get older it is n't that 're growing . instead what 're seeing is effect skin change ... bone may stop growing after puberty cartilage continues get bigger age say dr. arthur perry named one `` best doctor ny ... 15.01.2015 while rest body shrink we get older nose earlobe ear muscle keep getting bigger . that 's because 're made mostly ... most u will stop growing around age 20 . ... 's no way for bone continue grow even small bone ear nose.von c niemitz 2007 zitiert von 57 human ear grow throughout entire lifetime according complicated sexually dimorphic pattern -- conclusion from cross-sectional analysis.17.07.2013 more controversially it ha been suggested that because unlike bone cartilage continues grow ear made cartilage that may also ... originally answered do ear nose grow throughout life haha .. yes . answered one few time . grow because made cartilage ... not only that ear will continue growing generally linear fashion throughout entire life . however growth begin slow down ...,31100000.0
singer lady gaga ha up date played no le than 5 movie,True,hair fingernail may appear longer after death not because still growing . instead person fingernail hair may appear longer because skin around ha retracted according dermatology clinic uams . after death dehydration cause skin other soft tissue shrink . hair fingernail may appear longer after death not because still growing . instead person fingernail hair may appear longer because skin around ha retracted according dermatology clinic uams . after death dehydration cause skin other soft tissue shrink . 8 mar 2019,26 may 2013 yet amidst sign that no more fingernail continue lengthen hair grows we 're told.nails hair may appear keep growing is because flesh shrink it dry out retracting skin make nail hair appear longer.15 dec 2016 short answer is no though it may not seem that way casual observer . that 's because after death human body dehydrates ... 31 dec 2018 while it is true that hair nail composed lifeless keratin process make requires activity from germinal matrix ... 10 june 2013 it 's rather confronting see first dead body body part . wa uni saw mine . it wa lab session for subject such ... 7 may 2014 hair nail stop growing pretty much soon die . both nail hair grow from base up new cell develop push old ... 12 jan 2010 it is myth that fingernail hair continue grow after death . what really happens is that skin may retract around making ... ask mortician- do hair nail grow after deathhttps//www.youtube.com watchhttps//www.youtube.com watch4 mar 2018 it come up lot long after it 's been thoroughly debunked just case missed memo no nail hair do n't continue ...,26300000.0
goldfish have two second memory,False,goldfish known for orange hue terrible memory . one common saying even claim that these creature have mere 3-second recall . however is complete myth that despite it lack scientific backing ha spread widely remained largely undisputed public for decade . goldfish known for orange hue terrible memory . one common saying even claim that these creature have mere 3-second recall . however is complete myth that despite it lack scientific backing ha spread widely remained largely undisputed public for decade . 22 may 2021,27 oct 2019 is popular belief that goldfish only have 3 second memory . humble goldfish may not only have longer memory than most people ... 30 aug 2018 most goldfish keeper will have heard fact that goldfish memory span just three second long is it true13 may 2013 answer is very definite no ! scientist have proven that goldfish memory span nowhere near short three second . goldfish can ... 18 feb 2008 is popular belief that goldfish only have three-second memory span every lap fishbowl is like seeing world for ... 1 apr 2016 3 answers5 sept 2020 nevertheless expression still life on even though study presented post suggest that it 's myth . while concept ... conclusion goldfish do n't have memory span 2 3 10 second . basis common misconception is not known it is beneficial know that ...,6170000.0
jason momoa portrays khal drogo 'game throne ',True,milhouse mussolini van houten is recurring character simpson minor character simpson movie . is ten year old boy bart simpson 's best friend . milhouse mussolini van houten is recurring character simpson minor character simpson movie . is ten year old boy bart simpson 's best friend . relative parent kirk van houten luann ... alias lou la trec eagle eye maestro cj ... occupation student springfield elementary ... first appearance `` butterfinger group '' ...,milhouse mussolini van houten is major character from highly-acclaimed popular animated show simpson . is best friend bart simpson.milhouse is bart simpson 's best friend mrs. krabappel 's fourth grade class springfield elementary school . is insecure gullible ... 22 jul 2022 milhouse mussolini van houten born july 4 is bart simpson 's best friend . only child kirk luann van houten milhouse 's most ... 30 nov 2016 take bart 's best friend put-upon cohort milhouse van houten simpson fan favorite apparently wa n't even created for simpson ... 12 jun 2020 12 jun 2020 bart simpson 's best friend is blue-haired milhouse van houten . like many simpson character 's had it tough.4 answers21 nov 2020 simpson fan well acquainted with friendship between bart simpson milhouse van houten . boy best friend while ... bart simpson milhouse van houten 's friendship - youtubehttps//www.youtube.com watchhttps//www.youtube.com watch,98200.0
minnie mouse full name is wilhelmina mouse,False,it 's one disney 's shortest feature film ever . just 64 minute long `` dumbo '' is one shortest disney feature film ever created . average disney film typically run between 80 90 minute . just 64 minute long `` dumbo '' is one shortest disney feature film ever created . average disney film typically run between 80 90 minute . jan 15 2019 distributed walt disney company story helen aberson-mayer,oct 23 2018 dumbo 's success wa truly spectacular ! only 64 minute long it still hold title shortest disney feature-film date.dumbo is 1941 american animated fantasy film produced walt disney production ... 64 minute it is one disney 's shortest animated features.mar 21 2021 dumbo is disney 's shortest feature . just 64 minute long it 's shortest feature-length disney movie . walt wa advised extend ... it story animation were deliberately simple 64 minute it is one disney 's shortest full length feature . upon release dumbo wa major ... dumbo dumbo is 1941 animated disney film with unforgettable character scene . dumbo main character is born accident circus mother ... mar 18 2019 just over hour dumbo is shortest feature-length disney movie . walt wa ... oct 28 2020 watching dumbo following technically advanced innovative disney film prior is eye-opening experience . released 1941 dumbo is ... dumbo american animated musical film released 1941 that wa produced walt disney wa based on child 's book same name written ... what is shortest disney animated movie 6. dumbo is disney 's shortest feature . just 64 minute long it 's shortest feature-length disney movie .,32000.0
galapagos tortoise sleep up 16 hour day,True,octopus have three heart which is partly consequence having blue blood . two peripheral heart pump blood through gill where it pick up oxygen . central heart circulates oxygenated blood rest body provide energy for organ muscle . octopus have three heart which is partly consequence having blue blood . two peripheral heart pump blood through gill where it pick up oxygen . central heart circulates oxygenated blood rest body provide energy for organ muscle .,octopus have three heart one pump blood around body other two pump blood gill . reason for impressive cardiac hardware ... octopus have 3 heart because two pump blood gill larger heart circulates blood rest body . octopus have 9 brain because ... octopus have blue blood three heart doughnut-shaped brain . these n't even most unusual thing about ! jan 22 2019 giant pacific octopus ha three heart nine brain blue blood making reality stranger than fiction . thing know about giant ... nov 12 2021 nov 12 2021 circulatory system is just unusual . octopus ha multiple heart that fact can reveal secret about evolutionary ... missing seven seven250 youtube science with mr. harris feb 25 2021 feb 25 2021well is one main heart called systemic heart which act much like own heart pumping blood throughout body . addition octopus have two ... oct 31 2013 2 octopus have three heart . two heart work exclusively move blood beyond animal 's gill while third keep ...,38400000.0
prince eric ariel from little mermaid have daughter named princess song,False,,beauty beast opened on broadway palace theatre on 18 aprl 1994 ran venue 5 september 1999 before transferring lunt-fontanne where it finally closed on 29 july 2007 clocking up staggering 5461 performance . beauty beast opened on broadway palace theatre on 18 aprl 1994 ran venue 5 september 1999 before transferring lunt-fontanne where it finally closed on 29 july 2007 clocking up staggering 5461 performance . 10 mar 2017original broadway production 1994-2007 beauty beast is disney stage musical with music alan menken lyric howard ashman tim rice ... verstt den hr sidan broadway revival broadway revival broadway revival musical opened on broadway palace theatre on april 18 1994 ran until september 5 1999 transferring lunt- ... classic wa first disney animated feature made live stage musical disney theatrical production wa storming success.this first disney 's stage adaptation is based on on 1991 animated disney film which wa adapted from french fairy tale jeanne-marie ... verstt den hr sidan after 13-year run first disney musical arrive on broadway beauty beast play it final performance july 29. closure will allow ... 20 apr . 2022 menken tim rice . original broadway production ran for over thirteen year wa nominated for nine tony award including best musical ... first seen on broadway 1994 where it played remarkable 13-year run it ha now been produced 37 country worldwide . brand-new production beauty ...,12.0
carnivore animal eater,False,,chimpanzee have also flown . on 4 june 1949 albert ii became first monkey space died on reentry parachute capsule failed . two other monkey albert iii iv also died rocket failed . mouse wa launched space on 15 august 1950 did not survive return journey . chimpanzee have also flown . on 4 june 1949 albert ii became first monkey space died on reentry parachute capsule failed . two other monkey albert iii iv also died rocket failed . mouse wa launched space on 15 august 1950 did not survive return journey . animal space originally served test survivability spaceflight wide variety animal have been launched space including monkey ape ... 2022/01/27 first animal space wa not laika despite fame . ... first mammal reach space wa rhesus monkey named albert ii ... 2022/06/12 able baker were first monkey survive spaceflight . went space on may 28 1959 aboard jupiter-irbm am-18 from ... 2015/04/29 though far le famous than later non-human astronaut first animal space were group fruit fly launched altitude ... laika wa first we also sent these dog monkey other animal were sent space decade ago test whether it wa safe.the first animal space helped pave way for human follow . from fruit fly dog discover animal astronaut that pioneered space travel.while human space travel wa becoming safer thus more popular it did not put complete halt primate experiment space . large squirrel monkey ... 2014/04/03 before human actually went space one prevailing ... fair amount press first monkey live through space flight .,34900000.0
herbivore animal consume meat,False,,with very few exception such koala no other strictly herbivore . although animal do not hunt will eat meat opportunity present itself . opportunistic carnivore include panda deer cow goat chicken duck . with very few exception such koala no other strictly herbivore . although animal do not hunt will eat meat opportunity present itself . opportunistic carnivore include panda deer cow goat chicken duck . 19 fvr . 202119 sept. 2018 herbivore will occasionally eat meat even 's plenty vegetation left . yes course - hungry animal will eat whatever is available most ... 16 nov. 2012 herbivore eat plant carnivore eat meat few oddball omnivore that eat both . dichotomy plant-eaters meat- ... herbivore can not eat meat because have teeth specialized for grinding plant not meat . move meat next level digestion where ... 20 oct. 2016 classification herbivore v carnivore is one earliest biology lesson we 're taught school . herbivore eat plant ... 27 mar 2015 it turn out load herbivorous animal eat meat get chancelorikeets just most recently reported ... traduire cette page do herbivore ever eat animal do herbivore ever eat animal do herbivore ever eat animal herbivore eating meat vegan even herbivore eat meat ! 6 vegetarian animal that will give nightmare ... 15 avr . 2014 animal that eat plant herbivore animal that eat meat carnivore while animal like u eat anything omnivore . simple .,1.0
