question,truthValue,snippet,description,results
is no english word that rhyme with orange,True,,2014/04/30 human murder around 475000 other people each year . snake kill around 50000 while dog mainly from rabies transmission claim another ... 2017/08/18 nicely illustrated infographic gatesnotes mosquito kill least 725000 person every year whereas snake kill estimated ... 2019/07/10 mosquito every ill it bearsnot just plasmodium more than dozen virus from lethal yellow fever pregnancy-ravaging zika ... planet wa vastly different from one we currently inhabit were most animal that called it home . we navigate evolution life on ... 2019/07/29 mosquito . insect estimated have killed more people than any other single cause.illustration ariel davis.2022/07/12 west nile virus cause mild illness most people rare case ... now more than ever monitoring mosquito specie is vital ... it come killing human no other animal even come close . ... more than 2500 specie mosquito mosquito found every ... 2019/08/24 mosquito ha killed more people than any other cause death ... erased from historical record would have no wild ... no animal on earth ha touched more human life than mosquito . more people have died from mosquito-borne disease than all have been killed all ... transmitting disease mosquito cause death more people than any other animal taxon over 700000 each year . it ha been claimed that almost half ...,6440000.0
10297 balloon were used floating sequence for movie 'up ! ',True,day before computer-generated effect film crew had rely on practical trick simulate snow . scene which dorothy is awakened poppy field blanket snow engineered glinda good witch production reportedly used chrysotile asbestos . day before computer-generated effect film crew had rely on practical trick simulate snow . scene which dorothy is awakened poppy field blanket snow engineered glinda good witch production reportedly used chrysotile asbestos . 23 aug 2019,12 mar 2021 poppy scene wizard oz ha become infamous over year after viewer learned that fake snow scene wa 100 asbestos.17 sept 2014 movie wizard oz contained lethal asbestos exposure scene where snow made from100 industrial-grade chrysotile asbestos fell ... 12 mar 2021 snow 1939 's wizard oz wa made using toxic mineral asbestos . lot ha changed entertainment world since ... fake snow wa made up from industrial-grade white asbestos fibre unfortunately for actor production team everyone came contact with ... 15 apr 2021 1939 classic wizard oz used asbestos unique way fake snow . production team dropped thread asbestos from ceiling ... 15 nov 2021 famous poppy field scene which dorothy fell asleep snow used camera shot wa made from 100 industrial-grade ... 3 dec 2021 yes real lion pelt it wa very heavy hot inside it result . upvote 811 sept 2021 film snowfall triggered glinda good witch awakens dorothy lion from poppy-induced sleep . unfortunately scene ...,36100000.0
only letter not periodic table is letter j,True,,letter j q not found on periodic table . letter j q only two letter not found on periodic table . these letter do not occur either element symbol element name . letter j q not found on periodic table . letter j q only two letter not found on periodic table . these letter do not occur either element symbol element name . 14 juni 20201 dec. 2019 letter `` j '' is only one not found on periodic table . some country e.g . norway poland sweden serbia croatia ... 8 sep. 2018 letter j q only two letter not found on periodic table . these letter do not occur either element symbol element name . continue ... 28 apr . 2019 only two letter not on periodic table j q ... letter j get no respect . ... thats probably because element used `` ... fun fact ! only letter that ... - msu science festivalhttps//www.facebook.com ... videoshttps//www.facebook.com ... videos15 dec. 2019 one letter not found element name symbolsthe letter `` j '' is only one not found on periodic table . some country e.g .... not only that it is not used atomic symbol it is not part any element name . letter q ha least one mention temporary name element 114 ... 27 juli 2020 temporary element name such ununquadium contain letter . however no element name start with q no official element name contains ... 28 okt . 2019 letter `` j '' is only one not found on periodic table . some country e.g . norway poland sweden serbia croatia element ...,28.0
quill on porcupine africa long 3 pencil together .,True,since 2000 every year august finland ha organized mobile phone throwing world championship . it also became official sport finland . many other country including austria belgium czech republic u embraced sport started national championship . since 2000 every year august finland ha organized mobile phone throwing world championship . it also became official sport finland . many other country including austria belgium czech republic u embraced sport started national championship . 22 oct 2021,world national championship mobile phone throwing is international sport that started finland year 2000. it 's sport which ... every year mobile phone throwing world championship many phone lose life vaulted distance up 80 yards.the mobile phone used championship original phone with battery . ... mobile phone throwing phenomenon speaks people interest ... mobile phone throwing world championship take place ... https//www.youtube.com watchhttps//www.youtube.com watch22 sept 2015 folk finland have made mobile phone throwing national sport . throwing is meant represent spiritual freedom which come from ... 25 aug 2016 believe it not mobile phone throwing is national sport competitor meet annually see can throw handset farthest.contest organizer provide contestant with mobile phone throw world championship . include variety brand model all fitted ... related related swamp soccer tar barrel festival extreme ironing clauwau championship mobile phone throwing air guitar championships.vol . 121 no . 4 magazine,6210000.0
madonna 's real name is madonna,True,,2021/01/17 dolly parton miley cyrus have cutest relationship . plastic heart singer ha always referred parton godmother ... 2021/04/10 fan may surprised learn that dolly parton is miley cyrus 's godmother . find out sweet story behind special connection ! 2022/06/04 country legend dolly parton is miley cyrus ' godmother . parton said wa given that role due close relationship with cyrus ' father ... 2021/04/16 dolly opened up about special bond 2019 interview with siriusxm 's just jenny explaining came miley 's godmother after ... 2022/02/13 dolly parton became miley cyrus ' godmother ... miley grew up around country music . father billy ray cyrus regularly performed toured ... 2021/09/15 miley cyrus paid tribute godmother dolly parton wa included on 2021 time100 list featuring 100 most influential people ... 2021/01/21 dolly parton 75 is pop star miley cyrus ' godmother . miley wa born same year that father 's song achy breaky heart wa released while ... 2020/11/10 parton played cyrus ' character 's aunt dolly on show for three episode from 2006 2010. while called aunt wa actually ... 2020/06/27 dolly parton is not actually related cyrus family blood close familial bond wa made miley 's godmother . fact ...,112000.0
star sign aquarius is represented tiger,True,aquarius january 20 - february 18 personality according chinese zodiac tiger smart sophisticated . combing with aquarius sign western astrology tend like thinking creativity make become outstanding inventor . personality according chinese zodiac tiger smart sophisticated . combing with aquarius sign western astrology tend like thinking creativity make become outstanding inventor .,may 12 2018 aquarius tiger people always charming constantly want others ' approval sure . active competitive these ... cheerful aquarius-tiger radiates love for everything around . even just being with is happiness not mention close friendship.jan 26 2022 aquarius can both diligent surprising being ruled saturn uranus . aquarius energy is defined breaking from tradition ... aquarius born during year tiger ... tiger born during cycle aquarius represented primal astrology panther . panther more ... privacy notice governs membership influencer panel which can access here . website us cooky . like offline world cooky make ... aquarius is eleventh astrological sign zodiac originating from constellation aquarius . under tropical zodiac sun is ... conventional aquarian tiger character take on courage resilience associated animal . it also incorporates independence farsightedness ... sep 13 2019 aquarius is eleventh zodiac sign represents were born between january 20th february 18th . sign always relates ... mar 5 2021 star sign aquarius is represented tiger . true false . 1. see answer . unlocked badge showing astronaut 's boot touching down ...,3260000.0
south africa ha one capital,False,covering approximately 20 percent earth 's surface atlantic ocean is second largest ocean basin world following only pacific . however it is only slightly larger than half size pacific ocean . covering approximately 20 percent earth 's surface atlantic ocean is second largest ocean basin world following only pacific . however it is only slightly larger than half size pacific ocean . 26 feb 2021,26 feb 2021 pacific ocean is largest deepest world ocean basins.atlantic world atlantic ocean is second-largest world 's five ocean with area about 106460000 km2 41100000 sq mi . it cover ... atlantic ocean is second-largest ocean on earth accounting for one fifth earth 's surface 29 earth 's water . united state is le ... 4 june 2010 world 's second largest ocean atlantic ocean cover about 21 percent earth 's surface . separating north south america from europe ... 18 mar 2019 second-largest ocean on earth atlantic drive weather pattern including hurricane is home many specie from sea ... 1 june 2022 pacific ocean is largest ocean world taking up much area atlantic ocean indian ocean combined . ocean is ... 16 june 2021 pacific ocean . area 63800000 square mile 165250000 square kilometer . pacific ocean is largest ocean world atlantic ... pacific ocean represents 45 percent global ocean coverage . it is also largest body water single biggest feature on planet earth . ... 7 june 2022 three recognized major ocean pacific atlantic indian ocean basin . these obviously biggest that order .,11400000.0
mercury is hottest planet solar system .,True,,violet is color light short wavelength end visible spectrum between blue invisible ultraviolet . it is one seven color that ... purple is mixture red which is opposite side spectrum than violet blue which is relatively far from violet it is term ... 20 mar 2022 violet is sixth color rainbow -- it is color on inner edge rainbow . violet is color between blue purple.in art violet is colour on conventional wheel located between red blue opposite yellow it complement . pigment for violet come from ... violet is color light short wavelength end visible spectrum between blue invisible ultraviolet . it is one seven color that ... preferred for it uplifting imaginative quirky quality violet is multifaceted color come . though many believe that violet purple ...,141000000.0
pacific is deepest ocean,True,,jan 26 2022 on average jellyfish will live anywhere from 1-3 year . however certain specie will only live few day while others able live for ... 3 day ago rougheye rockfish sebastes aleutianus one longest living fish have maximum lifespan least 205 year according ... life cycle most jellyfish specie is similar . ... it wa 100 year later 1980s that immortality wa accidentally discovered.sep 16 2021 while human have average life expectancy 72 year according ... jellyfish turritopsis dohrnii ha no brain heart is ... apr 23 2019 from tuatara specie `` immortal '' jellyfish here some animal ... lifespan wild range from 30 40 years.jun 12 2021 mentioned earlier lifespan jellyfish depends on specie basically range from just few hour several month up years.feb 28 2013 it name is literal turritopsis nutricula is biologically immortal . immortal jellyfish can theoretically live forever thanks process ... mar 2 2016 moon jellyfish can age backward form horde clone regenerate lost body part new study says.feb 11 2016 various specie these spindly creature including red urchin known live 100 year longer without any biological sign ... jul 2 2013 immortal jellyfish turritopsis dohrnii formerly known turritopsis nutricula 1 specie jelly turritopsis dohrnii ...,2530000.0
it took eight month from start finish produce 1959 disney film sleeping beauty,False,it wa second animated feature film produced disney made after first animated success snow white seven dwarf 1937. plot involves old italian woodcarver named geppetto carves wooden puppet named pinocchio . it wa second animated feature film produced disney made after first animated success snow white seven dwarf 1937. plot involves old italian woodcarver named geppetto carves wooden puppet named pinocchio . based on adventure pinocchio ca ... production company walt disney production release date february 7 1940 center thea ...,adapted from novel c. collodi it chronicle adventure wooden puppet whose lonely maker geppetto wish were real boy.pinocchio 1940 disney 's second feature-length animated film followed after success snow white seven dwarf 1937 wa produced during ... living puppet with help cricket conscience must prove worthy become real boy.a living puppet with help cricket ... character pinocchio character pinocchio character pinocchio film star puppet - brought life fairy - try earn right become real boy face ... missing color color11 nov 2014 snow white seven dwarf will always first . disney 's second feature gave studio feature animation some it ... 26 june 1992 many people choose `` snow white seven dwarf '' favorite feature cartoon from disney 's golden age . my choice is `` pinocchio . '' ... 7 feb 2015 upon it new york city premiere on february 7 1940 critic hailed film masterpiece even day many prefer it disney 's ... pinocchio 's lie 1940 classic disney animation hd - youtubehttps//www.youtube.com watchhttps//www.youtube.com watch,549000.0
octopus ha three heart,True,,octopus 's three heart have slightly different role . one heart circulates blood around body while other two pump it past gill pick up oxygen . octopus 's three heart have slightly different role . one heart circulates blood around body while other two pump it past gill pick up oxygen.octopuses have three heart one pump blood around body other two pump blood gill . reason for impressive cardiac hardware ... octopus have three heart which is partly consequence having blue blood . two peripheral heart pump blood through gill where it pick up ... octopus have 3 heart because two pump blood gill larger heart circulates blood rest body . octopus have 9 brain because ... 22 de jan. de 2019 giant pacific octopus ha three heart nine brain blue blood making reality stranger than fiction . thing know about giant ... 23 de mar . de 2022 two heart creature made for gill used pump blood . apart from is third heart centre which ... octopus ha three heart is collection fourteen short story thread continuity that run through each is described book 's ... octopus ha three heart offer dispatch from margin human society . these story about damaged people have committed witnessed ... compre online octopus ha three heart short story de rose rachel na amazon . frete grtis em milhares de produtos com o amazon prime .,8680000.0
banana available color other than yellow,True,,waldorf salad is fruit nut salad generally made fresh apple celery walnut grape dressed mayonnaise traditionally served on bed ...,37100.0
mamenchisaurus hochuanensis is dinosaur that ha longest neck lived what is now china,True,,letter `` j '' is only one not found on periodic table . some country e.g . norway poland sweden serbia croatia element iodine is known name jod . however periodic table still us iupac symbol for element . letter `` j '' is only one not found on periodic table . some country e.g . norway poland sweden serbia croatia element iodine is known name jod . however periodic table still us iupac symbol for element . 1 dec. 201914 juni 2020 letter j q not found on periodic table . letter j q only two letter not found on periodic table.20 aug. 2015 letter `` j '' is only one not found on periodic table . some country e.g . norway poland sweden serbia croatia element iodine is known ... 15 dec. 2019 only letter that doe n't appear on periodic table is j. one letter not found element name symbolsthe letter `` j '' is only ... 7 nov. 2019 is letter j missing from periodic table ... letter j q only two letter not found on periodic table.fun fact ! only letter that ... - msu science festivalhttps//www.facebook.com ... videoshttps//www.facebook.com ... videosnot only that it is not used atomic symbol it is not part any element name . letter q ha least one mention temporary name element 114 ... noel botham 2006 humorthe letter j doe not appear anywhere on periodic table element . letter w is only letter alphabet that doe n't have one syllable ... mitchell symons 2020pecans only food that astronaut do not have treat ... j is only letter which doe n't appear anywhere periodic table element .,742.0
butterfly not bird,True,,1 respostabutterflies not considered bird because lack key feature characteristic that evident all bird species.19 de set . de 2020 butterfly can fly with wing just like bird do . butterfly have scale on wing actually have sharp edge . ... is butterfly not bird answer insect have two pair wing while bat bird each have one pair . butterfly wing covered ... family feature magnificent bird that usually associated with coastal habitat . albatross among largest flying bird great ... biodiversity is not only important it own right it also provides society with wide range ecosystem service upon which we depend such food ... 11 de mar . de 2021 new study show bird can learn recognize these visual cue avoiding not only butterfly failed nab past ... 8 de out . de 2015 impressive migrating monarch . most butterfly do not migrate . have ability overwinter larva pupa even adult ... de v pellissier 2020 citado por 24 increase abundance n2000 coverage increased correlated with specialization index for bird not for butterfly .,34100000.0
capital australia is sydney,False,,amazon is considered world 's largest river volume scientist have believed it is slightly shorter than africa 's nile . brazilian scientist ' 14-day expedition extended amazon 's length about 176 mile 284 kilometer making it 65 mile 105 kilometer longer than nile . amazon is considered world 's largest river volume scientist have believed it is slightly shorter than africa 's nile . brazilian scientist ' 14-day expedition extended amazon 's length about 176 mile 284 kilometer making it 65 mile 105 kilometer longer than nile . 17.06.2007the amazon might also world 's longest riverdepending on whom ask . most scientist believe south american river is least 4000 mile 6400 km ... which is longer nile amazon river nile used considered longest river world with 6695 kilometre amazon ... 08.08.2018 it ha only been since 2007 that amazon ha been considered longest river world . for year river actually came second ... top 10 longest river world nile river is longest river world whereas amazon is largest river world . river is ... 09.07.2014 longest river world measured from it mouth it most distant year-round source is likely amazon which flow 4345 mile ... two longest river world nile flowing mediterranean amazon flowing south atlantic . which is longer is more ...,37400000.0
century consists one hundred year,True,,start end century century is period 100 year . century numbered ordinally english many other language . word century ... recurring once every 100 year centenary celebration . noun plural centenary . centennial . period 100 year century.8 sept 2018 century is period 100 year derived from latin word centum meaning one hundred . therefore decade is 10 year century is 100 year ... consisting hundred year completing that term . pertaining hundred year . happening every hundred year . anniversary meaning for both ... century is period hundred year that is used stating date . for example 19th century wa period from 1801 1900.23 jul 2022 century is period 100 year . ... word century come from latin centum meaning one hundred . century is sometimes abbreviated ... century is period hundred year for example 19th 20th century . 19th century includes year between 1901-2000. whereas period lasting ... era age usually made up more than one century one hundred year . we find out about age era we can learn about what happened ... 100 second century began with year a.d. 101. while period 1900-1999 is course century is any period 100 year it is incorrect label ...,1180000000.0
every country world ha rectangular flag,False,,06.08.2019 4antworten30.04.2020 1 - chamber secret 2002 - 2 hour 41 minute 161 minute 2 - goblet fire 2005 - 2 hour 37 minute 157 minutes.harry potter chamber secret is 2002 fantasy film directed chris columbus ... film ha longest runtime series.26.02.2022 most popular one is harry potter chamber secret which is about 161 minute long . it only movie series that ... 30.04.2020 1 - chamber secret 2002 - 2 hour 41 minute 161 minute 2 - goblet fire 2005 - 2 hour 37 minute 157 ... 12.02.2021 david hayman producer all harry potter film wa asked about ... harry potter chamber secret extended version.for example harry potter chamber secret is longest movie despite it being second-shortest books.25.11.2020 fourth longest all eight film story clock beefy 152 minute -- over two half hour . it 's substantial length ... 29.05.2022 second longest movie is harry potter chamber secret it 's 161 minute long . shortest film is harry potter ... shirley raye redmond 2012 young adult nonfictionfilm . god goddess asgard have enjoyed long career marvel comic ... lockhart 2002 movie harry potter chamber secret .,2030000.0
theory it take over 5000 helium balloon lift average-sized human from ground,True,that railway never came pas it led new route connect america what would become known longest road world stretching 19000 mile from alaska tip argentina . yet it 's panama canal that get all pan-american attention history book . that railway never came pas it led new route connect america what would become known longest road world stretching 19000 mile from alaska tip argentina . yet it 's panama canal that get all pan-american attention history book .,it 's network road covering almost 30000 kilometre 19000 mi from north america south america . it 's said longest road on earth.apr 5 2016 according guinness world record pan-american highway is world 's longest motorable road.it is listed guinness book world record longest motorable road world . while pan-american highway doe n't have route through ... apr 27 2022 stretching from frozen north alaska glacial tip argentina pan-american highway run most mile kilometre ... pan-american highway is series route that pas through mexico guatemala honduras nicaragua costa rica panama north america ... jun 5 2022 longest longest `` motorable '' road world per guinness record length 15000-19000 mile 24000-30000 kilometer northern ...,6860000.0
someone from usa consumed over 26000 big mac after eating one day for forty year,True,,30 jun 2022 while shark not mammal certain type called viviparous shark such hammerhead shark do give birth live young.sharks not mammal shark fish . shark lack mammalian characteristic such hair lung do not produce milk . being fish shark have ... 8 oct 2020 no shark not mammal . all specie shark classified fish . shark do not have mammary gland do not feed young ... dolphin whale seal sea lion otter all mammal . give birth live young nurse young with milk . contrast shark fish.17 nov 2021 shark mammal fish ... already discussed above shark fish meaning that shark not mammal . ... mammal from mammalian ... shark not mammal do not posse any characteristic feature that define mammal . for instance not warm-blooded . shark ... 3 answersmost people think shark mammal give birth young one pup some do lay egg . all specie 70 shark bear live one ... we have explained shark not mammal . shark is cartilaginous fish . skeleton shark is n't made up bone cartilage . some specie ...,11000000.0
