question,truthValue,snippet,description,results
first speeding ticket wa 1896 for driving 8mph,True,model t wa introduced world 1908. henry ford wanted model t affordable simple operate durable . vehicle wa one first mass production vehicle allowing ford achieve aim manufacturing universal car . model t wa introduced world 1908. henry ford wanted model t affordable simple operate durable . vehicle wa one first mass production vehicle allowing ford achieve aim manufacturing universal car .,1896 quadricycle first automobile that henry ford built came symbolize all later success achieved mr. ford ford motor company . ... 26 mar 2020 henry ford established ford motor company 1903 five year later company rolled out first model t. ford introduced ... 1896 founder ford motor company built first car took it for spin on street detroit . ... it wa only 45 inch wide 43 inch high ... 18 nov 2019 henry ford generally get credit for first assembly line production car en masse with model t 1908. stephen corby.8 july 2015 ford is credited with bringing car mass which transformed driving from pastime for rich integral part daily life ... 25 apr 2022 widely regarded first automobile that wa affordable for middle-class american ford model t occupies important place ... 27 apr 2017 henry ford wa american automobile manufacturer created model t 1908 went on develop assembly line mode ... henry ford built first automobile which called quadricycle home detroit 1896. location ha been redeveloped where michigan ... 6 apr 2022 henry ford wa american industrialist businessman founded ford motor company . invented model t car moving assembly ...,28300000.0
roz frasier wa originally going played lisa kudrow,True,neighbour first aired wa much speculation about whether show wa set melbourne sydney it wa n't until 1994 that script confirmed that fictional suburb wa located melbourne . neighbour first aired wa much speculation about whether show wa set melbourne sydney it wa n't until 1994 that script confirmed that fictional suburb wa located melbourne .,k slayton 2022 neighbour ha been filmed pin oak court since series began 1985 it ha since become popular with tourist . tour cul-de-sac run ... 3 day ago neighbour is australian soap set fictional area melbourne called erinsborough . advertisement . fan across uk sad about ... jan 29 2018 filmed melbourne australian show neighbour ha graced television set all over world for over 30 year follows life ... feb 8 2022 while interior scene for neighbour filmed nunawading-based studio also located melbourne most filming is done on ... mar 7 2022 yet instagram post kate kendall starred lauren turner from 20032018 before going on direct later produce show ha ... on 27 august 2010 neighbour filmed scene sydney 's darling harbour on board cruise ship . episode marked only third time that show ... mar 3 2022 australian soap neighbour will shoot it final scene june following record 37-year run after producer fremantle failed secure ...,17100000.0
united kingdom is almost same size france,False,film producer disney hold record for most academy award earned individual having won 22 oscar from 59 nomination . wa presented with two golden globe special achievement award emmy award among other honor . film producer disney hold record for most academy award earned individual having won 22 oscar from 59 nomination . wa presented with two golden globe special achievement award emmy award among other honor .,walt disney 19011966 won received total twenty-six academy award hold record for most academy award history.walt disney 190166 won received total twenty-six academy award hold record for most academy award history . won total ... disney hold record for most academy award won individual film producer having won 22 oscar from 59 nominations.did know walt disney won total 26 academy award day hold record for most win most nomination for individual.as 2021 disney ha won total 135 academy award impressive number is that these 32 were won walt disney personally . is far ... 10 feb 2020 bong may have matched disney 's record most oscar won one night director ha long way go match disney 's record for ... 27 mar 2022 today walt disney company received six academy award 94th annual ceremony broadcast live on abc from dolby theatre ...,79400000.0
more country south america than africa,False,,alaska contains over 130 volcano volcanic field which have been active within last two million year . these volcano about 90 have been ... alaska contains over 130 volcano volcanic field which have been active within last two million years.these volcano catalogued on ... 12 aug 2021 all four located remote section aleutian . pavlof volcano located on peninsula is most active . episodic low-level ... alaska ha 80 percent all active volcano united state 10 percent found world . mount novarupta blew it top on june 6 ... 16 may 2018 alaska is home largest number potentially active volcano u.s. with 141 according alaska volcano observatory . while ... 2 dec 2021 state lie on pacific ring fire very seismically active region it also boast more than 40 active volcano with many more ... 1 feb 2019 california is second most volcanic region after alaska however it fall distant second place . compared 141 active volcano ... '' about 169 volcano united state that scientist consider active . most these located alaska where eruption occur virtually every ... most northern largest state united state alaska ha more glacier than any other state . alaska also ha more volcano than any other ...,2570000.0
fear height is called acrophobia .,True,,dec 1 2018 til amelia earhart eleanor roosevelt once sneaked out white house event commandeered airplane went on joyride baltimore.nov 14 2009 earhart broke up white house dinner party on april 20 1933 invited eleanor roosevelt go on flight baltimore back.eleanor roosevelt took many flight first lady . sometimes flew plane built carry president roosevelt reconfigured bomber called guess ... nov 18 2018 on short flight from baltimore aviator amelia earhart point out white house resident first lady eleanor roosevelt.apr 20 2022 on april night 1933 amelia earhart eleanor roosevelt slipped away from formal white house dinner for spontaneous flight ... public life before white house anna eleanor roosevelt wa american political figure diplomat activist . served first lady ... everyone went white house including had fingerprinted any reluctance undergo rather soiling process had always ... jul 26 2021 year wa 1933 amelia earhart wa invited white house event . midway through dinner earhart eleanor roosevelt sneaked out ... mar 5 2021 eleanor roosevelt went on joyride sneaking out white house event . true . 85. region human body which experience ... 23452 youtube funfilm mix oct 23 2017 oct 23 2017,81400.0
unit measurement for temperature is kelvin,True,,kelvin symbol k is si base unit temperature named after belfast-born university glasgow based engineer physicist william ... kelvin k base unit thermodynamic temperature measurement international system unit si . 2018 general conference on weight ... temperature energy kelvin symbol k is si unit temperature is one seven si base unit . it is defined fraction 1/273.16 ... apr 12 2010 kelvin k is defined taking fixed numerical value boltzmann constant k 1.380 649 1023 expressed unit ... may 8 2019 kelvin temperature scale is absolute temperature scale with zero absolute zero . because it is absolute scale measurement made ... kelvin symbol k is si unit thermodynamic temperature . it is defined taking fixed numerical value boltzmann constant k 1.380 ... nov 3 2020 kelvin k ordinarily we measure temperature degree centigrade c. scale two fixed temperature taken ice-point 0c ... kelvin is si unit thermodynamic temperature one seven si base units.mar 22 2021 new definition according general conference on weight measure is `` kelvin symbol k is si unit thermodynamic ... 18 answer,6140000.0
sense touch is activated eye .,False,,madrid is capital spain is home spanish royal family well spanish government . it is modern metropolitan city ... madrid is capital spain largest city country . it is also third-largest city european union after london berlin.madrid is capital spain administrative center madrid region . it is located central part iberian peninsula.as capital city spain many neighbourhood madrid . guide will help decide which is best for holiday taste . visit ... spain had no capital whatever capital it had established someone some point . madrid ha highest economic output country . madrid is ... spanish capital is one most populous european union cosmopolitan city where people over 180 nationality live together.25 jul 2020 after death francisco franco authoritarian rule came end democratic constitution wa adopted 1978. it madrid wa ...,482000000.0
astronaut ha played golf on moon,True,,traduire cette page tour de france is annual men 's multiple-stage bicycle race primarily held france ... all stage timed finish rider ' time ... tour ha often featured mix italian french alp always resulting epic day . `` on road tour de france '' tour is opportunity ... each year tour de france is staged for three week july usually 20 ... france where it finish occasionally only once year spain.8 juin 2022 according report gazzetta dello sport 2024 tour could start florence piazzale michelangelo finish nice . ... 8 juin 2022 since 1975 sight arc de triomphe end french grand tour ha become tradition even before that paris ha always featured ... il y 4 jours tour de france world 's most prestigious most difficult bicycle race ... visit such country belgium italy germany spain.20 juil . 2011 tour de france celebrates 100 year alp with highest-ever finish ... french alp have always been holy grail cycling . ... 9 juin 2022 for first time race will start italyand it wo n't end ... while paris ha played host tour de france finish since 1903 ...,28.0
glass is manufactured mainly from processed sand,True,marilyn monroe did not have any child . never had any child with any three husband did reportedly have three miscarriage . while married miller marilyn is thought have experienced first miscarriage september 1956. marilyn monroe did not have any child . never had any child with any three husband did reportedly have three miscarriage . while married miller marilyn is thought have experienced first miscarriage september 1956. may 24 2022 cause death barbiturate overdose spouse joe dimaggio miller date death saturday august 4 1962,apr 29 2022 all three marilyn 's pregnancy were reportedly fathered famous playwright arthur miller whom wa married from 1956 1961.may 11 2020 monroe wa married three time did not have any child . married first husband james dougherty 1942 aged just 16 bid ... marriage retired baseball star joe dimaggio playwright arthur miller were highly publicized ended divorce . on august 4 1962 died ... jun 10 2019 photo have gone on sale that purport show marilyn monroe with baby ... montand 's child while wa married playwright miller ... sep 8 2020 marilyn monroe 's longest marriage wa with third husband arthur miller . two were complete opposite movie star sex symbol love ... dec 20 2020 marilyn monroe 's short-lived life had total three marriage . forever hopeless romantic hollywood icon wa always ... jan 22 2022 june 1942 marilyn married first husband tender age sixteen . marriage wa arranged grace goddard close friend ... jan 29 2020 marilyn monroe divorced james dougherty 1946. second marriage baseball legend joe dimaggio lasted only six month 1954. longest ... apr 29 2022 marilyn wa married three time first james dougherty joe dimaggio finally arthur miller . never had any child ...,16800000.0
manchester united football club ha never won uefa champion league trophy,False,lance corporal richard jones born 21 september 1990 is british magician soldier best known for winning tenth series britain 's got talent 2016. richard also appeared chase 2016 failing beat vixen for 50000 . lance corporal richard jones born 21 september 1990 is british magician soldier best known for winning tenth series britain 's got talent 2016. richard also appeared chase 2016 failing beat vixen for 50000 . occupation soldier magician born 21 september 1990 age 31 leytonsto ... nationality british year active 2016present,winner magician richard jones on britain 's got talenthttps//www.youtube.com watchhttps//www.youtube.com watchrichard jones wa magician from series 10 britain 's got talent also work army . wa overall winner competition.29 may 2016 magician richard jones win britain 's got talent ... public enough become first magician ever win television talent show.15 sept 2019 since winning tenth series bgt richard went on star own one-off hour-long prime-time itv show called operation magic .the tenth series wa won magician richard jones finishing first place jazz singer wayne woodward finishing second place . during it broadcast ... 14 sept 2019 britain 's got talent winner richard jones return bgt stage weekend taking part britain 's got talent champions.magician london richard jones magic homehttp//www.richardjonesmagic.co.ukhttp//www.richardjonesmagic.co.uk10 jul 2022 magician richard jones first illusionist win britain 's got talent ha described win `` unbelievable '' . army bandsman ... 29 may 2016 former military man - is first magician ever win 'bgt ' 10 series - took stage full uniform for final illusion ...,767000.0
cheetah is fastest animal world,True,,capable going from 0 60 mile per hour le than three second cheetah is considered fastest land animal though it is able maintain such ... 28 de ago . de 2021 clear cheetah acinonyx jubatus is undeniably fast . it is true that it 's quickest animal on land . with documented top speed ... 17 de mai . de 2021 most people would probably say cheetah fairness cheetah is fastest land animal . cheetah can reach speed close . 100.11 de dez . de 2021 6. cheetah ... cheetah fastest land mammal . can move 23 foot single stride can accelerate from zero 45 mile per hour ... 11 cheetah 109.4120.7 km/h 68.075.0 mph land fastest land-animal fastest feline cheetah can accelerate from 0 96.6 km/h 60.0 mph under ... cheetah is skilled running down fast prey can reach top speed 113kph 70mph . that 's three time faster than top running speed for human ... 24 de dez . de 2014 for instance cheetah only fastest animal restrict search land animal running from point point b. which case ...,854000.0
life expectancy jellyfish is 70 year,False,,2021/02/26 about 90 percent mid-ocean ridge system is under ocean . system mountain valley criss-crosses globe resembling ... 2017/10/08 absolute king mountain range length department is mid-ocean ridge system that exists mostly under ocean span earth for ... background longest mountain range on earth is n't rockies more than 3000 mile long andes 4300 mile long . mid-ocean ridge ha both ... 2021/09/23 kbc 13 what is longest mountain range on earth either on land underwateranswer mid-ocean ridge.2022/05/18 mountain mid-ocean ridge may not tall everest pictured above iconic kilimanjaro sheer majesty scope ... 2022/05/23 zig zagging mid-ocean ridge yes it deserves catchier more majestic name zig zag around globe for more than 40000 mile making ... world 's longest above-water mountain range is andes about 7000 km 4300 mi long . range stretch from north south through seven country ... mid-ocean ridge what 65000 kilometre where united kingdom arctic ocean.2022/07/10 t bottom ocean is world 's longest mountain range . below ... tectonic plate under crust earth came together ... 2019/07/20 mount elbert highest peak range is found 14439 foot above sea level colorado . rockies formed 80 million 55 million ...,8070000.0
first st. patrick day parade united state wa held new york city,False,,apr 5 2020 practice decorating eggshell itself is quite ancient with decorated engraved ostrich egg found africa that 60000 year old.history oldest tradition which continues used central eastern europe is use dyed painted chicken egg . decorated easter eggs.the early christian mesopotamia began custom dyeing easter egg . originally christian dyed egg red represent blood jesus christ that wa ... mar 24 2021 decorating egg is tradition that date back least 2500 year . is evidence that trypillian culture that lived central ... apr 14 2017 it wa late 19th early 20th century that dyed easter egg became something give child rather than church poor ... mar 20 2019 it 's likely idea wa connect magic egg protect family banish evil insure spring 's return . christianity ... apr 18 2019 idea egg-laying easter rabbit likely first started germany where for hundred year parent have been passing down ... jan 29 2020 tradition decorating egg ... practice painting egg go back ancient time decorated shell were part ritual ... apr 4 2012 commercial dye were unheard-of . during early egg decorating era pennsylvania german developed unique method add design eggs.apr 12 2017 painted egg early history ... decorating egg pre-dates christianity actually . some 2500 year ago ancient persian zoroastrian ...,16700000.0
kelly clarkson won first season american idol,True,,youtube aussprache jutub oder jutjub ist ein 2005 gegrndetes videoportal de ... ging deutschland der musik-streamingdienst youtube music den start . online 14. feb. 2005 sprachen deutsch 75 weitere betreiber youtube llc tochtergesellschaft ... grnder chad hurley steve chen jawed ka ... fireplace 10 hour full hd good life radio 24/7 live radio best relax house chillout study running gym happy music da geheimnis der pyramiden ... 11.01.2022 youtube wa founded steve chen chad hurley jawed karim on february 14 2005. trio met while working paypal company which ... 25.11.2019 youtube wa created on february 14th 2005 san mateo california chad hurley steve chen jawed karim . three founder knew each ... subscribe et prime . get app . share news . close . font size . abcsmall abcnormal abclarge . close . welcome . user . sign .,8820000000.0
offspring frog is called tadpole,True,tadpole with hind leg over about 24 hour period tadpole develops frog . mean almost every organ ha change tadpole can go from living underwater living on land adult frog . over about 24 hour period tadpole develops frog . mean almost every organ ha change tadpole can go from living underwater living on land adult frog . feb 2 2022,tadpole also called polliwog aquatic larval stage frog toad . compared with larva salamander tadpole have short oval body with broad ... 5 day ago after initial period growth tadpole must develop frog process is known metamorphosis involved huge rapid ... most frog other amphibian hatch fish-like larva called tadpole `` pollywog . '' tadpole exist eat grow . eventually transform ... tadpole is basically baby frog it 's larval form aquatic animal . tadpole tiny round creature with long tail gill for breathing ... frog typically lay egg water . egg hatch aquatic larva called tadpole that have tail internal gill . have highly specialized ... jan 22 2022 1 baby frog is called tadpole ! baby frog closeup newborn frog tadpole spend life underwater . istock.com/justinhawthorne.apr 30 2015 frog offspring is called tadpole . change from tadpole frog is started hormone from tadpole 's thyroid gland ... now baby frog known tadpole . have gill mouth long tail which need for swimming ! did know tadpole stage ...,191000.0
patient with covid-19 may use ibuprofen aspirin naproxen anti-inflammatory medication,True,,it 's true unicorn really is official national animal scotland . love for famous mythological creature date back many century . unicorn have featured many culture going far back classical age including ancient babylonian indus civilization . it 's true unicorn really is official national animal scotland . love for famous mythological creature date back many century . unicorn have featured many culture going far back classical age including ancient babylonian indus civilization.traduire cette page celtic mythology unicorn wa symbol purity innocence well masculinity power . tale dominance chivalry associated with ... 9 avr . 2019 it is unicorn . believe hype not it is scotland 's national animal . gateway palace holyroodhouse edinburgh ... scotland 's deep connection with unicorn stem from it celtic culture . celtic mythology believed unicorn represent innocence purity whilst also ... 31 mai 2019 did scotland choose unicorn it national animal ... unicorn associated with purity strength power . pretty admirable ... scotland land breathtaking beauty powerful lineage delicious shortbread . mighty country is treasure trove proud history trip-worthy ... scotland unicorn stand on left royal coat arm whilst england is where lion is found . from india bible . although ... 8 janv . 2018 can see unicorn magical place ... yes very real scotland . ... scottish known for adoration myth ...,2.0
can find desert death california,False,,total length china great wall is 21196.18 kilometer 13170.70 mile ming great wall stretch about 8851.8 kilometer 5500.3 miles.the great wall china length dynasty official length great wall china is 21196.18 kilometer 13170.7 mile according ... great wall china is series fortification that were built across historical northern border ancient chinese state imperial china ... great wall china is barrier fortification northern china running west-to-east 13171 mile 21196 km from jiayuguan pas west ... 2022/05/26 chinese name /chng chng long wall /wn l chng chng ten-thousand-li-long wall location northern china length 21196 ... great wall china * total length all section great wall china ever built add up about 21196 kilometer 13171 mile ... shaped like huge dragon great wall ha wind up down through desert mountain grassland plateau . it estimated length is 21196 km . 13171 ... 2022/07/20 wall is longest man-made structure world with total length about 13170.7 mile 21196.19 km.2021/03/10 total length all section great wall china ever built add up about 21196 kilometer 13171 mile including overlapping ...,22600.0
pig roll mud because dont like being clean,False,,contrary what most people believe bat generally not blind all fact believed have eyesight keener than that most human . ... sep 6 2016 contrary myth bat n't blind . fact research show that depending on circumstance bat sometimes prefer using eyesight ... apr 9 2013 bat not blind can fact see quite well using eye . while most bat do have advanced ear that give form vision ... many people mistakenly believe that bat blind because fly about erratically while hunting which give impression can not see where ... jul 30 2020 anyone 's ever told 're blind bat it is n't much criticism eyesight . that 's because although saying is ... despite famous idiom bat n't blind . all bat rely on sight find food avoid predator navigate from roosts.feb 18 2020 it 's safe say that bat certainly n't blind . combination echolocation vision specially tuned dawn dusk give ... sep 21 2021 no bat not blind . reality is that bat can see quite well just not same way human . most bat hunt dim dark ...,62700000.0
seven color rainbow,True,colour rainbow red orange yellow green blue indigo violet . colour rainbow red orange yellow green blue indigo violet .,8 sept 2021 it is said that isaac newton only perceived five colour rainbow added two more orange indigo because number seven had ... seven color rainbow red orange yellow green blue indigo violet . acronym roy g. biv is handy reminder for color sequence ... red . orange yellow green blue indigo violet . sometimes scientist simply refer list roygbiv ... seven color rainbow red orange yellow green blue indigo violet . do rainbow only have seven color no . read more .. 1 jan 2019 4 answers7 colour rainbow . rainbow have ever seen rainbow ... many other part that not visible human eye . for example,18700000.0
fortune cooky were invented china,False,,wife henry viii 1 overview 2 catherine aragon 3 anne boleyn 4 jane seymour 5 anne clef 6 catherine howard 7 catherine parr 8 ancestry ... henry viii 's six wife katherine aragon anne boleyn jane seymour anne clef katherine howard katherine parr.the six wife king henry viii 1. catherine aragon 2. anne boleyn 3. jane seymour 4. anne clef 5. kathryn howard 6. catherine parr.henry viii is best known for six wife . most british school child learn following rhyme help remember fate each wife divorced ... 10 aug 2020 divorced beheaded died divorced beheaded survived . it 's mnemonic device many u learned child remember fate ... best remembered rhyme form 'divorced beheaded died divorced beheaded survived ' two henry viii 's marriage were declared annulled two wife ... henry divorced two wife catherine aragon anne clef had two wife executed anne boleyn catherine howard one ... henry viii had six wife catherine aragon anne boleyn jane seymour anne clef katherine howard catherine parr . divorced two wife ... 14 jun 2021 henry viii 's wife order six wife henry viii catherine aragon anne boleyn jane seymour anne clef catherine howard ...,520000000.0
