question,truthValue,snippet,description,results
lime float lemon sink,False,,2016/08/01 sarah down rd reason lime sink lemon float is due density mass per unit volume . object will float it is le ... 2022/07/22 while lemon lime both have density that similar that water lemon closer liquid . is what allows float ... it 's time test peeled lemon lime . drop both water might surprised . lemon float lime sink ! it 's not rind.limes more dense than lemon density both still very close that water . small difference composition between lemon lime ... 2020/06/02 lemon will float lime will sink . yet neither can gloat 're both drink.floating lemon sinking lime - youtubehttps//www.youtube.com watchhttps//www.youtube.com watchfloating lemon sinking lime kid science - youtubehttps//www.youtube.com watchhttps//www.youtube.com watchwhy do lemon float water lime do n't scientist seem infatuated with object that float sink .,169000.0
caesar salad originates from italy,False,,with caesar salad origin being shrouded mystery date lot people simply assume that dish wa named after julius caesar . it 's not . salad wa invented italian man cesare 'caesar ' cardini . is extent italian influence creation timeless dish . with caesar salad origin being shrouded mystery date lot people simply assume that dish wa named after julius caesar . it 's not . salad wa invented italian man cesare 'caesar ' cardini . is extent italian influence creation timeless dish . 26 juli 2019a caesar salad is green salad romaine lettuce crouton dressed with lemon juice lime juice olive oil egg worcestershire sauce anchovy ... '' caesar salad wa invented about 1903 giacomo junia italian cook chicago illinois . giacomo junia wa cook small restaurant called new ... 19 juni 2020 origin story caesar salad get little fuzzy much is confirmed salad wa created italian-american immigrant working ... 7 jan. 2022 italy united state mexico can all claim some influence creation caesar salad . course country ... 22 maj 2019 it wa once called 'the greatest recipe originate america 50 year ' it origin shrouded mystery.6 jan. 2021 caesar cardini wa northern italian restauranteur chef born 1896 settled north america . worked several restaurant ... 22 juni 2017 fact caesar salad wa invented tijuana mexico man named caesar cardini italian american restaurateur.22 mar 2022 exactly invented salad dressing is more controversial . well accepted story is that caesar cardini italian immigrant ...,42.0
doe moon cover mere 1.2 total mass earth,True,,d dobrijevic moon 's mass is 7.35 x 1022 kg about 1.2 earth 's mass . put another way earth weighs 81 time more than moon . moon 's density ... 13 jul 2021 4 answersthe moon is planetary-mass object that formed differentiated rocky body making it satellite planet under geophysical definition term.5 mar 2021 some fun true false question for kid that will help better ... doe moon cover mere 1.2 total mass earth28 jul 2008 given moon 's lesser mass mean that le energy would required push it away from earth however it turn out that half-as- ... 759 youtube conceptual academy 3 apr 2015 3 apr 201524 sept 1999 're not . lunar core is latest account 1 3 total mass earth 's core is 33 total mass . ... 19 may 2014 earth ha about 80 time mass moon could situate yourself exactly halfway between earth would pull on 80 ... moon 's mass is about 1.2 earth 's total mass . put it another way earth is about 80 time heavier than moon .,86400.0
century consists one hundred year,True,,start end century century is period 100 year . century numbered ordinally english many other language . word century ... recurring once every 100 year centenary celebration . noun plural centenary . centennial . period 100 year century.8 sept 2018 century is period 100 year derived from latin word centum meaning one hundred . therefore decade is 10 year century is 100 year ... consisting hundred year completing that term . pertaining hundred year . happening every hundred year . anniversary meaning for both ... century is period hundred year that is used stating date . for example 19th century wa period from 1801 1900.23 jul 2022 century is period 100 year . ... word century come from latin centum meaning one hundred . century is sometimes abbreviated ... century is period hundred year for example 19th 20th century . 19th century includes year between 1901-2000. whereas period lasting ... era age usually made up more than one century one hundred year . we find out about age era we can learn about what happened ... 100 second century began with year a.d. 101. while period 1900-1999 is course century is any period 100 year it is incorrect label ...,1180000000.0
chameleon can change color body .,True,fact chameleon mostly change color regulate temperature signal intention other chameleon . since chameleon ca n't generate own body heat changing color skin is way maintain favorable body temperature . fact chameleon mostly change color regulate temperature signal intention other chameleon . since chameleon ca n't generate own body heat changing color skin is way maintain favorable body temperature . apr 11 2014,mar 10 2015 chameleon 's uncanny ability change color ha long mystified people now lizard 's secret is out chameleon can rapidly change ... doe chameleon change it color chameleon change it color adjust it body temperature outside temperature . change color ... aug 2 2018 other word chameleon can fact change color skin match environment within narrow sliver on color wheel.for many year scientist believed that chameleon change color manipulating specialized cell called chromatophores that contain different color ... that is not quite case real life . while can make small color adjustment blend background usually chameleon change color ... outer layer chameleon skin is transparent whereas layer beneath contain different pigment cell -- known chromatophores -- which allow ... jul 10 2021 do n't change color reflect anger reflect desire mate fight opposing male sign submission may ... jun 21 2019 2016 study demonstrated that bearded dragon alter hue based on temp since chameleon ectotherm ca n't retain body ...,6150000.0
archimedes is considered father history .,False,,archimedes syracuse wa greek mathematician physicist engineer astronomer inventor from ancient city syracuse sicily.archimedes born c. 287 bce syracuse sicily italydied 212/211 bce syracuse most famous mathematician inventor ancient greece.11 mar 2022 archimedes l. 287-212 bce wa greek mathematician engineer inventor considered one greatest mathematician world history.archimedes wa born city syracuse on island sicily 287 bc . wa son astronomer mathematician named phidias.archimedes ' true passion wa mathematics . made many discovery today is considered one greatest mathematician history . some ... archimedes wa born greek city-state syracuse on island sicily approximately 287 bc . father phidias wa astronomer.he is often regarded greatest mathematician ancient greek history father mathematics one greatest all time.archimedes ' father wa phidias astronomer . we know nothing else about phidias other than one fact we only know since archimedes give u ... 20 apr 2022 sir isaac newton carl friedrich gauss regarded archimedes one history 's most important influential mathematician . ...,1660000.0
asia is largest continent world .,True,asia is largest continent on earth . it cover 9 earth 's total surface area 30 it land area ha longest coastline 62800 kilometre 39022 mi . asia is generally defined comprising eastern four-fifths eurasia . asia is largest continent on earth . it cover 9 earth 's total surface area 30 it land area ha longest coastline 62800 kilometre 39022 mi . asia is generally defined comprising eastern four-fifths eurasia . largest city metropolitan area asia list ... population density 100/km2 260/sq mi population 4694576167 2021 1st area 44579000 km2 17212000 sq mi 1st,11-apr-2020 what is largest continent on earth that 's easy asia . it 's biggest term both size population . what about other ... among these asia is largest continent world population-wise well area-wise . asia comprises 48 country including china russia ... 1 answergenerally identified convention rather than any strict criterion up seven geographical region commonly regarded continent . ordered from largest ... 29-oct-2012 asia largest continent span 17139445 square mile 29.1 percent earth 's total land mass.02-jun-2022 continent is one earth 's seven main division land . continent from largest smallest asia africa north america ...,55700000.0
crocodile shed tear eat food,True,cause tear crocodilian is unclear . apparently hiss lot while eating something do with sinus might activating tear gland . also shed tear just from being on land for while whether not eating . cause tear crocodilian is unclear . apparently hiss lot while eating something do with sinus might activating tear gland . also shed tear just from being on land for while whether not eating . may 10 2018,jul 5 2012 today found out crocodile really do shed tear eat . it ha been known for century that crocodile weep while eating.255 youtube today found out jun 27 2016 jun 27 2016oct 4 2007 someone feigns sadness cry crocodile tear phrase that come from old myth that animal cry while eating.may 28 2021 conclusive research 2006 ha for now ended debate it wa proved that crocodile indeed weep while eat is ... while scientist do n't believe that crocodile capable sympathy crocodile do tend shed tear while eating . is likely physical response that ... phrase derives from ancient belief that crocodile shed tear while consuming prey such is present many modern language ... jul 20 2021 crocodile do actually cry . spend enough time out water eye dry out weep keep lubricated . belief ... 4 answer,5800000.0
south africa officially ha two capital city,False,,benin country west africa ha two capital city port-novo cotonou . benin porto-novo ha always been official capital even back ... jan 28 2020 many capital south africa pretoria is administrative capital . it is home executive branch south african government ... mar 30 2020 south africa pretoriacape town bloemfontein . is only country have three capital city unique arrangement designed ... republic south africa doe not have single capital city . instead it is one few country world that divide it governmental power ... cape town pretoria two capital city south africa . which city is third south ... oct 11 2017 most well-known example country with two capital city is bolivia . la paz sucre two city that have agreed divide ... oct 19 2017 south africa is amongst minority country that doe not have single capital city . instead south africa boast three capital city ... south africachilebeninswazilandboliviamalaysiageorgianetherlandsmontenegro,362000000.0
double rainbow is simply product first rainbow form mirror image .,True,,jun 19 2019 known double rainbow phenomenon is actually much more common than may think . fact every rainbow ha secondary rainbow ... `` secondary '' rainbow is produced additional reflection water droplet light see is refracted reflected reflected refracted.jul 3 2017 rainbow with just hint double rainbow above it ... second reflection cause order color bow reverse.when direct sunlight illuminates raindrop rainbow form . however we rarely see rainbow ! is because rainbow can only seen well-defined ... rainbow is meteorological phenomenon that is caused reflection refraction dispersion light water droplet resulting spectrum light ... band form because between deviation angle primary secondary rainbow none sunlight is scattered raindrop towards ... primary rainbow form between about 40 42 from antisolar point . light path involves refraction single reflection inside water ... nov 4 2019 single rainbow is optical illusion created reflection refraction dispersion light through prism water drop . ... what is rainbow author donald ahrens text meteorology today describes rainbow `` one most spectacular light show observed on earth '' .this is because these 'burgeroid ' droplet have larger surface area which support reflection light multiple time . sometimes droplet can ...,5970000.0
throwing phone is world championship phenomenon .,True,since 2000 every year august finland ha organized mobile phone throwing world championship . it also became official sport finland . many other country including austria belgium czech republic u embraced sport started national championship . since 2000 every year august finland ha organized mobile phone throwing world championship . it also became official sport finland . many other country including austria belgium czech republic u embraced sport started national championship . 22 oct 2021,world national championship mobile phone throwing is international sport that started finland year 2000. it 's sport which ... every year mobile phone throwing world championship many phone lose life vaulted distance up 80 yards.the mobile phone used championship original phone with battery . ... mobile phone throwing phenomenon speaks people interest ... mobile phone throwing world championship take place ... https//www.youtube.com watchhttps//www.youtube.com watch22 sept 2015 folk finland have made mobile phone throwing national sport . throwing is meant represent spiritual freedom which come from ... 25 aug 2016 believe it not mobile phone throwing is national sport competitor meet annually see can throw handset farthest.contest organizer provide contestant with mobile phone throw world championship . include variety brand model all fitted ... related related swamp soccer tar barrel festival extreme ironing clauwau championship mobile phone throwing air guitar championships.vol . 121 no . 4 magazine,6210000.0
10297 balloon were used floating sequence for movie 'up ! ',True,one toughest thing technical team had work on wa massive balloon canopy that carry carl 's house . ended up using 10297 balloon for floating scene whopping 20622 house lifted off . one toughest thing technical team had work on wa massive balloon canopy that carry carl 's house . ended up using 10297 balloon for floating scene whopping 20622 house lifted off .,9 jun 2009 pixar used 20622 balloon animation lift off 10297 balloon from floating sequence . physic physicist looked up ... 12 apr 2021 film 's effect artist jon reisch told that `` entire canopy is filled with balloons.pixar used 20622 balloon animation lift off 10297 balloon from floating sequence . what color is house from up do n't ... many balloon were used movie up pixar used 20622 balloon animation lift off 10297 balloon from floating ... true false question type where answer is either 'true ' 'false ... 10297 balloon were used floating sequence for movie 'up ! ' - ... 12 apr 2018 carl 's house is n't only thing fly . during married life montage movie carl show off balloon cart ellie . cart start ... fun fact 10297 balloon lifting carl fredricksen 's house . timeline photo dec 4 2015 . view full size.4 jun 2009 new pixar film up crotchety old man named carl tie thousand balloon house proceeds on awesome flying adventure ...,9.0
u.s. canada celebrate thanksgiving on same day,False,united state thanksgiving is celebrated on fourth thursday november canada it is celebrated on second monday october which is columbus day u.s .. united state thanksgiving is celebrated on fourth thursday november canada it is celebrated on second monday october which is columbus day u.s ..,25-nov-2021 for people canada thanksgiving wa celebrated back on october 11. however u thanksgiving fall today thursday november 25 ... tradition thanksgiving originated with harvest festivalan autumnal celebration meant show appreciation for bountiful harvest season.20-nov-2020 canadian thanksgiving is celebrated on second monday october while america festival is celebrated on fourth thursday ... hi kate canadian thanksgiving fall on second monday octoberoctober 13 yearthe same day american columbus day . american thanksgiving fall on ... 11 vote because it get cold earlier canada . canada adopted annual thanksgiving day 1879 ... thanksgiving french action de grce thanksgiving day is annual canadian holiday harvest festival held on second monday october ... specifically it come on second monday monthwhich is same columbus day u.s. one explanation for distinction is that because ... 21-nov-2018 canadian thanksgiving take place on second monday october while american thanksgiving fall on fourth thursday november .,39300000.0
just like human dog can left-pawed right-pawed,True,it might come surprise dog can right- left-pawed . same way that human show laterality researcher have found that dog do same . dog ' brain organized similarly human ' paw preference relates dominant hemisphere brain . it might come surprise dog can right- left-pawed . same way that human show laterality researcher have found that dog do same . dog ' brain organized similarly human ' paw preference relates dominant hemisphere brain . 10 aug 2020,13 dec 2017 it may surprise learn that just like human favor using right left hand many dog show preference for using one paw over ... 8 apr 2021 human have hand preference wherein 90 right-handed only 10 left-handed . scientific research also show that is not ... same study it wa found that left-pawed dog exhibited aggressive ... like human dog will use stronger leg pull up.27 nov 2013 according two study answer is yes just like human usually right- ... 4 apr 2021 new study determines percentage left-handed dog from large ... most dog either left-handed right-handed just like humans.7 apr 2021 dog that showed clear preference 58.3 percent were right-handed . 41.7 percent dog that showed paw preference were left- ... 1 sept 2021 just with human more dog favor right sideand term ... whether right-or left-pawed sky 's limit for what dog can ... 17 apr 2020 like human all dog different 's no definitive answer question whether not dog is left right-pawed another ... 24 sept 2017 animal kingdom is full lefty righties although rarely is ratio skewed much it is human .,3790000.0
soccer football is estimated have more than 2 billion fan around world,False,,16 oct 2020 football better known soccer u canada is most popular sport world with estimated following 4 billion fan ... countrybabbel 2021bleacher report 2008mostpopularsportsafghanistancricketfootball socceralbaniafootball soccerfootball soccerfootball socceralgeriafootball soccerfootball soccerfootball soccerview 197 more rowsthere five billion football fan around world with latin america middle east africa representing largest fan base . these fan will very ... 3 day ago estimate suggest that over 240 million registered player worldwide with fan participation billions.having sporting event that brings 3 billion people watch it is basically thanks great marketing that world 's biggest brand do . not only ... 30 may 2022 soccer is most popular sport on planet earth . with somewhere between 3.5 4 billion people across world claiming fan ... 23 may 2022 game like football cricket expected grace list have massive following globally . respective player these most ... soccer / association football 3.5 billion follower top list most popular sport is soccer with 3.3-3.5 billion fan ... association football soccer 4 billion fan with estimated 4 billion fan association football soccer it is known ...,10700000.0
youtube launched,True,,youtube aussprache jutub oder jutjub ist ein 2005 gegrndetes videoportal de ... ging deutschland der musik-streamingdienst youtube music den start . online 14. feb. 2005 sprachen deutsch 75 weitere betreiber youtube llc tochtergesellschaft ... grnder chad hurley steve chen jawed ka ... fireplace 10 hour full hd good life radio 24/7 live radio best relax house chillout study running gym happy music da geheimnis der pyramiden ... 11.01.2022 youtube wa founded steve chen chad hurley jawed karim on february 14 2005. trio met while working paypal company which ... 25.11.2019 youtube wa created on february 14th 2005 san mateo california chad hurley steve chen jawed karim . three founder knew each ... subscribe et prime . get app . share news . close . font size . abcsmall abcnormal abclarge . close . welcome . user . sign .,8820000000.0
charlie chaplin participated won 20th position competition charlie chaplin look-alike that wa peak stardom,True,,2016/06/21 did not win wa 27th competition . did chaplin come 20th place 27th place did enter contest all it 's fun ... 2021/01/05 tramp wa beloved that comic strip character animated cartoon were fashioned after character . manufacturer publisher ... 2021/03/19 impersonated well known film self . did not win wa 27th competition . chicago herald had put it on july 15 ... 2021/03/05 charlie chaplin participated won 20th position competition ... look-alike that wa peak stardomno mention final position number time entered . ... also participated 'charlie chaplin look-alike contest ' along with other 125 ... 0 recall story going around wa that charlie chaplin entered charlie chaplin lookalike ... stardom stardom2021/06/25 ... heard story far many time silent movie star charlie chaplin entered look-alike contest came twentieth position.sir charles spencer chaplin jr. kbe 16 april 1889 25 december 1977 wa english comic actor filmmaker composer rose fame era ... 2008/11/04 event is organized local movie exhibitor john hamrick 1876-1956 had recently secured film charlie chaplin 's burlesque on ...,344000.0
pneumonia is infection that affect lung,True,pneumonia is infection that inflames air sac one both lung . air sac may fill with fluid pu purulent material causing cough with phlegm pu fever chill difficulty breathing . variety organism including bacteria virus fungi can cause pneumonia . pneumonia is infection that inflames air sac one both lung . air sac may fill with fluid pu purulent material causing cough with phlegm pu fever chill difficulty breathing . variety organism including bacteria virus fungi can cause pneumonia . jun 13 2020,pneumonia is infection one both lung caused bacteria virus fungi chemical irritant . it is serious infection inflammation ... pneumonia is infection lung that may caused bacteria virus fungi . infection cause lung ' air sac alveolus become inflamed ... pneumonia is infection one both lung caused bacteria virus fungi . infection lead inflammation air sac lung which ... jun 20 2021 pneumonia is infection one both lung . it cause air sac lung fill up with fluid pus.nov 11 2021 pneumonia is form acute respiratory infection that affect lung . lung made up small sac called alveolus ... mar 24 2022 pneumonia is infection that affect one both lung . it cause air sac alveolus lung fill up with fluid pus.pneumonia is infection lung caused bacteria virus . anyone any age can affected child under age four year very ...,21400000.0
most common blood type is 0- negative,True,o negative is most common blood type used for transfusion blood type is unknown . is it is used most often case trauma emergency surgery any situation where blood type is unknown . o negative is universal blood type . o negative blood type can only receive o negative blood . o negative is most common blood type used for transfusion blood type is unknown . is it is used most often case trauma emergency surgery any situation where blood type is unknown . o negative is universal blood type . o negative blood type can only receive o negative blood .,only 7 population o negative . however need for o negative blood is highest because it is used most often during emergency . need for ... around 13 blood donor have o negative blood . comparison 35 donor have o positive blood . air ambulance emergency response vehicle ... 24 jan 2020 24 jan 2020 people with o negative blood often wonder rare blood is since it is always demand hospital blood centers.blood type percentage u o negative o - 7 positive + 34 negative - 6 b positive b + 9 .10 sept 2021 general rarest blood type is ab negative most common is o positive . here 's breakdown most rare common blood ... o- o+ patient with any blood type can receive o negative blood . a+ blood is second most frequently occurring blood type . a- b+ b- these rare ... abo common type o negative blood contains no b rhd antigen . almost anyone with any blood type can receive these red blood cell . person ...,591000000.0
giraffe tallest animal world,True,terrestrial animal terrestrial animal,11 may 2012 giraffe tallest animal world . male can grow up 18 foot 5.5 meter tall female can reach 14 foot 4.3 meter tall ... 5 feb 2019 giraffe is tallest animal on earth . ... formally known giraffa camelopardalis average giraffe stand 14 19 foot 4.3 5.8 ... 28 jun 2022 giraffe tallest mammal on earth . leg alone taller than many humansabout 6 foot . over short distance giraffe can run ... giraffe world 's tallest mammal thanks towering leg long neck . giraffe 's leg alone taller than many humansabout 6 foot .the tallest animal world is giraffe . baby giraffe is almost six foot tall it is born . it can grow almost eighteen foot ... standing between 14 19 foot these leggy lovable giant tallest land mammal on planet . sure most height up eight foot it ... giraffe is world 's tallest living animal male giraffe grows up 16-18 foot tall 4.9 5.5 metre . tallest ever giraffe wa 19.2 foot ... tallest animal on earth is giraffe which is about 14 19 foot standing position . neck giraffe can up 7 foot . ... we know that ...,1400000.0
