question,truthValue,snippet,description,results
frog is most likely vomit entire stomach it ha .,True,frog eats something toxic it ca n't eject it stomach content . instead frog throw up it entire stomach . is called full gastric eversion it 's little like dumping out pocket . tidy creature frog wipe stomach hanging out it mouth with it front foot remove any stray bit . frog eats something toxic it ca n't eject it stomach content . instead frog throw up it entire stomach . is called full gastric eversion it 's little like dumping out pocket . tidy creature frog wipe stomach hanging out it mouth with it front foot remove any stray bit . 15 jan 2019,frog will actually throw up it entire stomach . total stomach vomiting mechanism frog ha same result emptying bag pushing it ... generally frog toad vomit because ate something inedible toxic due extreme motion sickness food item is large . frog perform ... 8 jan 2017 specie such green frog american bullfrog even african clawed frog all known evert stomachs.29 jan 2014 human emetic response -- more commonly known hurling puking ralphing upchucking vomiting -- is fairly simple process.21 apr 2021 case some frog toad `` heaving gut '' can have much more literal connotation . toad that eats something mildly ... 27 jan 2018 many specie frog will vomit out own stomach . gain ability once reaching maturity allowing expel toxin ... experimental evidence show that pica intentional compulsive consumption non-food substance can sign iron other nutrient deficiency ... amphibian reptile frequesntly kept pet can carry slamonella ... person under 5 year age more likely develop severe illness.if frog eats something toxic it ca n't eject it stomach content . instead frog throw up it entire stomach . is called full gastric eversion ...,1620000.0
granny smith apple originates from australia,True,,granny smith apple 'granny smith ' apple originated sydney australia 1868. it discoverer maria ann smith had emigrated from england 1839 with husband thomas . purchased small orchard cultivating fruit . 'granny smith ' apple originated sydney australia 1868. it discoverer maria ann smith had emigrated from england 1839 with husband thomas . purchased small orchard cultivating fruit . pdfthe granny smith also known green apple sour apple is apple cultivar which originated australia 1868. it is named after maria ann smith ... granny smith apple is named after maria smith orchardist ryde sydney . maria discovered apple growing on property 'sport ' from some ... granny smith apple had it 's origin orchard only few mile ... maria ann smith arrived australia with husband thomas 1830 aged 30.20 oct. 2018 it originated is not known for certain . according legend tree grew from discarded core crab apple thrown out ... these world-famous green apple actually have australian origin . according legend maria ann smith found apple seedling near house 1868.9 fvr . 2015 most common origin story granny smith apple some folk just call granny apple is that around 1868 new south wale ... 8 oct. 2014 granny smith apple from australia now stand for 'apple green ' aroma used perfume fresh flavour candy ... granny smith died just few year later unique apple found following among local grower eventually gaining national attention australia ...,5.0
penguin not bird .,False,penguin bird can fly yes penguin bird although flightless bird . lot people think penguin mammal rather than bird because ca n't fly we see swimming underwater waddling on land instead . penguin bird can fly yes penguin bird although flightless bird . lot people think penguin mammal rather than bird because ca n't fly we see swimming underwater waddling on land instead .,however penguin classified bird aves zoological term . black white flightless seabird family spheniscidae which found ... penguin bird penguin indeed bird included classification bird . is defined fact that penguin lay egg instead ... penguin is bird . it is not mammal because it lay egg ha feather . mammal have hair fur give birth live young . ... 15 nov 2016 penguin not mammal even though warm-blooded animals.penguins one only few specie flightless bird left world . many people ... penguin bird even though spend time on land water . motion water more closely resembles flying than swimming motion used ... 23 nov 2017 answer that would yes zoological term penguin classified bird aves . penguin member spheniscidae family ... relationship other bird order penguin group aquatic flightless bird . live almost exclusively southern hemisphere only one ... conclude activity reviewing characteristic bird general penguin particular . adaptation for younger student . student not ...,15700000.0
doe rainbow have 7 colour,True,,sequence colour give u characteristic pattern we 're all familiar with that we learn from childhood through use mnemonic phrase . colour rainbow red orange yellow green blue indigo violet . sequence colour give u characteristic pattern we 're all familiar with that we learn from childhood through use mnemonic phrase . colour rainbow red orange yellow green blue indigo violet.8 de set . de 2021 it is said that isaac newton only perceived five colour rainbow added two more orange indigo because number seven had ... 7 de ago . de 2018 rainbow is optical meteorological phenomenon . jos pozas explains human eye see 7 color rainbow.there seven color rainbow red orange yellow green blue indigo violet . acronym roy g. biv is handy reminder for color sequence ... we know rainbow color seven number violet indigo blue green yellow orange red . best way remember rainbow color order is ... 11 de out . de 2014 have every color rainbow literally . we commonly describe color red orange yellow green blue indigo violet that 's only because ... 8 de jul . de 2022 total number color that eye can see rainbow is 7. color always seen same order . these color order ... 7 colour rainbow . rainbow have ever seen rainbow sometimes sun is shining it is rainy somewhere same time can see ... 16 de fev . de 2015 set out colour rainbow order schoolchildren still memorize today red orange yellow green blue indigo violet .,199000000.0
spaghetto is term used for single strand spaghetti .,True,,what exactly supposed call that singular strand pasta it turn out word for individual piece spaghetti spaghetto . what exactly supposed call that singular strand pasta it turn out word for individual piece spaghetti spaghetto . 19.07.201724.07.2017 lot strand spaghetti . just one spaghetto . italian language rule also applies ravioli . it 's raviolo eat just one . cannoli12.05.2019 'spaghetti ' literally mean 'little string ' . ' ' end noun make it plural 'spaghetto ' is just singular form word one 'little ... 04.04.2022 spaghetto mean `` little string . '' spaghetti on other hand mean `` lot little string . '' roughly descriptive pasta do n't think ... 23.07.2017 food fan have been left shock after discovering that single strand spaghetti is referred 'spaghetto'.not once wa allowed help make dinner slice tomato boil spaghetto one piece spaghetti wash dish . for more quotation using term see ... 30.08.2021 what exactly supposed call single strand pasta it turn out is word for individual piece spaghetti spaghetto ... 26.07.2017 according dictionary.com spaghetti is plural form spaghetto meaning one piece is just called spaghetto.21.07.2017 guy stop working because spaghetti is plural single 'spaghetti ' is actually 'spaghetto . '24.07.2017 it turn out that spaghetti is actually italian plural word which mean individual noodle should called `` spaghetto '' . advertisement .,9330.0
diamond is hardest natural substance world .,True,,indeed diamond is hardest material world . material hardness is property determined scratch resistance . substance can only scratched ... 2015/12/18 while diamond may hardest naturally occurring substance found on earth explains not hardest available ... naturally occurring hardest substance on planet diamond score perfect 10 on mohs hardness scale indicating that it is hardest ... 1 2019/06/18 although diamond commonly known hardest material world actually six material that harder . diamond still one ... diamond is hardest naturally occurring substance found on earth . it is not hardest known substance . it is very hard compress diamond . correct option ishardness is substance 's ability resist plastic deformation yes definition diamond indeed hardest subtance on earth.2016/01/19 ask most people what hardest material on earth is will probably answer diamond . it name come from greek word ... 2009/02/16 gemstone lost it title world 's hardest material man-made nanomaterials some time ago . now rare natural substance look likely ...,43900000.0
banana available color other than yellow,True,,obviously majority banana world 's most popular fruit we come across yellow . previously blogged about benefit green banana basically banana that have not ripened enough turn yellow what may not know is that actually red banana also known red dacca banana . obviously majority banana world 's most popular fruit we come across yellow . previously blogged about benefit green banana basically banana that have not ripened enough turn yellow what may not know is that actually red banana also known red dacca bananas.17 oct. 2018 banana is n't plain boring yellow colored fruit which most u sure that it is ! fruit come many different shape size ... 21 dc . 2018 7rponses21 avr . 2008 while we accustomed thinking sweet banana having yellow skin can also feature red pink purple black tone ripe.2 dc . 2009 banana lemon duckling standard illustration for yellow . child often tested on other item opposite for example ... 3 fvr . 2022 original banana wa different from current sweet yellow banana . ... reportedly more than 99 percent banana consumed ... 2 fvr . 2022 ... banana yellow is fruit inside different color ... banana is green it is actually more acidic than sweet.22 janv . 2022 two way answer banana change color upon ripening . ... surprisingly besides unappetizing brownish yellow peel ...,295.0
total length great wall china add up 13171 mile,True,,total length china great wall is 21196.18 kilometer 13170.70 mile ming great wall stretch about 8851.8 kilometer 5500.3 miles.the great wall china length dynasty official length great wall china is 21196.18 kilometer 13170.7 mile according ... great wall china is series fortification that were built across historical northern border ancient chinese state imperial china ... great wall china is barrier fortification northern china running west-to-east 13171 mile 21196 km from jiayuguan pas west ... 2022/05/26 chinese name /chng chng long wall /wn l chng chng ten-thousand-li-long wall location northern china length 21196 ... great wall china * total length all section great wall china ever built add up about 21196 kilometer 13171 mile ... shaped like huge dragon great wall ha wind up down through desert mountain grassland plateau . it estimated length is 21196 km . 13171 ... 2022/07/20 wall is longest man-made structure world with total length about 13170.7 mile 21196.19 km.2021/03/10 total length all section great wall china ever built add up about 21196 kilometer 13171 mile including overlapping ...,22600.0
manchester united football club ha never won uefa champion league trophy,False,,top 5 club that have never won uefa champion league 5 arsenal 4 valencia 3 atletico madrid 2 paris saint-germain 1 manchester city.3 dec 2020 20. manchester city - 1 final 0 wins.all team with bigger average borussia dortmund manchester united barcelona real madrid bayern munich have been european champion . german ... 20 oct 2016 1. arsenal 2. chelsea 3. manchester utd 4. liverpool 5. manchester city champion league winner 6. tottenham europa league winner.the uefa champion league is ultimate club competition european football manchester united have won trophy three times.back european cup back european cup back european cup competition which manchester united ha had most success is european cup now known uefa champion league ... 16 mar 2022 manchester united crashed out champion league with defeat ... have won just two tie since 2011 elite european club ... manchester united have won many trophy over past fifty year . great sir alex ferguson won thirteen league title wa coach ... 5 day ago football league cup 5 european cup/uefa champion league 3 second division/championship 2 fifa club world cup 1 .,39500000.0
clampett family struck oil near home ozarks before moving beverly hill 1960 's,True,,clampett 's strike oil - youtubehttps//www.youtube.com watchhttps//www.youtube.com watchthis series follows clampett family from ozarks posh beverly hill after strike oil become millionaire . banker mr. drysdale try ... apr 29 2021 family from beverly hillbilly struck gold very first episode 1960s sitcom . case struck oil.in episode jed clampett sold swamp oil company get paid 25 million dollar for it head off beverly hill . original air date.as clampetts poor backwoods family from hill ozarks move posh beverly hill california after striking oil on land . show ... dec 23 2020 cbs sitcom told story clampett family ... family patriarch jed clampett up moved beverly hills.may 30 2022 just think 'd been learned leave well enough alone ... clampetts strike oil ozarks move beverly hill ... clampetts ' truck wa 1921 oldsmobile model 46 roadster . it wa lent cousin pearl family moved california . truck body wa actually found ... beverly hillbilly american television show that wa one most popular ... moved hillbilly family swanky beverly hill california ...,29000.0
tradition dyeing easter egg started united state,False,,apr 5 2020 practice decorating eggshell itself is quite ancient with decorated engraved ostrich egg found africa that 60000 year old.history oldest tradition which continues used central eastern europe is use dyed painted chicken egg . decorated easter eggs.the early christian mesopotamia began custom dyeing easter egg . originally christian dyed egg red represent blood jesus christ that wa ... mar 24 2021 decorating egg is tradition that date back least 2500 year . is evidence that trypillian culture that lived central ... apr 14 2017 it wa late 19th early 20th century that dyed easter egg became something give child rather than church poor ... mar 20 2019 it 's likely idea wa connect magic egg protect family banish evil insure spring 's return . christianity ... apr 18 2019 idea egg-laying easter rabbit likely first started germany where for hundred year parent have been passing down ... jan 29 2020 tradition decorating egg ... practice painting egg go back ancient time decorated shell were part ritual ... apr 4 2012 commercial dye were unheard-of . during early egg decorating era pennsylvania german developed unique method add design eggs.apr 12 2017 painted egg early history ... decorating egg pre-dates christianity actually . some 2500 year ago ancient persian zoroastrian ...,16700000.0
over 30000 variety apple existing world,True,,30000 apple variety found all over world only 30 used traded commercially . apple third most important fruit worldwide production ha long history . early 2500 year ago roman cultivated six different apple variety . 30000 apple variety found all over world only 30 used traded commercially . apple third most important fruit worldwide production ha long history . early 2500 year ago roman cultivated six different apple variety . 19 juin 2013here 's look many type apple exist which one most ... 7500 variety apple existence throughout world2500 ... apple far most diverse fruit term variety . uk alone we have developed over 2500 variety apple 7000 that exist ... over 30000 variety apple existing world . is factorfiction sugarandspice yolanda mulwa.7500 variety apple grown throughout world . 100 variety apple grown commercially united state . apple grown commercially ... traduire cette page apple cultivated over 7500 different type all over world . united state over 100 different type apple produced.there more than 30000 apple variety world - each one taste special look different ha different storage capacity also shelf-life ... walter leal filhothe number higher plant specie existing on earth is estimated ... 1904 were 7000 variety apple cultivated united state .,7.0
only two men signed declaration independence on july 4 1776,True,thomas jefferson benjamin franklin john adam all wrote that it wa signed congress on day it wa adopted on july 4 1776. thomas jefferson benjamin franklin john adam all wrote that it wa signed congress on day it wa adopted on july 4 1776. participant delegate second contine ... date august 2 1776 venue independence hall,delegate signed state from north south beginning with josiah bartlett new hampshire ending with george walton georgia . john dickinson ... aug 2 2021 richard henry lee george wythe elbridge gerry oliver wolcott lewis morris thomas mckean matthew thornton signed document after ... jul 3 2019 some signer world famous among thomas jefferson benjamin franklin john adam some obscure.not every man had been present congress on july 4 signed declaration on august 2. historian believe seven 56 signature on document were ... feb 8 2022 declaration independence printed john dunlap july 4 1776 ... on parchment on august 2 1776 delegate began signing it.george washington john jay alexander hamilton james madison typically counted `` founding father '' none signed declaration ... jul 4 2021 declaration wa officially written thomas jefferson john adam benjamin franklin roger sherman robert . r. livingston . although ... one most widely held misconception about declaration independence is that it wa signed on july 4 1776. fact independence wa formally ... declaration independence wa approved second continental congress on july 4 1776 it wa not signed until almost month later .,1010000.0
battle hastings took place 1066,True,,jun 10 2019 battle hastings wa bloody all-day battle fought on october 14 1066 between english norman force . norman led ... battle hastings battle on october 14 1066 that ended defeat harold ii england william duke normandy established norman ... english army led king harold took up position on senlac hill near hastings on morning 14th october 1066. harold 's exhausted ... on 14 october 1066 one most significant battle english history took place sussex known later generation battle hastings.oct 14 2019 where did battle hastings actually take place 8 fact about 1066 battle ... battle hastings which anglo-saxon king ... may 27 2022 king harold ii england is defeated norman force william conqueror battle hastings fought on senlac hill ... battle which became known battle hastings wa n't first battle which harold wa forced defend crown on 25 september 1066 'd ...,1510000.0
pineapple grow on tree,False,contrary what some people think pineapple do n't grow on tree grow out ground from leafy plant . plant consists stocky leaf whorled around central stem . healthy pineapple plant tapered swordlike leaf can grow up about 5 foot 1.5 meter long . contrary what some people think pineapple do n't grow on tree grow out ground from leafy plant . plant consists stocky leaf whorled around central stem . healthy pineapple plant tapered swordlike leaf can grow up about 5 foot 1.5 meter long . 31 mar 2014,even though pineapple considered fruit fruit generally come from treesunless it 's berry pineapple actually grow on plant close ... surprisingly pineapple do n't actually grow on tree . 're grown from center leafy plant . aggregate fruit which is formed from ... do pineapple grow on tree well straight answer question isno ! because pineapple 's plant is not ... answer no pineapple do n't grow on tree . pineapple plant also known ananas comosus is actually shrub . it ha unique appearance with long sharp ... 5 dec 2021 no pineapple do not grow on tree . is no such thing pineapple tree . pineapple plant grow close ground spiky ... 12 mar 2022 pineapple do not grow on tree instead grown on small plant that is typically 2 3 ft tall ha leaf similar bromeliad ... live area where water is scarce just give what can spare . pineapple grow with very little water . make sure soil is thickly mulched ...,965000.0
coffee is made from berry,True,what we call coffee bean is actually seed cherry-like fruit . coffee tree produce berry called coffee cherry that turn bright red ripe ready pick . fruit is found cluster along branch tree . skin coffee cherry exocarp is thick bitter . what we call coffee bean is actually seed cherry-like fruit . coffee tree produce berry called coffee cherry that turn bright red ripe ready pick . fruit is found cluster along branch tree . skin coffee cherry exocarp is thick bitter .,coffee bean is seed coffea plant source for coffee . it is pip inside red purple fruit often referred coffee cherry.coffee berry commonly called coffee cherry small rounded fruit about size grape that grow cluster along branch coffee ... is coffee bean fruit ... again no . what we call coffee bean is seed coffee cherry which is seed-bearing body formed from flower . that ... oct 25 2021 coffee fruit also known coffee cherry coffee berry is small round stone fruit produced coffee plant . it is about size ... jul 23 2021 cascara is byproduct made from coffee skin . it ha long been popular with coffee farmer latin america . after cherry have been ... coffee fruit also known coffee berry coffee cherryaug 28 2020 coffee fruit is type stone fruit that 's produced coffee plant . it 's often referred other name including coffee cherry ... therefore we can say that coffee bean actually come from fruit ! coffee berry usually contain bean that split two . however around 5 ... coffee cherry is familiar name given fruit coffee plant . coffee cherry is type drupe stone fruit that is usually red colour ...,34000000.0
rapper nicki minaj is over 180 cm 5 ft 10.9 height,False,,2018/11/21 it can kind tricky trying figure out tall female rapper really is . video look really tall well on ... rapper nicki minaj is over 180 cm 5 ft 10.9 height . false . nicki minaj is 'only ' 157 cm 5 ft 1.8 tall . hard tell with all high ... 2022/07/11 rapper nicki minaj is over 180 cm 5 ft 10.9 height . answer false . nicki minaj is 'only ' 157 cm 5 ft 1.8 tall.view complete result gradebook mastery dashboard start class game ... q.rapper nicki minaj is over 180 cm 5 ft 10.9 height .,4.0
seahorse only have intestine is no sign stomach for nutrient absorption from food .,True,seahorse do n't have stomach just intestine for absorption nutrient from food . food pass through digestive system rapidly eat plankton small crustacean almost constantly . seahorse do n't have stomach just intestine for absorption nutrient from food . food pass through digestive system rapidly eat plankton small crustacean almost constantly .,without stomach food essentially get digested on go . absorb nutrient from food it travel through digestive system ... another drawback relation feeding is that present simple intestinal tract without functional stomach novelli et al . 2015 palma et al . 2014 ... 15-apr-2010 also seahorse do n't even have stomach ! have eat constantly since food particularly go right through . adult seahorse ... 05-mar-2021 seahorse only have intestine is no sign stomach for nutrient absorption from food . true . 38. scallop have close 100 ... 07-jun-2018 long-snouted seahorse hippocampus guttulatus cuvier 1829 is ... planas et al . 2008 it ha recently been introduced ... very little absorption nutrient occurs stomach . once feed is released from stomach it enters small intestine . small intestine.some animal including seahorse lungfish platypus have no stomach . food go from oesophagus straight intestine . we make 1 3 ... pipefish seahorse family syngnathidae male provide all ... within pleuronectiformes is gradient stomach size that ha been ...,476000.0
liver is largest organ human body,False,did know that liver is second largest that make it largest solid internal organ have weighing 3-3.5 pound . it is located underneath rib lung diaphragm on top gallbladder stomach intestine . did know that liver is second largest that make it largest solid internal organ have weighing 3-3.5 pound . it is located underneath rib lung diaphragm on top gallbladder stomach intestine . aug 26 2021,liver largest solid internal organ is liver . it weighs approximately 33.5 pound 1.361.59 kilogram is about size football.the liver is largest internal diverse metabolically complicated organ human . human liver is involved 500 different function . human ... largest organ human body is one can see most easily skin . skin is considered organ because it ha some very specific ... liver is largest internal most metabolically complex organ human . it 's pretty incredible . liver performs over 500 different function ... mar 2 2018 liver is largest solid organ largest gland human body . it carry out over 500 essential tasks.nov 6 2017 after all 's lot love . more than 3 pound liver is size football human body 's second-largest organ behind ... g swann 2010 cited 37 skin is body 's largest organ . j vi commun med . 2010 dec334148-9 . doi 10.3109/17453054.2010.525439 . author.the liver is largest solid organ body . it remove toxin from body 's blood supply maintains healthy blood sugar level regulates blood ...,21300000.0
