question,truthValue,snippet,description,results
avatar wa highest-grossing movie decade,True,,avatar remains highest-grossing movie all time global box office with 2.84 billion ahead disney/marvel 's avenger endgame 2.79 billion second . spider-man no way home is sixth-highest-grossing title worldwide with running total 1.8 billion . avatar remains highest-grossing movie all time global box office with 2.84 billion ahead disney/marvel 's avenger endgame 2.79 billion second . spider-man no way home is sixth-highest-grossing title worldwide with running total 1.8 billion . 15 feb. 202218 maj 2022 directed james cameron avatar hold many box-office record including title for overall highest-grossing film.15 mar 2021 sci-fi epic debuted 2009 held global box office title for decade until it wa overtaken marvel 's avenger endgame 2019.13 mar 2021 saturday `` avatar 's '' box office gross surpassed 2.802 billion ... avatar is once again highest-grossing film all time.13 mar 2021 'avatar ' overtakes 'avengers endgame ' all-time highest-grossing film worldwide rise 2.8b amid china reissue update.27 juni 2019 james cameron 's avatar ha remained highest-grossing film for nearly decade wa movie -- which most do n't seem ... 3 maj 2022 ... box office earnings highest-grossing movie all time . ... avatar sequel more than decade after it theatrical success.13 mar 2021 james cameron 's film rung up estimated 3.5 million new ... set surpass 'avengers endgame ' highest-grossing movie all time.13 mar 2021 with re-release china avatar box office total ha surpassed avenger endgame become highest grossing movie all time ... 12 mar 2021 `` avatar '' is once again highest-grossing movie history ... ultimate box office crown for decade with 2.7897 billion worldwide .,4.0
peregrine falcon is fastest bird world,True,,jun 23 2022 peregrine falcon is fastest animal world ! michael shake/shutterstock.com . peregrine falcon take crown fastest ... apr 11 2019 peregrine falcon is fastest bird fact fastest animal on earth dive . it executes dive peregrine ... nov 21 2016 first some background peregrine falcon is indisputably fastest animal sky . it ha been measured speed above 83.3 m/s ... bird that can achieve greatest airspeed is peregrine falcon able exceed 320 km/h 200 mph it dive . close relative common swift ... jul 11 2022 peregrine falcon is fastest bird world it come speed it can reach whilst diving . can reach staggering 200 ... while peregrine falcon golden eagle show remarkable speed diving after prey other bird much faster level flight.aug 12 2020 not only is magnificent raptor fastest bird world also fastest animal on planet . peregrine falcon is ... apr 22 2022 incredible death-from-above skill set make peregrine falcon not only fastest bird world fastest animal ...,156000.0
george washington wa third president united state,False,george washington february 22 1732 december 14 1799 wa american military officer statesman founding father served first president united state from 1789 1797. george washington february 22 1732 december 14 1799 wa american military officer statesman founding father served first president united state from 1789 1797. year service 17521758 virginia militia ... parent augustine washington mary ball w ... rank colonel virginia militia general c ... branch/service virginia militia continental ar ...,presidency george washington began on april 30 1789 washington wa inaugurated first president united state ... oliver ellsworth third chief justice united states.jan 5 2022 george washington 1732-99 wa commander chief continental army during american revolutionary war 1775-83 served two ... nopresidentvice presidentyears servicecongresses1george washingtonjohn adamsapr . 30 1789mar . 3 17971 2 3 42john adamsthomas jeffersonmar . 4 1797mar . 3 18015 63thomas jeffersonaaron burrmar . 4 1801mar . 3 18057 8view 57 more rowsgeorge washington born 22 february 1731 - westmorland county virginia died 14 december 1799 - mount vernon va president united state 30 april ... feb 27 2021 george washington had set unofficial precedent 1796 decided several month before election not seek third term.the ... gilder lehrman collection 1798 george washington had led america victory revolution helped create american government served two term ...,71600000.0
atlantic ocean is biggest ocean on earth,False,covering approximately 20 percent earth 's surface atlantic ocean is second largest ocean basin world following only pacific . however it is only slightly larger than half size pacific ocean . covering approximately 20 percent earth 's surface atlantic ocean is second largest ocean basin world following only pacific . however it is only slightly larger than half size pacific ocean . 26 feb 2021,26 feb 2021 pacific ocean is largest deepest world ocean basins.atlantic world atlantic ocean is second-largest world 's five ocean with area about 106460000 km2 41100000 sq mi . it cover ... atlantic ocean is second-largest ocean on earth accounting for one fifth earth 's surface 29 earth 's water . united state is le ... 4 june 2010 world 's second largest ocean atlantic ocean cover about 21 percent earth 's surface . separating north south america from europe ... 18 mar 2019 second-largest ocean on earth atlantic drive weather pattern including hurricane is home many specie from sea ... 1 june 2022 pacific ocean is largest ocean world taking up much area atlantic ocean indian ocean combined . ocean is ... 16 june 2021 pacific ocean . area 63800000 square mile 165250000 square kilometer . pacific ocean is largest ocean world atlantic ... pacific ocean represents 45 percent global ocean coverage . it is also largest body water single biggest feature on planet earth . ... 7 june 2022 three recognized major ocean pacific atlantic indian ocean basin . these obviously biggest that order .,11400000.0
rio de janeiro is capital city brazil,False,,portuguese court imperial capital rio de janeiro is capital state same name brazil 's third-most populous state after paulo ... rio de janeiro became colonial capital 1763 wa capital independent brazil from 1822 until 1960 national capital wa moved ... o rio de janeiro foi segunda capital do brasil . cidade perdeu o seu posto em 1960 para cidade planejada de braslia . leia o texto e descubra detalhes ... 5 de mai . de 2019 brazil rio de janeiro brasilia ... rio de janeiro wa it capital for age . city wa crowded government building were far apart ... none it is currently brasilia . historically were once lifetime capital before it finally moved brasilia 1960 * ... melhor resposta none those.the capital city brazil is braslia.a city shaped like airplane ... rio de janeiro is capital city state rio de janeiro second largest city brazil third largest metropolitan area ...,114000000.0
two part body that ca n't heal,False,teeth only body part that can not repair . repairing mean either regrowing what wa lost replacing it with scar tissue . teeth can not do that . brain for example will not regrow damaged brain cell can repair area laying down other scar-type tissue . teeth only body part that can not repair . repairing mean either regrowing what wa lost replacing it with scar tissue . teeth can not do that . brain for example will not regrow damaged brain cell can repair area laying down other scar-type tissue .,mar 12 2015 brain lung ligament can not repair once damaged.jan 22 2022 teeth do n't repair like other body organ because teeth made enamel which is hardest substance entire human ... apr 20 2015 natural defense liver is one only organ that can spring back after part it tissue dy process is called compensatory ... mar 3 2020 liver very good regenerating because can make new cell . cell liver called hepatocytes.mar 9 2018 liver is organ best regenerating itself . instead scarring over damaged tissue like most organ liver can replace old ... mar 22 2019 liver is only organ human body that can regenerate . although some patient have diseased portion liver removed ... mf pittenger 2001 cited 11 osiris is delighted support nature insight on biology potential stem cell . almost 20 year ago field stem cell ... sep 26 2016 ca n't brain repair itself like skin can nerve cell do not renew nerve cell have trouble regrowing damaged parts.aug 7 2019 body also heal regenerate through stem cell . fetus is being formed womb embryonic stem cell divide ...,28500000.0
sega dreamcast wa released 2000 's,False,,video game console video game consolela dreamcast dormukyasuto est une console de jeux vido dveloppe par sega et le successeur de la saturn.24 aot 2020 sega 's dreamcast console wa ahead it time helped shape landscape gaming 2000s today.the actual release ps2 wa not until march 2000 japan late-october 2000 united state . sony 's press release despite being year ahead ... roughly 2.5 million dreamcasts were thought have been sold u march 31st 2000 with 13.83 million piece software . within five month launch ... dreamcast wa released japan november 1998 nearly year later north america . wa odd release window playstation 2 would ... le grand vnements de sega avant le lancement de la dreamcast avec une release d'environ 2000 photo d'poque . le tokyo game show et l'e3 sont de vnements ... la console tv sega dreamcast 2000 sries cx-1 - youtubehttps//www.youtube.com watchhttps//www.youtube.com watchbill loguidice matt barton 2014 computerssega 's dreamcast received lot pre-release hype including from it official ... jet grind radio 2000 sega calledjet set radio everywhere except.ingrid richardson larissa hjorth hugh davy 2021 language art disciplinessega 's dreamcast released 1998 wa ahead it time first console ... handheld game console market also expanded early 2000s with ...,2.0
mount everest is tallest mountain world,True,,mount everest is highest himalayan mountain andat 8850 meter 29035 feetis considered highest point on earth . mount everest is peak himalaya mountain range . it is located between nepal tibet autonomous region china . mount everest is highest himalayan mountain andat 8850 meter 29035 feetis considered highest point on earth . mount everest is peak himalaya mountain range . it is located between nepal tibet autonomous region china . 19.05.202219.01.2022 mount everest 's peak is highest altitude above mean sea level 29029 foot 8848 meter . mount chimborazo 's peak is furthest point ... 26.12.2021 mount everest is tallest mountain above sea level while mauna kea can certainly claim world 's tallest mountain sea level ... mount everest is called world 's highest mountain because it ha `` highest elevation above sea level . '' we could also say that it ha `` highest altitude ... mount lamlam on guam is periodically claimed among world 's highest mountain because it is adjacent mariana trench most extreme claim ... 26.05.2020 mt . everest 8850 meter 29035 foot above sea level undeniably claim point highest altitude world . title tallest ... mountain rangehighest mountainheightcountrieshimalayasmount everest8848 mnepal chinakarakoramk28611 mpakistanhindu kushtirich mir7708 mpakistanweitere 78zeilen anzeigen01.03.2020 highest mountain world is mount everest sitting pretty 8848m himalaya nepal . it 's likely already knew that . after ... which way measuring world 's tallest mountain do think is best 1 tallest from sea level mount . everest . 2 tallest from it base on land .,7750000.0
smallest particle element is molecule .,False,smallest particle element that can not divided broken up chemical mean . it consists central core nucleus containing proton neutron with electron revolving orbit region surrounding nucleus . smallest particle element that can not divided broken up chemical mean . it consists central core nucleus containing proton neutron with electron revolving orbit region surrounding nucleus .,sep 1 2015 smallest particle molecule is atom . smallest unit atom electron proton neutron.apr 24 2017 element is substance completely made up one atom . thus periodic table element is effectively list all known type ... atom is smallest particle element having same chemical property bulk element . first accurate theory explaining nature of.1 answeroct 8 2019 2 answerssep 18 2016 atom . for element smallest particle that can exist it still have property that element is atom.atoms simplest form matter that can exhibit all property element . no particle smaller than atom that can showcase these ... everything is made atom . atom is smallest particle element like oxygen hydrogen . atom join together form molecules.an atom is smallest unit pure substance element that can exist still retain property original substance element .,2750000.0
human body is about 60 water,True,up 60 human adult body is water . according h.h . mitchell journal biological chemistry 158 brain heart composed 73 water lung about 83 water . skin contains 64 water muscle kidney 79 even bone watery 31. up 60 human adult body is water . according h.h . mitchell journal biological chemistry 158 brain heart composed 73 water lung about 83 water . skin contains 64 water muscle kidney 79 even bone watery 31 .,most human body is water with average roughly 60. amount water body change slightly with age sex hydration levels.11 feb 2020 average adult male is about 60 water . average adult woman is about 55 water because woman naturally have more fatty tissue than men.3 ... remove toxin from body help with digestion metabolic function provides elasticity muscle joint . inadequate hydration water is actually ... typical percentage human body that is water is 60 adult men according dr. jeffrey utz allegheny university 50 adult woman according ... 10 jul 2019 while eight glass rule is good start it is n't based on solid well-researched information . body weight is made up 60 percent ... probably heard that human body is made up over 70 percent water drinking enough click here learn more ! 7 may 2018 on average 70-kg man is made up about 42 l total water . 28 litre is intracellular water 14 l is found extracellular fluid ... physiology body water is water content animal body that is contained tissue blood bone elsewhere.the body average adult human being contains 60 water most which is contained inside cell . billion body ...,104000000.0
lying frog on it back softly caressing it tummy it is possible hypnotize it,True,,during career won 26 academy award four were honorary wa nominated 59 time . lying frog on it back softly caressing it tummy it is possible hypnotize it . moon is wider than australia . answer false . during career won 26 academy award four were honorary wa nominated 59 time . lying frog on it back softly caressing it tummy it is possible hypnotize it . moon is wider than australia . answer false.1 juin 2015 pet frog 's tummy with other fingertip using repetitive stroking motion from just under it chin bottom it belly.28 oct. 2014 alligator method also work on lizard frog . hypnotize lizard frog put it on it back hold it still for few seconds.24 nov. 2020 it is possible hypnotize frog placing it on it back gently stroking it stomach . see ifunny ... 6 avr . 2022 it is possible hypnotize frog placing it on it back gently stroking it stomach . trivia quiz general knowledge gk click flip.purple disco machine sophie giant - youtubehttps//www.youtube.com watchhttps//www.youtube.com watch20 juin 2022 interesting fact about animal number two can hypnotise frog softly caressing it tummy while it is lying down on it back.28 sept. 2016 `` it 's state hypnotism generated flipping animal on it back fully ... 6 mai 2020 think that work on lot different animal including some human though position belly rub up down ...,1.0
on august 6 1945 united state dropped atomic bomb on hiroshima .,True,,traduire cette page il y 6 jours il y 6 jours on august 6 1945 during world war ii 1939-45 american b-29 bomber dropped world 's first deployed atomic bomb over japanese ... united state detonated two atomic bomb over japanese city hiroshima nagasaki on 6 9 august 1945 respectively.atomic bombing hiroshima nagasaki during world war ii american bombing raid on japanese city hiroshima august 6 1945 nagasaki ... early morning hour august 6 1945 b-29 bomber named enola gay took off from island tinian headed north northwest toward japan . ... bombing pearl harbor japanese initiate united state entrance war just four year before wa still fresh on mind many ... sixteen hour ago american airplane dropped one bomb on hiroshima important japanese army base . that bomb had more power than 20000 ton t.n.t .... 6 aot 2020 on morning august 6 1945 american b-29 bomber enola gay dropped atomic bomb on japanese city hiroshima.the two atomic bomb dropped on japan 1945 killed maimed hundred thousand people effect still being felt today.world war ii marked firstand onlywartime use atomic weapon . u.s. bombing japan helped bring end deadliest war history ...,736.0
pinocchio wa first animated full-color walt disney feature film,False,it wa second animated feature film produced disney made after first animated success snow white seven dwarf 1937. plot involves old italian woodcarver named geppetto carves wooden puppet named pinocchio . it wa second animated feature film produced disney made after first animated success snow white seven dwarf 1937. plot involves old italian woodcarver named geppetto carves wooden puppet named pinocchio . based on adventure pinocchio ca ... production company walt disney production release date february 7 1940 center thea ...,adapted from novel c. collodi it chronicle adventure wooden puppet whose lonely maker geppetto wish were real boy.pinocchio 1940 disney 's second feature-length animated film followed after success snow white seven dwarf 1937 wa produced during ... living puppet with help cricket conscience must prove worthy become real boy.a living puppet with help cricket ... character pinocchio character pinocchio character pinocchio film star puppet - brought life fairy - try earn right become real boy face ... missing color color11 nov 2014 snow white seven dwarf will always first . disney 's second feature gave studio feature animation some it ... 26 june 1992 many people choose `` snow white seven dwarf '' favorite feature cartoon from disney 's golden age . my choice is `` pinocchio . '' ... 7 feb 2015 upon it new york city premiere on february 7 1940 critic hailed film masterpiece even day many prefer it disney 's ... pinocchio 's lie 1940 classic disney animation hd - youtubehttps//www.youtube.com watchhttps//www.youtube.com watch,549000.0
asos stand for seen on screen,True,,for back were n't listening asos stand for seen on screen . asos.com . that 's because asos first launched 2000 it wa celebrity-linked clothing website . for back were n't listening asos stand for seen on screen . asos.com . that 's because asos first launched 2000 it wa celebrity-linked clothing website . 11 de ago . de 2017asos mean seen on screen . abbreviation is mostly used categoriesfashionscreenshoppingcodingbusiness . rating 1.7. asos stand for `` seen on screen '' . can shop anything see on asos instagram on it youtube channel . next gallery.the asos mean seen on screen . we proud list acronym asos largest database abbreviation acronym . following image show one ... what doe asos stand for hop on get meaning asos . acronym /abbreviation/slang asos mean seen on screen . acronymandslang.com.what doe business finance asos stand for hop on get meaning asos . business finance acronym /abbreviation/slang asos mean seen on screen.1 de fev . de 2021 what doe asos stand for ... asos stand for seen on screen with original tagline saying 'buy what see on film tv ' . that 's ... 1 de dez . de 2020 asos is acronym for seen on screen . not many buyer aware fact . it cleverly describes with great eloquence ... asos seen on screen fashion clothing site asos automated surface observing system asos air support operation squadron usaf asos sense ... looking for definition asos find out what is full meaning asos on abbreviations.com ! 'as seen on screen ' is one option -- get view more ...,1190000.0
mamenchisaurus hochuanensis is dinosaur that ha longest neck lived what is now china,True,,mamenchisaurus is genus sauropod dinosaur known for remarkably long neck which made up nearly half total body length . numerous specie have ... remains some seven specie all large long-necked have been found deposit dating back some 160 million year region elsewhere china.sauropods had longest neck among dinosaur ... mamenchisaurus lived area today 's china mongolia time earth wa very warm ... mamenchisaurus wa long-necked long-tailed quadrupedal plant-eating sauropod . ornithischian dinosaur date from late jurassic period.fun fact dinosaur with longest neck for it body size is mamenchisaurus hochuanensis sauropod dino that lived what is now china . ... mamenchisaurus wa dinosaur that lived during late jurassic period wa ... mamenchisaurus is largest known dinosaur from asia ha ... apr 18 2021 however none had neck long mamenchisaurus not ... somewhere eastern part laurasia on what is now china.jan 23 2015 china 's overstuffed with awesome dinosaur today we 're taking look ... ... mar 29 2017 with such long neck might assume that mamenchisaurus ... type specie m. constructus which wa discovered china highway ...,2850.0
first football world wa manufactured from pig 's bladder,True,,oldest football ever found wa made 1540s . it consists pig bladder covered with piece leather possibly from deer . it wa found 1981 stirling castle scotland . course it wa n't always most pleasant task blow up pig bladder use football . oldest football ever found wa made 1540s . it consists pig bladder covered with piece leather possibly from deer . it wa found 1981 stirling castle scotland . course it wa n't always most pleasant task blow up pig bladder use football.5 aug. 2000 first properly made ball wa simply pig sheep 's bladder inflated good old fashioned lung power knotted end.31 jan. 2014 fact pigskin were originally made out animal bladderssometimes bladder pig which is thought moniker pigskin ... long before american football wa invented nfl wa created ball were inflated pig bladder . it 's true ! do n't know about would not ... 20 dec. 2019 inflatable rubber bladder wa first made 1862 is credited richard lindon . lindon 's wife died lung disease relatively young ... 25 juni 2022 early football were made from animal bladder including from cow deer sometimes even pig . bladder wa inflated it wa ... 20 mar 2017 medieval europe pig bladder were inflated with air used ... first rubber football wa made 1855 wa followed up ... charles goodyear patented vulcanised rubber 1836 made first rubber football bladder 1855. prior that pig 's bladder were used football ... first ball were made natural material such inflated pig bladder later put inside leather cover which ha given rise american ...,9.0
can find desert death california,False,overview . death valley lie just east high peak sierra nevada mountain central california . 282 foot below sea level it is lowest point united state . it is also both hottest driest place united state . overview . death valley lie just east high peak sierra nevada mountain central california . 282 foot below sea level it is lowest point united state . it is also both hottest driest place united state .,death valley is desert valley eastern california northern mojave desert bordering great basin desert . during summer it is one ... mar 9 2022 death valley national park is stunning area one famous desert california . mojave desert is nearly 50000 square mile ... jul 12 2022 southern california is home five most unforgettable desert region park entire usa . desert park resource is here ! oct 22 2018 located both california nevada death valley national park is largest national park lower 48 state ha nearly 1000 ... located on border california nevada death valley national park wa designated 1933 is home one world 's strangest phenomenon rock ... mojave desert arid region southeastern california portion nevada arizona utah u.s. it wa named for mojave people . mojave desert ... 3119 youtube peter santenello apr 3 2022 apr 3 2022,36300000.0
animation film finding nemo main protagonist is pufferfish,False,,feb 20 2013 - bloat is main character finding nemo minor character ... blowfish from finding nemo finding nemo movie finding nemo character ... finding nemo is 2003 american computer-animated adventure film produced pixar animation studio released walt disney pictures.here 's look main character `` finding nemo '' ... not used acting alone for animated film recording brook did n't enjoy process much ... gill is moorish idol major character disney/pixar 's 2003 animated film finding nemo . is leader tank gang . gill is maverick ... 2021/06/01 'finding nemo ' is one pixar 's best most important is one big ... is one main character film fact ... finding nemo 2003 connection on imdb referenced featured ... dory ha same short-term memory problem memento 's main character.2018/02/22 finding nemo is animation movie produced pixar animation studio directed andrew stanton with co-direction lee unkrich ... 2014/05/17 2004 disney animated film finding nemo feature more than 50 ... we especially enjoy different character story seem ...,220000.0
