question,truthValue,snippet,description,results
name batman butler is albert,False,,alfred pennyworth is one main character lego batman movie voiced ralph fiennes . film is both butler father-figure ... british special force veteran turned butler alfred pennyworth is most loyal friend confidant both bruce wayne batman.jul 23 2019 debut alfred is portly music-hall actor aspiring detective arrives gotham city intending investigate batman ... jul 18 2014 1. last name alfred 's most widely accepted surname is pennyworth although is also referred alfred beagle several batman ... 3 answersfeb 1 2014 alfred many face batman 's butler . jeremy iron may next alfred pennyworth 's not first . let 's look back on ... sep 15 2002 starting with detective comic 38 april 1940 batman wa joined crime fighting partner robin boy wonder dick grayson . batman ... sep 8 2021 alfred 's life with bruce wayne thrust many role especially 's serving batman 's man-at-arms most trusted associate . one ...,1650000.0
toy story wa pixars first movie,True,,toy story wa first pixar-disney collaboration first feature-length animated film that wa completely computer generated . toy story wa first pixar-disney collaboration first feature-length animated film that wa completely computer generated.diese seite bersetzen toy story is 1995 american computer-animated comedy film directed john lasseter produced pixar animation studio released walt disney ... 19.11.2015 for it 20th birthday 'toy story ' creator john lasseter ed catmull andrew stanton reflect on decision that shaped film.04.01.2021 it 's first many case pioneer animated movie we see today it 's first cgi animated feature film that showcase ... 18.11.2020 release toy story 25 year ago marked paradigm shift animation cinema history . it wa first full-length feature pixar ... 19.11.2020 toy story other pixar movie . first feature-length film completely computer-animated pixar 's toy story wa both curiosity ... 29.12.2020 since release it very first feature film toy story 1995 pixar ha become one hollywood 's most celebrated animation studios.diese seite bersetzen toy story is cgi animated medium franchise created pixar distributed walt disney picture beginning with original 1995 film toy story .,32200000.0
spaghetto is singular form word spaghetti,True,,`` spaghetto '' is singular word for `` spaghetti '' internet may never same . fyi it 's not `` that noodle . '' imagine scenario have piping hot bowl spaghetti bolognese front dig spoon fork twirl up one lone noodle . `` spaghetto '' is singular word for `` spaghetti '' internet may never same . fyi it 's not `` that noodle . '' imagine scenario have piping hot bowl spaghetti bolognese front dig spoon fork twirl up one lone noodle . 19 de jul . de 201712 de mai . de 2019 'spaghetti ' literally mean 'little string ' . ' ' end noun make it plural 'spaghetto ' is just singular form word one 'little ... 18 de jul . de 2017 internet just discovered that singular form spaghetti is `` spaghetto . '' twitter ha been freaking out ever since one user tweeted about ... from italian spaghetto . nounedit . spaghetto plural spaghetti . rare prescriptive ... 15 de jan. de 2021 spago is italian word for 'string ' . spaghetto is diminutive form spago meaning 'little string ' larghetto from largo 'slow ' ... 17 de jul . de 2017 did know word spaghetti is plural noun large portion internet just discovered that week everybody is freaking ... 11 de set . de 2016 singular spaghetti is spaghetto . have good meal . yummy ! yummy ! answer is . helpful ... spaghetto is singular word for spaghetti . ... we could not afford spaghetti kid we used ramen noodle with ketchup called it spaghetto.30 de ago . de 2015 spaghetti is masculine plural diminutive that mean mentioned that singular is `` spaghetto '' that word is ...,6150.0
eiffel tower is located paris,True,,eiffel tower is located on champ de mar 5 avenue anatole france 7th arrondissement paris . symbolic monument heart paris ... eiffel tower is located seventh arrondissement paris elegant district with wide avenue beautiful architecture other tourist attraction ... 4 mar 2020 4 mar 2020 it height unique silhouette floating above paris landscape quickly made eiffel tower one most popular attraction paris.the eiffel tower is located seventh arrondissement near seine on left bank rive gauche river . tower is found one end ... eiffel tower wa designed engineer maurice koechlin emile nouguier . gustave eiffel redeemed right . project wa intended `` ...,59000000.0
trojan horse wa used greek mask way city troy win war,True,,traduzir esta pgina trojan horse refers wooden horse said have been used greek during trojan war enter city troy win war . is no ... trojan horse huge hollow wooden horse constructed greek gain entrance troy during trojan war . horse wa built epeius master ... greek build giant wooden horse hide it attack city trojan bring horse within wall . retelling famous trick ... greek under guidance odysseus built huge wooden horse horse wa symbol city troy left it gate troy . ... trojan war had been going on for decade with no end sight many greek hero dying odysseus came up with idea that won war for ... trojan war greek tradition started way for zeus reduce ... trojan army defending great city troy led king priam ... story trojan war recounted homer 's iliad ... would greek assured that troy would move it inside beloved city wall ... agamemnon wa chosen commander-in-chief next most prominent greek hero brother menelaus achilles patroclus two unrelated men named ... 30 de mar . de 2020 trojan horse is story from trojan war about subterfuge that greek used enter independent city troy win ...,1080000.0
violet is colour .,True,,violet is color light short wavelength end visible spectrum between blue invisible ultraviolet . it is one seven color that ... purple is mixture red which is opposite side spectrum than violet blue which is relatively far from violet it is term ... 20 mar 2022 violet is sixth color rainbow -- it is color on inner edge rainbow . violet is color between blue purple.in art violet is colour on conventional wheel located between red blue opposite yellow it complement . pigment for violet come from ... violet is color light short wavelength end visible spectrum between blue invisible ultraviolet . it is one seven color that ... preferred for it uplifting imaginative quirky quality violet is multifaceted color come . though many believe that violet purple ...,141000000.0
oldest educational establishment world is university al quaraouiyine morocco,True,,established very beginning morocco 's oldest imperial city university al-karaouine also written al-quaraouiyine al-qarawiyyin wa founded 859 is considered unesco guinness book world record oldest continually operating university world . established very beginning morocco 's oldest imperial city university al-karaouine also written al-quaraouiyine al-qarawiyyin wa founded 859 is considered unesco guinness book world record oldest continually operating university world . 19 mar 2018traduire cette page status world 's oldest university status world 's oldest university status world 's oldest university some source such unesco guinness world record cite al-qarawiyyin oldest university oldest ... 7 juin 2020 founded 859 a.d. tunisian-born fatima al-fihri morocco 's fez university is not only oldest higher education institution on ... 31 mar 2016 university al quaraouiyine fe morocco is oldest still operating degree-granting university world.the oldest existing continually operating educational institution world is university karueein founded 859 ad fez morocco.the al-qarawiyyin mosque religious school / college wa founded fatima ... world record is sometimes referred oldest university.26 mai 2020 not oxford bologna al-qarawiyyin is world 's first university . still functioning today moroccan city fe ... 8 mai 2020 moroccan city fez fatima al-fihri founded mosque which developed famous al-qarawiyyin university.it is no wonder with it tradition invention education that africa hold oldest university morocco which is run continuously . university al ...,11.0
snow 'wizard oz ' is real,False,day before computer-generated effect film crew had rely on practical trick simulate snow . scene which dorothy is awakened poppy field blanket snow engineered glinda good witch production reportedly used chrysotile asbestos . day before computer-generated effect film crew had rely on practical trick simulate snow . scene which dorothy is awakened poppy field blanket snow engineered glinda good witch production reportedly used chrysotile asbestos . 23 aug 2019,12 mar 2021 poppy scene wizard oz ha become infamous over year after viewer learned that fake snow scene wa 100 asbestos.17 sept 2014 movie wizard oz contained lethal asbestos exposure scene where snow made from100 industrial-grade chrysotile asbestos fell ... 12 mar 2021 snow 1939 's wizard oz wa made using toxic mineral asbestos . lot ha changed entertainment world since ... fake snow wa made up from industrial-grade white asbestos fibre unfortunately for actor production team everyone came contact with ... 15 apr 2021 1939 classic wizard oz used asbestos unique way fake snow . production team dropped thread asbestos from ceiling ... 15 nov 2021 famous poppy field scene which dorothy fell asleep snow used camera shot wa made from 100 industrial-grade ... 3 dec 2021 yes real lion pelt it wa very heavy hot inside it result . upvote 811 sept 2021 film snowfall triggered glinda good witch awakens dorothy lion from poppy-induced sleep . unfortunately scene ...,36100000.0
ape can not laugh,False,,13 jun 2015 study laughing chimpanzee rat offer clue about evolutionary pasta well mental health.apes ape . chimpanzee gorilla bonobo orangutan show laughter-like vocalization response physical contact such wrestling play chasing ... 22 may 2021 22 may 2021 new study journal bioacoustics found that 65 different specie animal have own form laughter . study co-author sasha ... 17 may 2021 17 may 2021 team identified 65 specie that `` laughed '' while playing most were mammal few bird specie demonstrated playful laughter . ... md ross 2010 cited 110 addition producing most distinctive laughter among great ape orangutan clearly were specie laugh least during tickling session ... 27 may 2015 dog rat chimpanzee other ape few specie that known emit unique sound similar laughter response pleasure . can ... 6 oct 2021 now we know that laughing is rare legitimate behavior amongst certain group animal . particular primate rodent bird ...,740000.0
archimedes is considered father history,False,,archimedes syracuse wa greek mathematician physicist engineer astronomer inventor from ancient city syracuse sicily.archimedes born c. 287 bce syracuse sicily italydied 212/211 bce syracuse most famous mathematician inventor ancient greece.mar 11 2022 archimedes l. 287-212 bce wa greek mathematician engineer inventor considered one greatest mathematician world history.archimedes is one more interesting character history ancient greece . ... father wa astronomer named phidias . archimedes may also ... wa son astronomer mathematician named phidias . aside from that very little is known about early life archimedes family . some ... archimedes ' father wa phidias astronomer . we know nothing else about phidias other than one fact we only know since archimedes give u ... is often regarded greatest mathematician ancient greek history father mathematics one greatest all time.archimedes wa born greek city-state syracuse on island sicily approximately 287 bc . father phidias wa astronomer.jan 25 2020 archimedes wa mathematician inventor from ancient greece . regarded one greatest mathematician history 's father ...,2030000.0
dog ha 20 leg .,False,,7 feb 2018 dog ha 20 nail because it ha dew claw . these little thumb line digit on it front foot . most breed dew claw removed ... which dog is better 20 nail dog v/s 18 nail dog - youtubehttps//www.youtube.com watchhttps//www.youtube.com watchmyths about dog with 20 claw dog fact tuc - youtubehttps//www.youtube.com watchhttps//www.youtube.com watch21 mar 2017 dewclaw is thumb . same is true for canine hind foot with dewclaw being big toe.polydactyly is rare occurrence where dog is born with extra toe toe . it 's not considered problem unless it catch on things.rare dog breed that commonly born with functional double dewclaws on both hind leg ! fact few dog breed for whom ... 28 june 2019 dewclaw is extra toe that is found on inside dog 's front leg . it 's completely normal digit with three bone two joint ... 19 may 2020 have ever wondered many toe dog ha perhaps never noticed . dog have 5 toe on front leg 4 on hind legs.4 mar 2021 most dog have 5 toe on front leg 4 toe on back . however certain breed especially giant dog breed such ...,161000000.0
french fry originated from france,False,,french fry north american english chip british english finger chip indian english french-fried potato simply fry batonnet ... 8 janv . 2015 french frythough indisputably frymay not actually french . some claim that fry originated belgium where villager along ... 15 juil . 2020 despite it name popularity french fry not french . origin can found belgium where historian claim potato were ... 24 janv . 2022 had assumed that name `` french fry '' indicates that classic fried potato dish hail from france 'd wrong.31 juil . 2018 we may never know actually invented french fry credit boaz ... despite common name dish fact that france ha ... despite it name french fry is not french . origin french fry have been traced back belgium where historian claim potato were being ... 23 sept. 2010 truth about fry is that it originated france noted said only fry 1760 is earliest origin that word ... despite it name fame french fry not french . origin strongly found northwest european country belgium.and belgium is country that consumes export most it is france that it wa born end 18th century . french fry one ... french fry generally thought have originated france belgium ha recently spoken out say snack is .,435.0
maximum length for video posted on tiktok is 60 second,True,,tiktok 's expansion allow up 10-minute video come le than year after it raised maximum length video three minute july 2021 up from 60 second before . tiktok 's expansion allow up 10-minute video come le than year after it raised maximum length video three minute july 2021 up from 60 second before . 28 fvr . 2022traduire cette page 1 juil . 2021 1 juil . 2021 previously tiktok video could up 60 second length after initially expanding from 15-second clip . 60-second video format ... 1 mar 2022 launch tiktok video were limited 15 second . tiktok later increased maximum video length time 60 second tripled that 3 ... 15 juin 2022 while user could originally only record upload 15-second video on tiktok that limit wa later extended one minute ... 10 mai 2022 what is maximum length for tiktok video look tiktok 's time ... 2017 tiktok bumped up video length 60 seconds.7 juil . 2021 week social medium news tiktok increase it video length limit from 60 second three minute snapchat share insight on it ... first thing consider is length . first tiktok video could only up 15 second long company recently extended limit 60 ... 10 mai 2022 video started 15-second clip grew 60-second clop now 3-minute video may on card testing with certain users.video file size up 287.6 mb io 72 mb android size video length max fifteen second can also combine story video together for up sixty ...,12.0
five player on baseball team,False,,2 june 2019 7 answersofficial number player on team baseball 9 basketball 5 field hockey 11 football american 11.in sport baseball each nine player on team is assigned particular fielding position it is turn ... 3 first baseman 4 second baseman 5 third baseman 6 shortstop ... baseball ha two team 9 player . fielding team 's position made up pitcher catcher first baseman second baseman shortstop third baseman ... each inning batting team sends one player known hitter batter turn bat known `` bat '' until three hitter `` out '' whilst ... 9 player on baseball field core position pitcher . pitcher 's job is throw ball over plate way that it is difficult for ... 5 way choosing male partner for woman 1. for woman 2 only 4 choice remaining ... baseball team ha 9 starting players.joe gergen 2022 juvenile nonfictiona guide today 's star all-time great legendary teamswith tip on ... 1927 only five player hit more 1936 another baseball legend named ... 1896 ... not syracuse 's first football team least first victorious one team new york epsilon furnished five player . baseball track ...,407000000.0
popping finger toe knuckle is bad for joint,False,,knuckle `` cracking '' ha not been shown harmful beneficial . more specifically knuckle cracking doe not cause arthritis . joint `` cracking '' can result from negative pressure pulling nitrogen gas temporarily joint such knuckle `` cracked . '' is not harmful . knuckle `` cracking '' ha not been shown harmful beneficial . more specifically knuckle cracking doe not cause arthritis . joint `` cracking '' can result from negative pressure pulling nitrogen gas temporarily joint such knuckle `` cracked . '' is not harmful . 15.10.202029.12.2020 contrary popular belief cracking knuckle doe n't actually contribute development arthritis . however is potential ... 13.08.2018 according dr. klapper knuckle cracking itself doe no harm finger neck ankle other joint that pop crack throughout ... 14.05.2018 cracking knuckle is probably harmless . although have been occasional report dislocation tendon injury from overly vigorous ... no definitive link between knuckle cracking arthritis any other medical condition . some study imply knuckle cracking may lead some hand ... 14.03.2019 according research cracking knuckle is n't harmful . it doe n't cause arthritis make knuckle larger it can distracting ... 26.01.2021 it affect joint ... although cracking knuckle regularly can relatively harmless it can also cause damage it 's done ... 04.06.2022 cracking knuckle is rarely harmful on occasion even knuckle crack can done wrong lead pain inflammation maybe even ... 11.01.2019 many people crack knuckle toe back especially finger . snapping popping sound can cause within earshot ... 12.04.2017 found no evidence that finger puller popper more likely suffer from arthritis than do n't crack knuckle . ...,631000.0
banana grow upside down,True,,9 jun 2016 banana grow right side up . hung upside down because it 's easier have from stem end weight thus pull upside ... 2 mar 2020 heck did banana always start growing upside down book enoch chapter 80 verse 3 3. time fruit earth ... doe banana grow upside down - youtubehttps//www.youtube.com watchhttps//www.youtube.com watch18 oct 2010 banana do n't grow on tree banana tree actually giant herb . trunk formed from layer leaf that wrap onto themselves.did know banana grow upside down against gravity . banana start growing hang downwards like any other fruit . grow ... yes banana grow bunch hanging from tree upside down . 6gr8kids 3y ago . live . point point 83. rating . similar question .,567000.0
greenland is largest island world,True,greenland is officially world 's largest island that is not continent . home 56000 people greenland ha it own extensive local government it is also part realm denmark . greenland is officially world 's largest island that is not continent . home 56000 people greenland ha it own extensive local government it is also part realm denmark .,greenland 836330 sq miles/2166086 sq km new guinea 317150 sq miles/821400 sq km borneo 288869 sq miles/748168 sq km madagascar 226756 sq mile ... new guineaborneomadagascarbaffin islandsumatrahonshu islandvictoria islandgreat britainellesmere islandsep 17 2010 australia maybe greenland is world largest island . while australia is island it is considered continent . greenland ha area ... aug 23 2021 greenland is biggest island on list . another visualization garcia explores size same island population density ... islandlocation political affiliationsq . misq . kmgreenlandnorth atlantic danish8399992175597baffin islandnorth atlantic canadian195926507451sumatranortheast indian ocean indonesian182859473605view 30 more rowsgreenland is described `` world 's largest island '' variety encyclopaedia . doe australia 's status continent negate fact that it is `` ... may 31 2021 greenland is world 's largest island . total land area greenland is 2.16 million sq . km though includes some small ...,19800000.0
human lose more than 80 heat from foot,False,,dec 17 2008 experiment had been performed with people wearing only swimming trunk would have lost no more than 10 body heat ... idea that heat loss occurs primarily through head is old wife tale say expert wilderness medicine.feb 1 2013 despite myth that people lose up half body heat through head we actually lose far le than that.jan 18 2016 true false 80 body heat is lost from head . ... duh uncovered head lost more heat than rest bodies.jan 15 2019 therefore it 's probably more correct say that about 10 body heat is lost through headand that 's entire body were ... dec 3 2021 one more bit information child tend lose higher percentage body heat through head . reason compared adult ... mar 31 2013 're no more likely lose heat from head than other part body except hand foot . taylor mackenzie.jul 8 2013 over year physiologist have tested theory about people get cold with help various crew human guinea pig from hardy ... cold hand freezing foot blue finger understand body work it cold . ... for more than 20 year therm-ic ha been working on heat ... dm savastano 2009 cited 213 third obese individual may lose smaller fraction metabolic heat because core temperature triggering vasoconstriction is greater obesity 10 ...,12700000.0
washington dc is capital france .,False,,diese seite bersetzen washington d.c. formally district columbia also known just washington simply d.c. is capital city federal district united ... established french capital a.d. 987 hughes capet . capital - time difference utc+1 6 hour ahead washington dc during standard time note applies ... washington wa established capital united state result compromise following seven year negotiation member u.s .... wa paris chosen capital france ... we tried do that here u country expanded washington dc is no longer center.09.02.2022 washington d.c .. since u.s. congress wa established constitution 1789 it ha ... paris is capital france. . washington d.c is capital americacapitals - c `` france '' = '' paris '' `` united kingdom '' = '' london '' `` usa '' = '' washington dc '' `` kenya '' = '' nairobi '' for seq1 lengthcapitals capital ... nickname nation 's capital statehood washington d.c. is n't state ... some visitor another famous capital paris capital city france.like many other element new nation even most basic feature capital city were unsettled . president washington first took office new ...,51900000.0
monkey wa first non-human go space,False,,chimpanzee have also flown . on 4 june 1949 albert ii became first monkey space died on reentry parachute capsule failed . two other monkey albert iii iv also died rocket failed . mouse wa launched space on 15 august 1950 did not survive return journey . chimpanzee have also flown . on 4 june 1949 albert ii became first monkey space died on reentry parachute capsule failed . two other monkey albert iii iv also died rocket failed . mouse wa launched space on 15 august 1950 did not survive return journey . animal space originally served test survivability spaceflight wide variety animal have been launched space including monkey ape ... 2022/01/27 first animal space wa not laika despite fame . ... first mammal reach space wa rhesus monkey named albert ii ... 2022/06/12 able baker were first monkey survive spaceflight . went space on may 28 1959 aboard jupiter-irbm am-18 from ... 2015/04/29 though far le famous than later non-human astronaut first animal space were group fruit fly launched altitude ... laika wa first we also sent these dog monkey other animal were sent space decade ago test whether it wa safe.the first animal space helped pave way for human follow . from fruit fly dog discover animal astronaut that pioneered space travel.while human space travel wa becoming safer thus more popular it did not put complete halt primate experiment space . large squirrel monkey ... 2014/04/03 before human actually went space one prevailing ... fair amount press first monkey live through space flight .,34900000.0
